ID,Type,SKU,Name,Published,"Is featured?","Visibility in catalog","Short description",Description,"Date sale price starts","Date sale price ends","Tax status","Tax class","In stock?",Stock,"Low stock amount","Backorders allowed?","Sold individually?","Weight (kg)","Length (cm)","Width (cm)","Height (cm)","Allow customer reviews?","Purchase note","Sale price","Regular price",Categories,Tags,"Shipping class",Images,"Download limit","Download expiry days",Parent,"Grouped products",Upsells,Cross-sells,"External URL","Button text",Position,"Attribute 1 name","Attribute 1 value(s)","Attribute 1 visible","Attribute 1 global"
36112,simple,,"Vertical Normal Lab Freeze Dryer YR05190",1,0,visible,"<strong>Manufacturer</strong>: <em>Kalstein</em>\n\n<img class=""alignnone size-full wp-image-29188"" src=""https://kalstein.net/en/wp-content/uploads/2022/01/CE.jpg"" alt="""" width=""54"" height=""53"" />","standard type vacuum freeze dryer is suitable for experiment in laboratory. Freeze dryer is widely used in medicine, pharmacy, biology research, chemical industry and food production ,etc. After the freeze drying process, a long term preservation for products is much easier. They can be restored to the original state and maintain their chemical and biological characteristics after being watered.The vacuum freeze drying technology, which is also called sublimation drying, is a technical method that freezes samples in advance, and then sublimates its moisture in vacuum state.\n<h6>Features</h6>\n<ul>\n 	<li>CFC Free refrigeration</li>\n 	<li>LCD display drying curves, English interface</li>\n 	<li>Big opening of condenser, condenser with pre-freezing function</li>\n 	<li>Low noise compressor, good efficiency,long service life</li>\n 	<li>Condenser and operation panel are all stainless steel</li>\n 	<li>Drying Chamber with organic glass is safe and visible</li>\n 	<li>Shelf and tray are stainless steel, tray spacing can be customized</li>\n 	<li>Small volume , easy and convenient operation</li>\n 	<li>Nitrogen valve is optional</li>\n 	<li>Eutectic point test device is optional</li>\n 	<li>Communication interface is optional</li>\n 	<li>Cascade refrigeration is optional , applied for -80℃ device</li>\n</ul>\n<h6>Technical Description</h6>\n<table width=""582"">\n<tbody>\n<tr class=""firstRow"">\n<td width=""308""><strong>Model</strong></td>\n<td width=""274""><strong>YR05190</strong></td>\n</tr>\n<tr>\n<td width=""308""><strong>Freeze drying area</strong></td>\n<td width=""274"">0.12㎡</td>\n</tr>\n<tr>\n<td width=""308""><strong>Condenser capacity</strong></td>\n<td width=""274"">3-4 L /24h</td>\n</tr>\n<tr>\n<td width=""308""><strong>Condenser temperature</strong></td>\n<td width=""274"">-55℃ (-80 ℃ optional )</td>\n</tr>\n<tr>\n<td width=""308""><strong> Vacuum degree</strong></td>\n<td width=""274"">&lt; 10 Pa</td>\n</tr>\n<tr>\n<td width=""308""><strong>Material tray</strong></td>\n<td width=""274"">Ф200mm , 4 layers</td>\n</tr>\n<tr>\n<td width=""308""><strong>Bulk capacity</strong></td>\n<td width=""274"">1.2L, 10mm thickness</td>\n</tr>\n<tr>\n<td width=""308""><strong>Vial capacity Φ12mm</strong></td>\n<td width=""274"">920 pcs</td>\n</tr>\n<tr>\n<td width=""308""><strong>Vial capacity Φ16mm</strong></td>\n<td width=""274"">480 pcs</td>\n</tr>\n<tr>\n<td width=""308""><strong>Vial capacity Φ22mm</strong></td>\n<td width=""274"">260 pcs</td>\n</tr>\n<tr>\n<td width=""308""><strong>Cooling</strong></td>\n<td width=""274"">Air, draughty, ambient   temperature≤25℃</td>\n</tr>\n<tr>\n<td width=""308""><strong>Voltage</strong></td>\n<td width=""274"">220V, 50Hz</td>\n</tr>\n<tr>\n<td width=""308""><strong>Host dimension</strong></td>\n<td width=""274"">556×460×(720+430) mm</td>\n</tr>\n<tr>\n<td width=""308""><strong>Power</strong></td>\n<td width=""274"">750W</td>\n</tr>\n<tr>\n<td width=""308""><strong>Host weight</strong></td>\n<td width=""274"">62 kg</td>\n</tr>\n</tbody>\n</table>\n&nbsp;",,,taxable,,1,,,0,0,199.00,77.5,69,120,0,,,"4165,92","Laboratory sector > Freeze Dryer > Vertical Laboratory Freeze Dryer",,,"https://kalstein.net/en/wp-content/uploads/2022/08/YR05190-Kalstein.jpg, https://kalstein.net/en/wp-content/uploads/2022/08/YR05190-1-IMG.jpg, https://kalstein.net/en/wp-content/uploads/2022/08/YR05190-2-IMG.jpg, https://kalstein.net/en/wp-content/uploads/2022/08/YR05190-3-IMG.jpg",,,,,,,,,0,,,,
36114,simple,,"T Type Vertical Lab Freeze Dryer YR05193-1",1,0,visible,"<strong>Manufacturer</strong>: <em>Kalstein</em>\n\n<img class=""alignnone size-full wp-image-29188"" src=""https://kalstein.net/en/wp-content/uploads/2022/01/CE.jpg"" alt="""" width=""54"" height=""53"" />","<article>Freeze dryer is widely used in medicine, pharmacy, biology research, chemical industry and food production etc. After the freeze drying process,a long term preservation for products is much easier. They can be restored to the original state and maintain their chemical and biological characteristics after being watered.The vacuum freezing drying techinology, which is also called sublimation drying, is a technical method that freezes the samples in advance, and then sublimates its moisture in the vacuum state.\n<h6>Features</h6>\n<ul>\n 	<li>CFC Free refrigeration</li>\n 	<li>LCD display drying curves, English interface</li>\n 	<li>Opening of condenser, condenser with pre-freezing function</li>\n 	<li>Low noise compressor, good efficiency,long service life</li>\n 	<li>Condenser and operation panel are all stainless steel</li>\n 	<li>Drying Chamber with organic glass is safe and visible</li>\n 	<li>Shelf and tray are stainless steel, tray spacing can be customized</li>\n 	<li>Small volume , easy and convenient operation</li>\n 	<li>Nitrogen valve is optional</li>\n 	<li>Eutectic point test device is optional</li>\n 	<li>Communication interface is optional</li>\n 	<li>Cascade refrigeration is optional , applied for -80℃ device</li>\n</ul>\n<h6>Technical Specifications</h6>\n<table width=""402"">\n<tbody>\n<tr>\n<td width=""197""><strong>Model</strong></td>\n<td width=""205""><strong>YR05193-1</strong></td>\n</tr>\n<tr>\n<td width=""197""><strong>Condenser capacity</strong></td>\n<td width=""205"">3 kg /24h</td>\n</tr>\n<tr>\n<td width=""197""><strong>Condenser temperature</strong></td>\n<td width=""205"">-55℃ (-80 ℃ optional )</td>\n</tr>\n<tr>\n<td width=""197""><strong> Vacuum degree</strong></td>\n<td width=""205"">&lt; 10 Pa</td>\n</tr>\n<tr>\n<td rowspan=""2"" width=""197""><strong>Rubber sealed valve</strong></td>\n<td width=""205"">24 pcs, for 24 ampule</td>\n</tr>\n<tr>\n<td width=""205"">special requirement customized</td>\n</tr>\n<tr>\n<td width=""197""><strong>Cooling</strong></td>\n<td width=""205""> Air，draughty, ambient temperature≤25℃</td>\n</tr>\n<tr>\n<td width=""197""><strong>Vacuum pump flow rate</strong></td>\n<td width=""205"">2 L/S, 7.2 m3/h</td>\n</tr>\n<tr>\n<td width=""197""><strong>Voltage</strong></td>\n<td width=""205""> 220V ,50 Hz</td>\n</tr>\n<tr>\n<td width=""197""><strong>Power</strong></td>\n<td width=""205"">750  W</td>\n</tr>\n<tr>\n<td width=""197""><strong>Host dimension</strong></td>\n<td width=""205"">560×460×(720+440) mm</td>\n</tr>\n<tr>\n<td width=""197""><strong>Host Weight</strong></td>\n<td width=""205"">62 kg</td>\n</tr>\n</tbody>\n</table>\n&nbsp;\n\n&nbsp;\n\n&nbsp;\n\n</article>",,,taxable,,1,,,0,0,201.00,120,69,77,0,,,"6098,40","Laboratory sector > Freeze Dryer > Vertical Laboratory Freeze Dryer",,,"https://kalstein.net/en/wp-content/uploads/2022/08/YR05193-1-img1.png, https://kalstein.net/en/wp-content/uploads/2022/08/YR05193-1-img2.png, https://kalstein.net/en/wp-content/uploads/2022/08/YR05193-1-img3.png, https://kalstein.net/en/wp-content/uploads/2022/08/YR05193-1-img4.png, https://kalstein.net/en/wp-content/uploads/2022/08/YR05193-1-img5.png",,,,,,,,,0,,,,
36115,simple,,"T Type Lab Freeze Dryer YR05197-1",1,0,visible,"<strong>Manufacturer</strong>: <em>Kalstein</em>\n\n<img class=""alignnone size-full wp-image-29188"" src=""https://kalstein.net/en/wp-content/uploads/2022/01/CE.jpg"" alt="""" width=""54"" height=""53"" />","YR05197-1 Freeze Dryer is suitable for the preservation of bacteria, fungi and other microbial strains in the ampoule tube. The ampule sealing method is often used in the laboratory. The samples are sealed in small ampoules after freeze drying. It has the advantages of long preservation period, small variation, ease of large-scale preservation and wide applications.\n<h6>Description</h6>\nYR05197-1 lyophilizer has 24pcs of standard rubber sealing valves and 24 ampules can be mounted. Special requirements can be customized. It is suitable for the preservation of bacteria, fungi and other microbial strains in the ampoule tube. The ampule sealing method is often used in the laboratory. The samples are sealed in small ampoules after freeze drying. It has the advantages of long preservation period, small variation, ease of large-scale preservation and wide applications.\n<h6>Features</h6>\n<ul>\n 	<li>All-in-one structure , small size, no external flange, easy to use, no leakage.</li>\n 	<li>All materials in contact with the product use inert materials to meet the requirements of the GLP.</li>\n 	<li>The cold trap and console are made of stainless steel, which is anti-corrosion and easy to clean.</li>\n 	<li>All stainless steel inflated /water release valve is designed and produced by our company, which is safety, anti- corrosion, no leakage.</li>\n 	<li>with sample pre-frozen function, large cold trap opening, no inner coil,and low temperature refrigerator is needless.</li>\n 	<li>Patented gas diversion technology, and strong ice holding ability.</li>\n 	<li>World- known  brand compressors, high efficiency, long life, low noise.</li>\n 	<li>Well-known brand vacuum pump with a high pumping speed to achieve a higher ultimate vacuum.</li>\n 	<li>Vacuum pump protection function can set the cold trap temperature to protect the vacuum pump life.</li>\n 	<li>Professionally designed FD-LAB freeze-drying machine control system + SH-HPSC-I modular controller with high reliability and stability.</li>\n 	<li>Intelligent data recording system can real-time record and display the cold trap temperature curve, sample temperature curve, vacuum curve.</li>\n</ul>\n<h6>Technical Description</h6>\n<table width=""358"">\n<tbody>\n<tr>\n<td width=""169""><strong>Model</strong></td>\n<td width=""189""><strong>YR05197-1</strong></td>\n</tr>\n<tr>\n<td width=""169""><strong>Ampule   numbers</strong></td>\n<td width=""189"">24pcs</td>\n</tr>\n<tr>\n<td width=""169""><strong>Cold   trap temp.</strong></td>\n<td width=""189"">≤-60℃，optional≤-80℃</td>\n</tr>\n<tr>\n<td width=""169""><strong>Cold   trap depth</strong></td>\n<td width=""189"">400mm</td>\n</tr>\n<tr>\n<td width=""169""><strong>Cold   trap dia</strong></td>\n<td width=""189"">Ф270mm</td>\n</tr>\n<tr>\n<td width=""169""><strong>Ice   collectiong capacity</strong></td>\n<td width=""189"">6kg/24h</td>\n</tr>\n<tr>\n<td width=""169""><strong>Pumping   speed</strong></td>\n<td width=""189"">4L/S</td>\n</tr>\n<tr>\n<td width=""169""><strong>Ultimate   speed</strong></td>\n<td width=""189"">≤5pa</td>\n</tr>\n<tr>\n<td width=""169""><strong>Power</strong></td>\n<td width=""189"">1400w</td>\n</tr>\n<tr>\n<td width=""169""><strong>Main   unit weight</strong></td>\n<td width=""189"">105kg</td>\n</tr>\n<tr>\n<td width=""169""><strong>Main   unit dimension</strong></td>\n<td width=""189"">630×580×970mm</td>\n</tr>\n<tr>\n<td width=""169""><strong>-80℃ main unit dimensions</strong></td>\n<td width=""189"">810×580×950mm</td>\n</tr>\n<tr>\n<td width=""169""><strong>T   fram sizes</strong></td>\n<td width=""189"">430×480mm（H *L）</td>\n</tr>\n<tr>\n<td width=""169""><strong>Flask   frame sizes</strong></td>\n<td width=""189"">610×600mm（H *L）</td>\n</tr>\n<tr>\n<td width=""169""><strong>Cooling   mode</strong></td>\n<td width=""189"">wind   cooled</td>\n</tr>\n<tr>\n<td width=""169""><strong>Defrosting   mode</strong></td>\n<td width=""189"">by   air</td>\n</tr>\n</tbody>\n</table>\n&nbsp;",,,taxable,,1,,,0,0,200.00,120,69,77,0,,,"8118,00","Laboratory sector > Freeze Dryer > Vertical Laboratory Freeze Dryer",,,"https://kalstein.net/en/wp-content/uploads/2022/08/YR05197-1-img2.png, https://kalstein.net/en/wp-content/uploads/2022/08/YR05197-1-img1.png, https://kalstein.net/en/wp-content/uploads/2022/08/YR05197-1-img3.png, https://kalstein.net/en/wp-content/uploads/2022/08/YR05197-1-img4.png",,,,,,,,,0,,,,
78102,variable,,"Vertical Laboratory Freeze Dryer YR05191 // YR05193",1,0,visible,"<strong>Manufacturer</strong>: <em>Kalstein</em>\n\n<img class=""alignnone size-full wp-image-29784 lazyloaded"" src=""https://eibf7xhmv73.exactdn.com/en/wp-content/uploads/2022/04/CE.jpg?strip=all&amp;lossy=1&amp;ssl=1"" alt="""" width=""54"" height=""53"" data-src=""https://eibf7xhmv73.exactdn.com/en/wp-content/uploads/2022/04/CE.jpg?strip=all&amp;lossy=1&amp;ssl=1"" data-eio-rwidth=""54"" data-eio-rheight=""53"" />","Laboratory vacuum freeze dryer is widely used in medicine, pharmaceutical, biological research, chemical and food. The lyophilized articles are easy to store for a long time, and can be restored to the state before lyophilization and maintain the original biochemical characteristics after adding water. The freeze dryer is suitable for laboratory use and meets the requirements of routine lyophilization in most laboratories.\n<h6>Features</h6>\n<ul>\n 	<li>Warning System when operating</li>\n 	<li>7 Inch Touch Screen</li>\n 	<li>Stainless steel cold trap and operating table</li>\n 	<li>A large opening cold trap with pre-freezing function</li>\n 	<li>Cold Trap Electric Defrost</li>\n 	<li>Flexible switching of vacuum units (Pa, mBar, etc.)</li>\n 	<li>Vacuum pump protection function with set the vacuum pump to start the cold trap temperature.</li>\n</ul>\n<h6>Technical Specifications</h6>\n<table dir=""ltr"" border=""1"" cellspacing=""0"" cellpadding=""0""><colgroup> <col width=""165"" /> <col width=""127"" /> <col width=""129"" /> <col width=""134"" /></colgroup>\n<tbody>\n<tr>\n<td data-sheets-value=""{&quot;1&quot;:2,&quot;2&quot;:&quot;Model&quot;}"">Model</td>\n<td data-sheets-value=""{&quot;1&quot;:2,&quot;2&quot;:&quot;YR05191&quot;}"">YR05191</td>\n<td data-sheets-value=""{&quot;1&quot;:2,&quot;2&quot;:&quot;YR05192&quot;}"">YR05192</td>\n<td data-sheets-value=""{&quot;1&quot;:2,&quot;2&quot;:&quot;YR05193&quot;}"">YR05193</td>\n</tr>\n<tr>\n<td data-sheets-value=""{&quot;1&quot;:2,&quot;2&quot;:&quot;Freeze-dried area&quot;}"">Freeze-dried area</td>\n<td data-sheets-value=""{&quot;1&quot;:2,&quot;2&quot;:&quot;0.08m²&quot;}"">0.08m²</td>\n<td data-sheets-value=""{&quot;1&quot;:2,&quot;2&quot;:&quot;0.12m²&quot;}"">0.12m²</td>\n<td data-sheets-value=""{&quot;1&quot;:2,&quot;2&quot;:&quot;0.08m²&quot;}"">0.08m²</td>\n</tr>\n<tr>\n<td data-sheets-value=""{&quot;1&quot;:2,&quot;2&quot;:&quot;Panel material (material thickness 10mm)&quot;}"">Panel material (material thickness 10mm)</td>\n<td data-sheets-value=""{&quot;1&quot;:2,&quot;2&quot;:&quot;0.8L&quot;}"">0.8L</td>\n<td data-sheets-value=""{&quot;1&quot;:2,&quot;2&quot;:&quot;1.2L&quot;}"">1.2L</td>\n<td data-sheets-value=""{&quot;1&quot;:2,&quot;2&quot;:&quot;0.8L&quot;}"">0.8L</td>\n</tr>\n<tr>\n<td data-sheets-value=""{&quot;1&quot;:2,&quot;2&quot;:&quot;Material Tray&quot;}"">Material Tray</td>\n<td data-sheets-value=""{&quot;1&quot;:2,&quot;2&quot;:&quot;Ф180mm\r\\n3 layers&quot;}"">Ф180mm\n3 layers</td>\n<td data-sheets-value=""{&quot;1&quot;:2,&quot;2&quot;:&quot;Ф200mm\r\\n4 layers&quot;}"">Ф200mm\n4 layers</td>\n<td data-sheets-value=""{&quot;1&quot;:2,&quot;2&quot;:&quot;Ф180mm\r\\n3 layers&quot;}"">Ф180mm\n3 layers</td>\n</tr>\n<tr>\n<td data-sheets-value=""{&quot;1&quot;:2,&quot;2&quot;:&quot;Material plate spacing&quot;}"">Material plate spacing</td>\n<td colspan=""3"" rowspan=""1"" data-sheets-value=""{&quot;1&quot;:2,&quot;2&quot;:&quot;70mm&quot;}"">70mm</td>\n</tr>\n<tr>\n<td data-sheets-value=""{&quot;1&quot;:2,&quot;2&quot;:&quot;Cold trap temperature&quot;}"">Cold trap temperature</td>\n<td colspan=""3"" rowspan=""1"" data-sheets-value=""{&quot;1&quot;:2,&quot;2&quot;:&quot;≤ -56°C (no load), optional ≤ -80°C (no load)&quot;}"">≤ -56°C (no load), optional ≤ -80°C (no load)</td>\n</tr>\n<tr>\n<td data-sheets-value=""{&quot;1&quot;:2,&quot;2&quot;:&quot;Water catching capacity&quot;}"">Water catching capacity</td>\n<td colspan=""3"" rowspan=""1"" data-sheets-value=""{&quot;1&quot;:2,&quot;2&quot;:&quot;3-4kg/24h&quot;}"">3-4kg/24h</td>\n</tr>\n<tr>\n<td data-sheets-value=""{&quot;1&quot;:2,&quot;2&quot;:&quot;Ultimate vacuum&quot;}"">Ultimate vacuum</td>\n<td colspan=""3"" rowspan=""1"" data-sheets-value=""{&quot;1&quot;:2,&quot;2&quot;:&quot;≤ 5pa (no load)&quot;}"">≤ 5pa (no load)</td>\n</tr>\n<tr>\n<td data-sheets-value=""{&quot;1&quot;:2,&quot;2&quot;:&quot;Power&quot;}"">Power</td>\n<td colspan=""3"" rowspan=""1"" data-sheets-value=""{&quot;1&quot;:2,&quot;2&quot;:&quot;970 W&quot;}"">970 W</td>\n</tr>\n<tr>\n<td data-sheets-value=""{&quot;1&quot;:2,&quot;2&quot;:&quot;Host Weight&quot;}"">Host Weight</td>\n<td colspan=""3"" rowspan=""1"" data-sheets-value=""{&quot;1&quot;:2,&quot;2&quot;:&quot;62 KG&quot;}"">62 KG</td>\n</tr>\n<tr>\n<td data-sheets-value=""{&quot;1&quot;:2,&quot;2&quot;:&quot;Mainframe Dimensions&quot;}"">Mainframe Dimensions</td>\n<td data-sheets-value=""{&quot;1&quot;:2,&quot;2&quot;:&quot;580×500×1210mm&quot;}"">580×500×1210mm</td>\n<td data-sheets-value=""{&quot;1&quot;:2,&quot;2&quot;:&quot;580×500×1185mm&quot;}"">580×500×1185mm</td>\n<td data-sheets-value=""{&quot;1&quot;:2,&quot;2&quot;:&quot;580×500×1260mm&quot;}"">580×500×1260mm</td>\n</tr>\n</tbody>\n</table>",,,taxable,,1,,,0,0,,,,,0,,,,"Laboratory sector > Freeze Dryer > Vertical Laboratory Freeze Dryer",,,https://kalstein.net/en/wp-content/uploads/2023/08/YR05191-YR05193.jpg,,,,,,,,,0,Model,"YR05191, YR05192, YR05193",1,1
78334,variable,,"Vertical Laboratory Freeze Dryer YR05194 // YR05197",1,0,visible,"<strong>Manufacturer</strong>: <em>Kalstein</em>\n\n<img class=""alignnone size-full wp-image-29784 lazyloaded"" src=""https://eibf7xhmv73.exactdn.com/en/wp-content/uploads/2022/04/CE.jpg?strip=all&amp;lossy=1&amp;ssl=1"" alt="""" width=""54"" height=""53"" data-src=""https://eibf7xhmv73.exactdn.com/en/wp-content/uploads/2022/04/CE.jpg?strip=all&amp;lossy=1&amp;ssl=1"" data-eio-rwidth=""54"" data-eio-rheight=""53"" />","Laboratory vacuum freeze dryer is widely used in medicine, pharmaceutical, biological research, chemical and food. The lyophilized articles are easy to store for a long time, and can be restored to the state before lyophilization and maintain the original biochemical characteristics after adding water. The freeze dryer is suitable for laboratory use and meets the requirements of routine lyophilization in most laboratories.\n<h6>Features</h6>\n<ul>\n 	<li>Warning System when operating</li>\n 	<li>7 Inch Touch Screen</li>\n 	<li>Stainless steel cold trap and operating table</li>\n 	<li>A large opening cold trap with pre-freezing function</li>\n 	<li>Cold Trap Electric Defrost</li>\n 	<li>Flexible switching of vacuum units (Pa, mBar, etc.)</li>\n 	<li>Vacuum pump protection function with set the vacuum pump to start the cold trap temperature.</li>\n</ul>\n<h6>Technical Specifications</h6>\n<table dir=""ltr"" border=""1"" cellspacing=""0"" cellpadding=""0""><colgroup><col width=""156"" /><col width=""120"" /><col width=""121"" /><col width=""120"" /><col width=""121"" /></colgroup>\n<tbody>\n<tr>\n<td data-sheets-value=""{&quot;1&quot;:2,&quot;2&quot;:&quot;Model&quot;}"">Model</td>\n<td data-sheets-value=""{&quot;1&quot;:2,&quot;2&quot;:&quot;YR05194&quot;}"">YR05194</td>\n<td data-sheets-value=""{&quot;1&quot;:2,&quot;2&quot;:&quot;YR05195&quot;}"">YR05195</td>\n<td data-sheets-value=""{&quot;1&quot;:2,&quot;2&quot;:&quot;YR05196&quot;}"">YR05196</td>\n<td data-sheets-value=""{&quot;1&quot;:2,&quot;2&quot;:&quot;YR05197&quot;}"">YR05197</td>\n</tr>\n<tr>\n<td data-sheets-value=""{&quot;1&quot;:2,&quot;2&quot;:&quot;Freeze-dried area&quot;}"">Freeze-dried area</td>\n<td data-sheets-value=""{&quot;1&quot;:2,&quot;2&quot;:&quot;0.18m²/0.27m²&quot;}"">0.18m²/0.27m²</td>\n<td data-sheets-value=""{&quot;1&quot;:2,&quot;2&quot;:&quot;0.09m²&quot;}"">0.09m²</td>\n<td data-sheets-value=""{&quot;1&quot;:2,&quot;2&quot;:&quot;0.18m²/0.27m²&quot;}"">0.18m²/0.27m²</td>\n<td data-sheets-value=""{&quot;1&quot;:2,&quot;2&quot;:&quot;0.09m²&quot;}"">0.09m²</td>\n</tr>\n<tr>\n<td data-sheets-value=""{&quot;1&quot;:2,&quot;2&quot;:&quot;Panel material (material thickness 10mm)&quot;}"">Panel material (material thickness 10mm)</td>\n<td data-sheets-value=""{&quot;1&quot;:2,&quot;2&quot;:&quot;1.8L/2.7L&quot;}"">1.8L/2.7L</td>\n<td data-sheets-value=""{&quot;1&quot;:2,&quot;2&quot;:&quot;0.9L&quot;}"">0.9L</td>\n<td data-sheets-value=""{&quot;1&quot;:2,&quot;2&quot;:&quot;1.8L/2.7L&quot;}"">1.8L/2.7L</td>\n<td data-sheets-value=""{&quot;1&quot;:2,&quot;2&quot;:&quot;0.9L&quot;}"">0.9L</td>\n</tr>\n<tr>\n<td data-sheets-value=""{&quot;1&quot;:2,&quot;2&quot;:&quot;Material Tray&quot;}"">Material Tray</td>\n<td data-sheets-value=""{&quot;1&quot;:2,&quot;2&quot;:&quot;Ф240mm\r\\n4/6 layers&quot;}"">Ф240mm\n4/6 layers</td>\n<td data-sheets-value=""{&quot;1&quot;:2,&quot;2&quot;:&quot;Ф200mm\r\\n3 layers&quot;}"">Ф200mm\n3 layers</td>\n<td data-sheets-value=""{&quot;1&quot;:2,&quot;2&quot;:&quot;Ф240mm\r\\n4/6 layers&quot;}"">Ф240mm\n4/6 layers</td>\n<td data-sheets-value=""{&quot;1&quot;:2,&quot;2&quot;:&quot;Ф200mm\r\\n3 layers&quot;}"">Ф200mm\n3 layers</td>\n</tr>\n<tr>\n<td data-sheets-value=""{&quot;1&quot;:2,&quot;2&quot;:&quot;Material plate spacing&quot;}"">Material plate spacing</td>\n<td colspan=""4"" rowspan=""1"" data-sheets-value=""{&quot;1&quot;:2,&quot;2&quot;:&quot;70mm&quot;}"">70mm</td>\n</tr>\n<tr>\n<td data-sheets-value=""{&quot;1&quot;:2,&quot;2&quot;:&quot;Cold trap temperature&quot;}"">Cold trap temperature</td>\n<td colspan=""4"" rowspan=""1"" data-sheets-value=""{&quot;1&quot;:2,&quot;2&quot;:&quot;≤ -56 ° C (no load), optional ≤ -80 ° C (no load)&quot;}"">≤ -56 ° C (no load), optional ≤ -80 ° C (no load)</td>\n</tr>\n<tr>\n<td data-sheets-value=""{&quot;1&quot;:2,&quot;2&quot;:&quot;Water catching capacity&quot;}"">Water catching capacity</td>\n<td colspan=""4"" rowspan=""1"" data-sheets-value=""{&quot;1&quot;:2,&quot;2&quot;:&quot;6 kg/24h&quot;}"">6 kg/24h</td>\n</tr>\n<tr>\n<td data-sheets-value=""{&quot;1&quot;:2,&quot;2&quot;:&quot;Ultimate vacuum&quot;}"">Ultimate vacuum</td>\n<td colspan=""4"" rowspan=""1"" data-sheets-value=""{&quot;1&quot;:2,&quot;2&quot;:&quot;≤ 5pa (no load)&quot;}"">≤ 5pa (no load)</td>\n</tr>\n<tr>\n<td data-sheets-value=""{&quot;1&quot;:2,&quot;2&quot;:&quot;Power&quot;}"">Power</td>\n<td colspan=""4"" rowspan=""1"" data-sheets-value=""{&quot;1&quot;:2,&quot;2&quot;:&quot;1400 W&quot;}"">1400 W</td>\n</tr>\n<tr>\n<td data-sheets-value=""{&quot;1&quot;:2,&quot;2&quot;:&quot;Host Weight&quot;}"">Host Weight</td>\n<td colspan=""4"" rowspan=""1"" data-sheets-value=""{&quot;1&quot;:2,&quot;2&quot;:&quot;105 KG&quot;}"">105 KG</td>\n</tr>\n<tr>\n<td data-sheets-value=""{&quot;1&quot;:2,&quot;2&quot;:&quot;Mainframe Dimensions&quot;}"">Mainframe Dimensions</td>\n<td data-sheets-value=""{&quot;1&quot;:2,&quot;2&quot;:&quot;630×580×1415mm&quot;}"">630×580×1415mm</td>\n<td data-sheets-value=""{&quot;1&quot;:2,&quot;2&quot;:&quot;630×580×1510mm&quot;}"">630×580×1510mm</td>\n<td data-sheets-value=""{&quot;1&quot;:2,&quot;2&quot;:&quot;630×580×1435mm&quot;}"">630×580×1435mm</td>\n<td data-sheets-value=""{&quot;1&quot;:2,&quot;2&quot;:&quot;630×580×1540mm&quot;}"">630×580×1540mm</td>\n</tr>\n</tbody>\n</table>",,,taxable,,1,,,0,0,,,,,0,,,,"Laboratory sector > Freeze Dryer > Vertical Laboratory Freeze Dryer",,,https://kalstein.net/en/wp-content/uploads/2023/08/YR05194-YR05197.jpg,,,,,,,,,0,Model,"YR05194, YR05195, YR05196, YR05197",1,1
