ID,Type,SKU,Name,Published,"Is featured?","Visibility in catalog","Short description",Description,"Date sale price starts","Date sale price ends","Tax status","Tax class","In stock?",Stock,"Low stock amount","Backorders allowed?","Sold individually?","Weight (kg)","Length (cm)","Width (cm)","Height (cm)","Allow customer reviews?","Purchase note","Sale price","Regular price",Categories,Tags,"Shipping class",Images,"Download limit","Download expiry days",Parent,"Grouped products",Upsells,Cross-sells,"External URL","Button text",Position,"Attribute 1 name","Attribute 1 value(s)","Attribute 1 visible","Attribute 1 global"
54470,variable,,"Stainless Steel Electric Water Distiller YR05969 - YR05970",1,0,visible,"<strong>Manufacturer: </strong><em>Kalstein</em>\n\n<img class=""alignnone size-full wp-image-29188"" src=""https://kalstein.net/en/wp-content/uploads/2022/01/CE.jpg"" alt="""" width=""54"" height=""53"" />","Electric distiller water is generally made of high-quality stainless steel, and the heating water is composed of water and pure water, which are divided into 5 liters, 10 liters, and 20 liters according to the water production. The automatic control and ordinary type water cut is according to the water cut mode. According to the water quality, it is divided into single steaming and double steaming.\n\n<strong>Features:</strong>\n<ul>\n 	<li>The machine is made of high quality stainless steel.</li>\n 	<li>Coil-type condensation structure, cooling effect is good, a large amount of water.</li>\n 	<li>Cooling water back into the evaporation bucket, saving water resources.</li>\n 	<li>The drain valve can drain the water in the bucket to improve the fouling conditions.</li>\n 	<li>Copper submerged heating tube, high thermal efficiency, long service life.</li>\n</ul>\n<strong>Technical Description:</strong>\n<table width=""240"">\n<tbody>\n<tr>\n<td width=""80"">Model</td>\n<td width=""80"">YR05969</td>\n<td width=""80"">YR05970</td>\n</tr>\n<tr>\n<td>Voltage</td>\n<td>220V/50Hz</td>\n<td>380V/50Hz</td>\n</tr>\n<tr>\n<td>Features</td>\n<td colspan=""2"">Automatic Electrical</td>\n</tr>\n<tr>\n<td>Power</td>\n<td>4.5kW</td>\n<td>7.5kW</td>\n</tr>\n<tr>\n<td>Water consumption</td>\n<td>≥5L/h</td>\n<td>≥10L/h</td>\n</tr>\n<tr>\n<td>Packaging size (carton)(cm)</td>\n<td>35×26×78cm</td>\n<td>43x30x90cm</td>\n</tr>\n<tr>\n<td>Capacity</td>\n<td>5L/h</td>\n<td>10L/h</td>\n</tr>\n</tbody>\n</table>",,,taxable,,1,,,0,0,,,,,0,,,,"Laboratory sector > Water Distiller > Water Distiller (Single Distillation)",,,https://kalstein.net/en/wp-content/uploads/2022/12/YR05969-YR05970.jpg,,,,,,,,,0,Modelo,"YR05969, YR05970",1,1
54477,simple,,"Electric Stainless Steel 20L Water Distiller YR05971",1,0,visible,"<strong>Manufacturer: </strong><em>Kalstein</em>\n\n<img class=""alignnone size-full wp-image-29188"" src=""https://kalstein.net/en/wp-content/uploads/2022/01/CE.jpg"" alt="""" width=""54"" height=""53"" />","Electric distiller water is generally made of high-quality stainless steel, and the heating water is composed of water and pure water, which are divided into 5 liters, 10 liters, and 20 liters according to the water production. The automatic control and ordinary type water cut is according to the water cut mode. According to the water quality, it is divided into single steaming and double steaming.\n<h6 class=""magic-5""><span data-spm-anchor-id=""a2700.wholesale.0.i37.9cb717abHH2rpm"">Features:</span></h6>\n<div class=""magic-6"">\n<div class=""magic-7"">\n<ul>\n 	<li class=""magic-8"">The machine is made of high quality stainless steel.</li>\n 	<li class=""magic-8"">Coil-type condensation structure, cooling effect is good, a large amount of water.</li>\n 	<li class=""magic-8"">Cooling water back into the evaporation bucket, saving water resources.</li>\n 	<li class=""magic-8"">The drain valve can drain the water in the bucket to improve the fouling conditions.</li>\n 	<li class=""magic-8"">Copper submerged heating tube, high thermal efficiency, long service life.</li>\n</ul>\n<h6>Technical Description:</h6>\n<table width=""249"">\n<tbody>\n<tr style=""font-style: inherit; font-weight: inherit;"">\n<td style=""font-style: inherit;"" width=""80"">\n<p data-spm-anchor-id=""a2700.wholesale.0.i39.9cb717abHH2rpm"">Model</p>\n</td>\n<td width=""169""><span data-sheets-value=""{&quot;1&quot;:2,&quot;2&quot;:&quot;YR05971&quot;}"" data-sheets-userformat=""{&quot;2&quot;:15083,&quot;3&quot;:{&quot;1&quot;:0},&quot;4&quot;:{&quot;1&quot;:2,&quot;2&quot;:16777215},&quot;6&quot;:{&quot;1&quot;:[{&quot;1&quot;:2,&quot;2&quot;:0,&quot;5&quot;:{&quot;1&quot;:2,&quot;2&quot;:0}},{&quot;1&quot;:0,&quot;2&quot;:0,&quot;3&quot;:3},{&quot;1&quot;:1,&quot;2&quot;:0,&quot;4&quot;:1}]},&quot;8&quot;:{&quot;1&quot;:[{&quot;1&quot;:2,&quot;2&quot;:0,&quot;5&quot;:{&quot;1&quot;:2,&quot;2&quot;:0}},{&quot;1&quot;:0,&quot;2&quot;:0,&quot;3&quot;:3},{&quot;1&quot;:1,&quot;2&quot;:0,&quot;4&quot;:1}]},&quot;9&quot;:1,&quot;10&quot;:1,&quot;12&quot;:0,&quot;14&quot;:{&quot;1&quot;:2,&quot;2&quot;:0},&quot;15&quot;:&quot;Arial&quot;,&quot;16&quot;:10}"">YR05971</span></td>\n</tr>\n<tr style=""font-style: inherit; font-weight: inherit;"">\n<td style=""font-style: inherit;"">Voltage</td>\n<td style=""font-style: inherit;"">380V/50Hz</td>\n</tr>\n<tr style=""font-style: inherit; font-weight: inherit;"">\n<td style=""font-style: inherit;"">Features</td>\n<td style=""font-style: inherit;"">Automatic Electrical type</td>\n</tr>\n<tr style=""font-style: inherit; font-weight: inherit;"">\n<td style=""font-style: inherit;"">Power</td>\n<td style=""font-style: inherit;"">15kw</td>\n</tr>\n<tr style=""font-style: inherit; font-weight: inherit;"">\n<td style=""font-style: inherit;"">Water consumption</td>\n<td style=""font-style: inherit;"">≥20L/h</td>\n</tr>\n<tr style=""font-style: inherit; font-weight: inherit;"">\n<td style=""font-style: inherit;"">Dimension(carton)(cm)</td>\n<td style=""font-style: inherit;"">51x36x80</td>\n</tr>\n<tr>\n<td>Capacity</td>\n<td><span data-sheets-value=""{&quot;1&quot;:2,&quot;2&quot;:&quot;20L/h&quot;}"" data-sheets-userformat=""{&quot;2&quot;:15083,&quot;3&quot;:{&quot;1&quot;:0},&quot;4&quot;:{&quot;1&quot;:2,&quot;2&quot;:16777215},&quot;6&quot;:{&quot;1&quot;:[{&quot;1&quot;:2,&quot;2&quot;:0,&quot;5&quot;:{&quot;1&quot;:2,&quot;2&quot;:0}},{&quot;1&quot;:0,&quot;2&quot;:0,&quot;3&quot;:3},{&quot;1&quot;:1,&quot;2&quot;:0,&quot;4&quot;:1}]},&quot;8&quot;:{&quot;1&quot;:[{&quot;1&quot;:2,&quot;2&quot;:0,&quot;5&quot;:{&quot;1&quot;:2,&quot;2&quot;:0}},{&quot;1&quot;:0,&quot;2&quot;:0,&quot;3&quot;:3},{&quot;1&quot;:1,&quot;2&quot;:0,&quot;4&quot;:1}]},&quot;9&quot;:1,&quot;10&quot;:1,&quot;12&quot;:0,&quot;14&quot;:{&quot;1&quot;:2,&quot;2&quot;:0},&quot;15&quot;:&quot;Arial&quot;,&quot;16&quot;:10}"">20L/h</span></td>\n</tr>\n</tbody>\n</table>\n</div>\n</div>",,,taxable,,1,,,0,0,13.5,50,36,80,0,,,"752,40","Laboratory sector > Water Distiller > Water Distiller (Single Distillation)",,,https://kalstein.net/en/wp-content/uploads/2022/12/YR05971-1.jpg,,,,,,,,,0,,,,
54483,variable,,"Automatic Control Water Distiller YR05972 - YR05973",1,0,visible,"<strong>Manufacturer: </strong><em>Kalstein</em>\n\n<img class=""alignnone size-full wp-image-29188"" src=""https://kalstein.net/en/wp-content/uploads/2022/01/CE.jpg"" alt="""" width=""54"" height=""53"" />","Electric distiller water is generally made of high-quality stainless steel, and the heating water is composed of water and pure water, which are divided into 5 liters, 10 liters, and 20 liters according to the water production. The automatic control and ordinary type water cut is according to the water cut mode. According to the water quality, it is divided into single steaming and double steaming.\n<h6>Features:</h6>\n<ul>\n 	<li>The Electric distilled water is made of high-quality stainless steel.</li>\n 	<li>The coil condensing structure has good cooling effect and large water output.</li>\n 	<li>The cooling water returns to the evaporation barrel to save water resources.</li>\n 	<li>The drain valve can drain the concentrated water in the barrel to improve the scaling situation.</li>\n 	<li>The heating power is automatically cut off when the water is lacking, and the heating will continue after the return water is replenished to the working water level.</li>\n 	<li>Copper immersion heating tube has high thermal efficiency and long service life.</li>\n</ul>\n<h6>Technical Description:</h6>\n<table width=""240"">\n<tbody>\n<tr>\n<td width=""80"">Model</td>\n<td width=""80"">YR05972</td>\n<td width=""80"">YR05973</td>\n</tr>\n<tr>\n<td>Applicable power supply</td>\n<td>220V/50Hz</td>\n<td>380V/50Hz</td>\n</tr>\n<tr>\n<td>Features</td>\n<td colspan=""2"">Lack of Water Automatic Control</td>\n</tr>\n<tr>\n<td>Power</td>\n<td>4.5kW</td>\n<td>7.5kW</td>\n</tr>\n<tr>\n<td>Water consumption</td>\n<td>≥5L/h</td>\n<td>≥10L/h</td>\n</tr>\n<tr>\n<td>Packaging size (carton)(cm)</td>\n<td><span data-sheets-value=""{&quot;1&quot;:2,&quot;2&quot;:&quot;35×34×78cm&quot;}"" data-sheets-userformat=""{&quot;2&quot;:12667,&quot;3&quot;:{&quot;1&quot;:0},&quot;4&quot;:{&quot;1&quot;:2,&quot;2&quot;:16777215},&quot;6&quot;:{&quot;1&quot;:[{&quot;1&quot;:2,&quot;2&quot;:0,&quot;5&quot;:{&quot;1&quot;:2,&quot;2&quot;:0}},{&quot;1&quot;:0,&quot;2&quot;:0,&quot;3&quot;:3},{&quot;1&quot;:1,&quot;2&quot;:0,&quot;4&quot;:1}]},&quot;7&quot;:{&quot;1&quot;:[{&quot;1&quot;:2,&quot;2&quot;:0,&quot;5&quot;:{&quot;1&quot;:2,&quot;2&quot;:0}},{&quot;1&quot;:0,&quot;2&quot;:0,&quot;3&quot;:3},{&quot;1&quot;:1,&quot;2&quot;:0,&quot;4&quot;:1}]},&quot;8&quot;:{&quot;1&quot;:[{&quot;1&quot;:2,&quot;2&quot;:0,&quot;5&quot;:{&quot;1&quot;:2,&quot;2&quot;:0}},{&quot;1&quot;:0,&quot;2&quot;:0,&quot;3&quot;:3},{&quot;1&quot;:1,&quot;2&quot;:0,&quot;4&quot;:1}]},&quot;9&quot;:1,&quot;11&quot;:4,&quot;15&quot;:&quot;Calibri&quot;,&quot;16&quot;:11}"">35×34×78cm</span></td>\n<td><span data-sheets-value=""{&quot;1&quot;:2,&quot;2&quot;:&quot;42×38×90cm&quot;}"" data-sheets-userformat=""{&quot;2&quot;:12667,&quot;3&quot;:{&quot;1&quot;:0},&quot;4&quot;:{&quot;1&quot;:2,&quot;2&quot;:16777215},&quot;6&quot;:{&quot;1&quot;:[{&quot;1&quot;:2,&quot;2&quot;:0,&quot;5&quot;:{&quot;1&quot;:2,&quot;2&quot;:0}},{&quot;1&quot;:0,&quot;2&quot;:0,&quot;3&quot;:3},{&quot;1&quot;:1,&quot;2&quot;:0,&quot;4&quot;:1}]},&quot;7&quot;:{&quot;1&quot;:[{&quot;1&quot;:2,&quot;2&quot;:0,&quot;5&quot;:{&quot;1&quot;:2,&quot;2&quot;:0}},{&quot;1&quot;:0,&quot;2&quot;:0,&quot;3&quot;:3},{&quot;1&quot;:1,&quot;2&quot;:0,&quot;4&quot;:1}]},&quot;8&quot;:{&quot;1&quot;:[{&quot;1&quot;:2,&quot;2&quot;:0,&quot;5&quot;:{&quot;1&quot;:2,&quot;2&quot;:0}},{&quot;1&quot;:0,&quot;2&quot;:0,&quot;3&quot;:3},{&quot;1&quot;:1,&quot;2&quot;:0,&quot;4&quot;:1}]},&quot;9&quot;:1,&quot;11&quot;:4,&quot;15&quot;:&quot;Calibri&quot;,&quot;16&quot;:11}"">42×38×90cm</span></td>\n</tr>\n<tr>\n<td>Capacity</td>\n<td>5L/h</td>\n<td>10L/h</td>\n</tr>\n</tbody>\n</table>",,,taxable,,1,,,0,0,,,,,0,,,,"Laboratory sector > Water Distiller > Water Distiller (Single Distillation)",,,https://kalstein.net/en/wp-content/uploads/2022/12/YR05972-YR05973-1.jpg,,,,,,,,,0,Modelo,"YR05972, YR05973",1,1
54489,simple,,"High Quality Automatic Control Water Distiller 20L YR05974",1,0,visible,"<strong>Manufacturer: </strong><em>Kalstein</em>\n\n<img class=""alignnone size-full wp-image-29188"" src=""https://kalstein.net/en/wp-content/uploads/2022/01/CE.jpg"" alt="""" width=""54"" height=""53"" />","Electric distilled water is generally used in high-quality stainless steel, water heating from the water and pure water, according to water production is divided into 5 liters, 10 liters, 20 liters three. According to the water control way to break water automatic control and ordinary type. According to the water quality to separate single steam and double distillation.\n<h6>Features:</h6>\n<ul>\n 	<li>The whole machine is made of high quality stainless steel.</li>\n 	<li>Coil condensing structure, good cooling effect, large amount of water.</li>\n 	<li>Cooling water is returned to the evaporating barrel to save water resources.</li>\n 	<li>The drain valve can discharge concentrated water in the barrel to improve the fouling conditions.</li>\n 	<li>The lack of water automatically cuts off the heating power and continues heating after the return water is replenished to the working water level.</li>\n 	<li>The copper immersed heating tube has high thermal efficiency and long service life.</li>\n</ul>\n<h6>Technical Description:</h6>\n<table width=""313"">\n<tbody>\n<tr>\n<td width=""80"">\n<p data-spm-anchor-id=""a2700.wholesale.0.i39.9cb717abHH2rpm"">Model</p>\n</td>\n<td width=""233"">YR05974</td>\n</tr>\n<tr>\n<td>Voltage</td>\n<td>380V/50Hz</td>\n</tr>\n<tr>\n<td>Features</td>\n<td>Lack of Water Automatic Control</td>\n</tr>\n<tr>\n<td>Power</td>\n<td>15kw</td>\n</tr>\n<tr>\n<td>Water consumption</td>\n<td>≥20L/h</td>\n</tr>\n<tr>\n<td>Dimension(carton)(cm)</td>\n<td>51x36x80</td>\n</tr>\n<tr>\n<td>Capacity</td>\n<td><span data-sheets-value=""{&quot;1&quot;:2,&quot;2&quot;:&quot;20L/h&quot;}"" data-sheets-userformat=""{&quot;2&quot;:15083,&quot;3&quot;:{&quot;1&quot;:0},&quot;4&quot;:{&quot;1&quot;:2,&quot;2&quot;:16777215},&quot;6&quot;:{&quot;1&quot;:[{&quot;1&quot;:2,&quot;2&quot;:0,&quot;5&quot;:{&quot;1&quot;:2,&quot;2&quot;:0}},{&quot;1&quot;:0,&quot;2&quot;:0,&quot;3&quot;:3},{&quot;1&quot;:1,&quot;2&quot;:0,&quot;4&quot;:1}]},&quot;8&quot;:{&quot;1&quot;:[{&quot;1&quot;:2,&quot;2&quot;:0,&quot;5&quot;:{&quot;1&quot;:2,&quot;2&quot;:0}},{&quot;1&quot;:0,&quot;2&quot;:0,&quot;3&quot;:3},{&quot;1&quot;:1,&quot;2&quot;:0,&quot;4&quot;:1}]},&quot;9&quot;:1,&quot;10&quot;:1,&quot;12&quot;:0,&quot;14&quot;:{&quot;1&quot;:2,&quot;2&quot;:0},&quot;15&quot;:&quot;Arial&quot;,&quot;16&quot;:10}"">20L/h</span></td>\n</tr>\n</tbody>\n</table>",,,taxable,,1,,,0,0,13,51,36,80,0,,,"922,68","Laboratory sector > Water Distiller > Water Distiller (Single Distillation)",,,https://kalstein.net/en/wp-content/uploads/2022/12/YR05974-1.jpg,,,,,,,,,0,,,,
54493,variable,,"Stainless steel automatic double distillation water distiller YR05975 // YR05977",1,0,visible,"<strong>Manufacturer: </strong><em>Kalstein</em>\n\n<img class=""alignnone size-full wp-image-29188"" src=""https://kalstein.net/en/wp-content/uploads/2022/01/CE.jpg"" alt="""" width=""54"" height=""53"" />","Electric distiller water is generally made of high-quality stainless steel, and the heating water is composed of water and pure water, which are divided into 5 liters, 10 liters, and 20 liters according to the water production. The automatic control and ordinary type water cut is according to the water cut mode. According to the water quality, it is divided into single steaming and double steaming.\n<h6><span data-spm-anchor-id=""a2700.wholesale.0.i8.6d5913bbBc9pOD"">Performance characteristics:</span></h6>\n<ul>\n 	<li data-spm-anchor-id=""a2700.wholesale.0.i10.6d5913bbBc9pOD""><span data-spm-anchor-id=""a2700.wholesale.0.i11.6d5913bbBc9pOD"">The machine is made of high quality stainless steel.</span></li>\n 	<li>Twin towers, reasonable structure.</li>\n 	<li>Coil-type condensation structure, cooling effect is good, a large amount of water.</li>\n 	<li>Dry water automatically cut off the heating power, to be back to the water after the work to continue to heat.</li>\n 	<li>The initial steam and re-steam level control are set separately.</li>\n 	<li>Copper immersion electric heating tube with high efficiency and long service life.</li>\n</ul>\n<h6>Technical Data:</h6>\n<table width=""370"">\n<tbody>\n<tr>\n<td width=""80"">\n<p data-spm-anchor-id=""a2700.wholesale.0.i39.9cb717abHH2rpm"">Model</p>\n</td>\n<td width=""94"">YR05975</td>\n<td width=""94"">YR05976</td>\n<td width=""102"">YR05977</td>\n</tr>\n<tr>\n<td>Voltage</td>\n<td>380V/50Hz</td>\n<td>380V/50Hz</td>\n<td>380V/50Hz</td>\n</tr>\n<tr>\n<td>Features</td>\n<td colspan=""3"">Automatic Electrical type</td>\n</tr>\n<tr>\n<td>Power</td>\n<td>10kW</td>\n<td width=""94""><span style=""font-weight: inherit;"" data-spm-anchor-id=""a2700.wholesale.0.i15.6d5913bbBc9pOD"">17kW</span></td>\n<td width=""102""><span style=""font-weight: inherit;"" data-spm-anchor-id=""a2700.wholesale.0.i16.6d5913bbBc9pOD"">32kW</span></td>\n</tr>\n<tr>\n<td>Water consumption</td>\n<td width=""94""><span style=""font-weight: inherit;"" data-spm-anchor-id=""a2700.wholesale.0.i17.6d5913bbBc9pOD"">&gt;=5L/H</span></td>\n<td>&gt;=10L/H</td>\n<td>&gt;=20L/H</td>\n</tr>\n<tr>\n<td>Dimension(carton)(cm)</td>\n<td><span data-sheets-value=""{&quot;1&quot;:2,&quot;2&quot;:&quot;45×68×84cm&quot;}"" data-sheets-userformat=""{&quot;2&quot;:12799,&quot;3&quot;:{&quot;1&quot;:0},&quot;4&quot;:{&quot;1&quot;:2,&quot;2&quot;:16777215},&quot;5&quot;:{&quot;1&quot;:[{&quot;1&quot;:2,&quot;2&quot;:0,&quot;5&quot;:{&quot;1&quot;:2,&quot;2&quot;:0}},{&quot;1&quot;:0,&quot;2&quot;:0,&quot;3&quot;:3},{&quot;1&quot;:1,&quot;2&quot;:0,&quot;4&quot;:1}]},&quot;6&quot;:{&quot;1&quot;:[{&quot;1&quot;:2,&quot;2&quot;:0,&quot;5&quot;:{&quot;1&quot;:2,&quot;2&quot;:0}},{&quot;1&quot;:0,&quot;2&quot;:0,&quot;3&quot;:3},{&quot;1&quot;:1,&quot;2&quot;:0,&quot;4&quot;:1}]},&quot;7&quot;:{&quot;1&quot;:[{&quot;1&quot;:2,&quot;2&quot;:0,&quot;5&quot;:{&quot;1&quot;:2,&quot;2&quot;:0}},{&quot;1&quot;:0,&quot;2&quot;:0,&quot;3&quot;:3},{&quot;1&quot;:1,&quot;2&quot;:0,&quot;4&quot;:1}]},&quot;8&quot;:{&quot;1&quot;:[{&quot;1&quot;:2,&quot;2&quot;:0,&quot;5&quot;:{&quot;1&quot;:2,&quot;2&quot;:0}},{&quot;1&quot;:0,&quot;2&quot;:0,&quot;3&quot;:3},{&quot;1&quot;:1,&quot;2&quot;:0,&quot;4&quot;:1}]},&quot;9&quot;:1,&quot;10&quot;:2,&quot;11&quot;:4,&quot;15&quot;:&quot;Calibri&quot;,&quot;16&quot;:11}"">45×68×84cm</span></td>\n<td><span data-sheets-value=""{&quot;1&quot;:2,&quot;2&quot;:&quot;46×77×95cm&quot;}"" data-sheets-userformat=""{&quot;2&quot;:12795,&quot;3&quot;:{&quot;1&quot;:0},&quot;4&quot;:{&quot;1&quot;:2,&quot;2&quot;:16777215},&quot;6&quot;:{&quot;1&quot;:[{&quot;1&quot;:2,&quot;2&quot;:0,&quot;5&quot;:{&quot;1&quot;:2,&quot;2&quot;:0}},{&quot;1&quot;:0,&quot;2&quot;:0,&quot;3&quot;:3},{&quot;1&quot;:1,&quot;2&quot;:0,&quot;4&quot;:1}]},&quot;7&quot;:{&quot;1&quot;:[{&quot;1&quot;:2,&quot;2&quot;:0,&quot;5&quot;:{&quot;1&quot;:2,&quot;2&quot;:0}},{&quot;1&quot;:0,&quot;2&quot;:0,&quot;3&quot;:3},{&quot;1&quot;:1,&quot;2&quot;:0,&quot;4&quot;:1}]},&quot;8&quot;:{&quot;1&quot;:[{&quot;1&quot;:2,&quot;2&quot;:0,&quot;5&quot;:{&quot;1&quot;:2,&quot;2&quot;:0}},{&quot;1&quot;:0,&quot;2&quot;:0,&quot;3&quot;:3},{&quot;1&quot;:1,&quot;2&quot;:0,&quot;4&quot;:1}]},&quot;9&quot;:1,&quot;10&quot;:2,&quot;11&quot;:4,&quot;15&quot;:&quot;Calibri&quot;,&quot;16&quot;:11}"">46×77×95cm</span></td>\n<td><span data-sheets-value=""{&quot;1&quot;:2,&quot;2&quot;:&quot;56×86×120cm&quot;}"" data-sheets-userformat=""{&quot;2&quot;:12795,&quot;3&quot;:{&quot;1&quot;:0},&quot;4&quot;:{&quot;1&quot;:2,&quot;2&quot;:16777215},&quot;6&quot;:{&quot;1&quot;:[{&quot;1&quot;:2,&quot;2&quot;:0,&quot;5&quot;:{&quot;1&quot;:2,&quot;2&quot;:0}},{&quot;1&quot;:0,&quot;2&quot;:0,&quot;3&quot;:3},{&quot;1&quot;:1,&quot;2&quot;:0,&quot;4&quot;:1}]},&quot;7&quot;:{&quot;1&quot;:[{&quot;1&quot;:2,&quot;2&quot;:0,&quot;5&quot;:{&quot;1&quot;:2,&quot;2&quot;:0}},{&quot;1&quot;:0,&quot;2&quot;:0,&quot;3&quot;:3},{&quot;1&quot;:1,&quot;2&quot;:0,&quot;4&quot;:1}]},&quot;8&quot;:{&quot;1&quot;:[{&quot;1&quot;:2,&quot;2&quot;:0,&quot;5&quot;:{&quot;1&quot;:2,&quot;2&quot;:0}},{&quot;1&quot;:0,&quot;2&quot;:0,&quot;3&quot;:3},{&quot;1&quot;:1,&quot;2&quot;:0,&quot;4&quot;:1}]},&quot;9&quot;:1,&quot;10&quot;:2,&quot;11&quot;:4,&quot;15&quot;:&quot;Calibri&quot;,&quot;16&quot;:11}"">56×86×120cm</span></td>\n</tr>\n<tr>\n<td>Capacity</td>\n<td><span data-sheets-value=""{&quot;1&quot;:2,&quot;2&quot;:&quot;5L/h&quot;}"" data-sheets-userformat=""{&quot;2&quot;:15087,&quot;3&quot;:{&quot;1&quot;:0},&quot;4&quot;:{&quot;1&quot;:2,&quot;2&quot;:16777215},&quot;5&quot;:{&quot;1&quot;:[{&quot;1&quot;:2,&quot;2&quot;:0,&quot;5&quot;:{&quot;1&quot;:2,&quot;2&quot;:0}},{&quot;1&quot;:0,&quot;2&quot;:0,&quot;3&quot;:3},{&quot;1&quot;:1,&quot;2&quot;:0,&quot;4&quot;:1}]},&quot;6&quot;:{&quot;1&quot;:[{&quot;1&quot;:2,&quot;2&quot;:0,&quot;5&quot;:{&quot;1&quot;:2,&quot;2&quot;:0}},{&quot;1&quot;:0,&quot;2&quot;:0,&quot;3&quot;:3},{&quot;1&quot;:1,&quot;2&quot;:0,&quot;4&quot;:1}]},&quot;8&quot;:{&quot;1&quot;:[{&quot;1&quot;:2,&quot;2&quot;:0,&quot;5&quot;:{&quot;1&quot;:2,&quot;2&quot;:0}},{&quot;1&quot;:0,&quot;2&quot;:0,&quot;3&quot;:3},{&quot;1&quot;:1,&quot;2&quot;:0,&quot;4&quot;:1}]},&quot;9&quot;:1,&quot;10&quot;:1,&quot;12&quot;:0,&quot;14&quot;:{&quot;1&quot;:2,&quot;2&quot;:0},&quot;15&quot;:&quot;Arial&quot;,&quot;16&quot;:10}"">5L/h</span></td>\n<td><span data-sheets-value=""{&quot;1&quot;:2,&quot;2&quot;:&quot;10L/h&quot;}"" data-sheets-userformat=""{&quot;2&quot;:15083,&quot;3&quot;:{&quot;1&quot;:0},&quot;4&quot;:{&quot;1&quot;:2,&quot;2&quot;:16777215},&quot;6&quot;:{&quot;1&quot;:[{&quot;1&quot;:2,&quot;2&quot;:0,&quot;5&quot;:{&quot;1&quot;:2,&quot;2&quot;:0}},{&quot;1&quot;:0,&quot;2&quot;:0,&quot;3&quot;:3},{&quot;1&quot;:1,&quot;2&quot;:0,&quot;4&quot;:1}]},&quot;8&quot;:{&quot;1&quot;:[{&quot;1&quot;:2,&quot;2&quot;:0,&quot;5&quot;:{&quot;1&quot;:2,&quot;2&quot;:0}},{&quot;1&quot;:0,&quot;2&quot;:0,&quot;3&quot;:3},{&quot;1&quot;:1,&quot;2&quot;:0,&quot;4&quot;:1}]},&quot;9&quot;:1,&quot;10&quot;:1,&quot;12&quot;:0,&quot;14&quot;:{&quot;1&quot;:2,&quot;2&quot;:0},&quot;15&quot;:&quot;Arial&quot;,&quot;16&quot;:10}"">10L/h</span></td>\n<td><span data-sheets-value=""{&quot;1&quot;:2,&quot;2&quot;:&quot;20L/h&quot;}"" data-sheets-userformat=""{&quot;2&quot;:15083,&quot;3&quot;:{&quot;1&quot;:0},&quot;4&quot;:{&quot;1&quot;:2,&quot;2&quot;:16777215},&quot;6&quot;:{&quot;1&quot;:[{&quot;1&quot;:2,&quot;2&quot;:0,&quot;5&quot;:{&quot;1&quot;:2,&quot;2&quot;:0}},{&quot;1&quot;:0,&quot;2&quot;:0,&quot;3&quot;:3},{&quot;1&quot;:1,&quot;2&quot;:0,&quot;4&quot;:1}]},&quot;8&quot;:{&quot;1&quot;:[{&quot;1&quot;:2,&quot;2&quot;:0,&quot;5&quot;:{&quot;1&quot;:2,&quot;2&quot;:0}},{&quot;1&quot;:0,&quot;2&quot;:0,&quot;3&quot;:3},{&quot;1&quot;:1,&quot;2&quot;:0,&quot;4&quot;:1}]},&quot;9&quot;:1,&quot;10&quot;:1,&quot;12&quot;:0,&quot;14&quot;:{&quot;1&quot;:2,&quot;2&quot;:0},&quot;15&quot;:&quot;Arial&quot;,&quot;16&quot;:10}"">20L/h</span></td>\n</tr>\n</tbody>\n</table>",,,taxable,,1,,,0,0,,,,,0,,,,"Laboratory sector > Water Distiller > Water Distiller (Doble Distillation)",,,"https://kalstein.net/en/wp-content/uploads/2022/12/YR05975-YR05977.jpg, https://kalstein.net/en/wp-content/uploads/2022/12/YR05975-YR05977-2.jpg",,,,,,,,,0,Modelo,"YR05975, YR05976, YR05977",1,1
