ID,Type,SKU,Name,Published,"Is featured?","Visibility in catalog","Short description",Description,"Date sale price starts","Date sale price ends","Tax status","Tax class","In stock?",Stock,"Low stock amount","Backorders allowed?","Sold individually?","Weight (kg)","Length (cm)","Width (cm)","Height (cm)","Allow customer reviews?","Purchase note","Sale price","Regular price",Categories,Tags,"Shipping class",Images,"Download limit","Download expiry days",Parent,"Grouped products",Upsells,Cross-sells,"External URL","Button text",Position,"Attribute 1 name","Attribute 1 value(s)","Attribute 1 visible","Attribute 1 global","Attribute 2 name","Attribute 2 value(s)","Attribute 2 visible","Attribute 2 global"
27450,variable,,"Recirculating Chiller YR02297 // YR02300",1,0,visible,"<strong>Manufacturer</strong>: Kalstein\n\n<img class=""alignnone size-full wp-image-7597"" src=""https://www.kalstein.ee/wp-content/uploads/2020/01/CE.jpg"" alt="""" width=""54"" height=""53"" />","This series of chiller is usually used to provide constant low temperature condition for inspections, chemical, biological and physical experiments which need to be carried on under low temperature, mainly used for medicine and health care, food process, chemical industry and teaching in colleges and research institutes.\n<h6>Advantages</h6>\n<ul>\n 	<li>Applications in Chemistry and Biology, like Atomic absorption, ICP-MS, Nuclear Magnetic Resonance, biological fermenter, chemical reaction vessel ( synthetic vessel) etc.</li>\n 	<li>Material Area: Electron Microscopy, X-ray diffraction, X fluorescence, Magnetron sputtering, vacuum coating machine, Laser machine etc.</li>\n 	<li>Equipped with world famous brand compressor, ensure low noise, high reliability, stable performance and long life span.</li>\n 	<li>High performance circulating pump or imported high pressure vane pump with stable and reliable quality. Pump pressure is adjustable.</li>\n 	<li>Completely closed circulation system prevents bath fluid from evaporation or contamination.</li>\n 	<li>Built-in filters in circulation hose avoids possible blockage.</li>\n 	<li>Environmental friendly CFC-free refrigerant meets international standards.</li>\n 	<li>Compact design with good-looking appearance</li>\n 	<li>Designed with liquid level monitor, which make it easier to check the bath fluid left in the tank.</li>\n 	<li>Pressure of bath fluid can be measured by the pressure gauge which is fixed near the fluid outlet.</li>\n 	<li>Variable models to meet customer's different requirements.</li>\n 	<li>Removable side panels for quick and easy cleaning and maintenance.}</li>\n</ul>\n<h6>Technical Description</h6>\n<table width=""927"">\n<tbody>\n<tr>\n<td colspan=""2"" width=""230""><strong>Model</strong></td>\n<td width=""174""><strong>YR02297</strong></td>\n<td width=""174""><strong>YR02298</strong></td>\n<td width=""174""><strong>YR02299</strong></td>\n<td width=""174""><strong>YR02300</strong></td>\n</tr>\n<tr>\n<td colspan=""2"" width=""230""><strong>Working Temperature Range</strong></td>\n<td colspan=""4"" width=""697"">-30 ~ 5'C</td>\n</tr>\n<tr>\n<td colspan=""2"" width=""230""><strong>Temperature Stability</strong></td>\n<td width=""174"">± 2°C</td>\n<td width=""174""></td>\n<td colspan=""2"" width=""348"">± 2'C</td>\n</tr>\n<tr>\n<td colspan=""2"" width=""230""><strong>Power Supply</strong></td>\n<td colspan=""3"" width=""522"">220-240V~, 50/60Hz</td>\n<td width=""174"">3~, 380V, 50Hz</td>\n</tr>\n<tr>\n<td colspan=""2"" width=""230""><strong>Rated power</strong></td>\n<td width=""174"">1070</td>\n<td width=""174"">1475</td>\n<td width=""174"">1275</td>\n<td width=""174"">1475</td>\n</tr>\n<tr>\n<td rowspan=""4"" width=""115""><strong>Cooling Capacity</strong>\n\n<strong>(W)</strong></td>\n<td width=""115""><strong>0°C</strong></td>\n<td width=""174"">1250</td>\n<td width=""174"">1750</td>\n<td width=""174"">2800</td>\n<td width=""174"">6000</td>\n</tr>\n<tr>\n<td width=""115""><strong>-10°C</strong></td>\n<td width=""174"">800</td>\n<td width=""174"">1100</td>\n<td width=""174"">1800</td>\n<td width=""174"">4000</td>\n</tr>\n<tr>\n<td width=""115""><strong>-20°C</strong></td>\n<td width=""174"">300</td>\n<td width=""174"">700</td>\n<td width=""174"">1000</td>\n<td width=""174"">2500</td>\n</tr>\n<tr>\n<td width=""115""><strong>-25°C</strong></td>\n<td width=""174"">150</td>\n<td width=""174"">300</td>\n<td width=""174"">500</td>\n<td width=""174"">7100</td>\n</tr>\n<tr>\n<td colspan=""2"" width=""230""><strong>Refrigerant</strong></td>\n<td colspan=""3"" width=""522"">R410A</td>\n<td width=""174"">R404A</td>\n</tr>\n<tr>\n<td colspan=""2"" width=""230""><strong>Bath Fluid Filling Volume ( L)</strong></td>\n<td width=""174"">10</td>\n<td width=""174"">17</td>\n<td width=""174"">30</td>\n<td width=""174"">40</td>\n</tr>\n<tr>\n<td colspan=""2"" width=""230""><strong>Circulating Pump Flow Rate</strong></td>\n<td colspan=""3"" width=""522"">20L/min</td>\n<td width=""174"">30L/min</td>\n</tr>\n<tr>\n<td colspan=""2"" width=""230""><strong>Pressure (bar)</strong></td>\n<td colspan=""3"" width=""522"">0.4</td>\n<td width=""174"">1</td>\n</tr>\n<tr>\n<td colspan=""2"" width=""230""><strong>Hase Connection Size</strong></td>\n<td colspan=""3"" width=""522"">1 / 2""</td>\n<td width=""174"">3 / 4""</td>\n</tr>\n<tr>\n<td colspan=""2"" width=""230""><strong>Dimensions ( mm )</strong></td>\n<td width=""174"">435Wx 6900 x 720H</td>\n<td width=""174"">465W x 6900 x 820H</td>\n<td width=""174"">495W x 760D x 860H</td>\n<td width=""174"">650W x 10550 x 1070H</td>\n</tr>\n<tr>\n<td colspan=""2"" width=""230""><strong>Net Weight ( Kg)</strong></td>\n<td width=""174"">70</td>\n<td width=""174"">80</td>\n<td width=""174"">100</td>\n<td width=""174"">195</td>\n</tr>\n</tbody>\n</table>",,,taxable,,1,,,0,0,,,,,0,,,,"Laboratory sector > Recirculating Chiller",,,https://kalstein.net/en/wp-content/uploads/2022/01/YR02293-YR02296-IMG-3.jpg,,,,,,,,,0,Model,"YR02297, YR02298, YR02299, YR02300",1,1,,,,
27451,simple,,"Recirculating Chiller YR02301",1,0,visible,"<strong>Manufacturer</strong>: Kalstein\n\n<img class=""alignnone size-full wp-image-7597"" src=""https://www.kalstein.ee/wp-content/uploads/2020/01/CE.jpg"" alt="""" width=""54"" height=""53"" />","This compact chiller is particularly designed for lab scale rotary evaporator. It is reasonably structured with small foot-print, which can be placed on bench or on floor.\n<h6>Advantages</h6>\n<ul>\n 	<li>Circulating joint nozzle can be rotated 360° which makes it easy to connect with corollary equipment</li>\n 	<li>All parts contacting refrigerant is made of stainless steel 304 and macromolecule anti-corrosive material</li>\n 	<li>World famous brand compressor ensures high reliabilit</li>\n</ul>\n<table dir=""ltr"" border=""1"" cellspacing=""0"" cellpadding=""0""><colgroup> <col width=""171"" /> <col width=""137"" /></colgroup>\n<tbody>\n<tr>\n<td data-sheets-value=""{&quot;1&quot;:2,&quot;2&quot;:&quot;Model&quot;}""><strong>Model</strong></td>\n<td data-sheets-value=""{&quot;1&quot;:2,&quot;2&quot;:&quot;YR02301&quot;}"">YR02301</td>\n</tr>\n<tr>\n<td data-sheets-value=""{&quot;1&quot;:2,&quot;2&quot;:&quot;Working Temperature Range&quot;}""><strong>Working Temperature Range</strong></td>\n<td data-sheets-value=""{&quot;1&quot;:2,&quot;2&quot;:&quot;-15-25℃&quot;}"">-15-25℃</td>\n</tr>\n<tr>\n<td data-sheets-value=""{&quot;1&quot;:2,&quot;2&quot;:&quot;Power Supply&quot;}""><strong>Power Supply</strong></td>\n<td data-sheets-value=""{&quot;1&quot;:2,&quot;2&quot;:&quot;220-240V～ 50Hz&quot;}"">220-240V～ 50Hz</td>\n</tr>\n<tr>\n<td data-sheets-value=""{&quot;1&quot;:2,&quot;2&quot;:&quot;Overall Power&quot;}""><strong>Overall Power</strong></td>\n<td data-sheets-value=""{&quot;1&quot;:2,&quot;2&quot;:&quot;450W&quot;}"">450W</td>\n</tr>\n<tr>\n<td data-sheets-value=""{&quot;1&quot;:2,&quot;2&quot;:&quot;Cooling Capacity&quot;}""><strong>Cooling Capacity</strong></td>\n<td data-sheets-value=""{&quot;1&quot;:2,&quot;2&quot;:&quot;400W&quot;}"">400W</td>\n</tr>\n<tr>\n<td data-sheets-value=""{&quot;1&quot;:2,&quot;2&quot;:&quot;Refrigerant&quot;}""><strong>Refrigerant</strong></td>\n<td data-sheets-value=""{&quot;1&quot;:2,&quot;2&quot;:&quot;R134A&quot;}"">R134A</td>\n</tr>\n<tr>\n<td data-sheets-value=""{&quot;1&quot;:2,&quot;2&quot;:&quot;Bath Fluid Filling Volume&quot;}""><strong>Bath Fluid Filling Volume</strong></td>\n<td data-sheets-value=""{&quot;1&quot;:2,&quot;2&quot;:&quot;3L&quot;}"">3L</td>\n</tr>\n<tr>\n<td data-sheets-value=""{&quot;1&quot;:2,&quot;2&quot;:&quot;Material of Bath Fluid Tank&quot;}""><strong>Material of Bath Fluid Tank</strong></td>\n<td data-sheets-value=""{&quot;1&quot;:2,&quot;2&quot;:&quot;Stainless Steel 304&quot;}"">Stainless Steel 304</td>\n</tr>\n<tr>\n<td data-sheets-value=""{&quot;1&quot;:2,&quot;2&quot;:&quot;Circulating Pump Flow Rate&quot;}""><strong>Circulating Pump Flow Rate</strong></td>\n<td data-sheets-value=""{&quot;1&quot;:2,&quot;2&quot;:&quot;17L/min&quot;}"">17L/min</td>\n</tr>\n<tr>\n<td data-sheets-value=""{&quot;1&quot;:2,&quot;2&quot;:&quot;Pump Pressure&quot;}""><strong>Pump Pressure</strong></td>\n<td data-sheets-value=""{&quot;1&quot;:2,&quot;2&quot;:&quot;0.2bar&quot;}"">0.2bar</td>\n</tr>\n<tr>\n<td data-sheets-value=""{&quot;1&quot;:2,&quot;2&quot;:&quot;Dimensions&quot;}""><strong>Dimensions</strong></td>\n<td data-sheets-value=""{&quot;1&quot;:2,&quot;2&quot;:&quot;260W*410D*550H mm&quot;}"">260W*410D*550H mm</td>\n</tr>\n<tr>\n<td data-sheets-value=""{&quot;1&quot;:2,&quot;2&quot;:&quot;Net Weight&quot;}""><strong>Net Weight</strong></td>\n<td data-sheets-value=""{&quot;1&quot;:2,&quot;2&quot;:&quot;26kg&quot;}"">26kg</td>\n</tr>\n</tbody>\n</table>\n&nbsp;",,,taxable,,1,,,0,0,41,38,51,73,0,,,"1795,86","Laboratory sector > Recirculating Chiller",,,"https://kalstein.net/en/wp-content/uploads/2022/01/YR02301-Kalstein-K.jpg, https://kalstein.net/en/wp-content/uploads/2022/01/YR02301-Kalstein-K-2.jpg, https://kalstein.net/en/wp-content/uploads/2022/01/YR02301-Kalstein-K-3.jpg, https://kalstein.net/en/wp-content/uploads/2022/01/Cool-down-time-of-YR02301-2.jpg",,,,,,,,,0,,,,,,,,
27452,variable,,"Recirculating Chiller YR02293 - YR02296",1,0,visible,"<strong>Manufacturer</strong>: Kalstein\n\n<img class=""alignnone size-full wp-image-7597"" src=""https://www.kalstein.ee/wp-content/uploads/2020/01/CE.jpg"" alt="""" width=""54"" height=""53"" />","YR Recirculating  Chiller is usually used to provide constant low temperature condition for inspections, chemical, biological and physical experiments which need to be carried on under low temperature, mainly used for medicine and health care, food process, chemical industry and teaching in colleges and research institutes.\n<h6>Advantages</h6>\n<ul>\n 	<li>Applications in Chemistry and Biology, like biological fermenter, chemical synthetic vessel etc.</li>\n 	<li>Equipped with world famous brand compressor, ensure low noise, high reliability, stable performance and long life span.</li>\n 	<li>Completely closed circulation system prevents bath fluid from evaporation or contamination.</li>\n 	<li>Built-in filters in circulation hose avoids possible blockage.</li>\n 	<li>Environmental friendly CFC-free refrigerant meets international standards.</li>\n 	<li>Compact design with good-looking appearance</li>\n 	<li>Designed with liquid level monitor, which make it easier to check the bath fluid left in the tank.</li>\n 	<li>Pressure of bath fluid can be measured by the pressure gauge which is fixed near the fluid outlet.</li>\n 	<li>Variable models to meet customer’s different requirements.</li>\n 	<li>Removable side panels for quick and easy cleaning and maintenance.</li>\n 	<li>Eco-friendly refrigerant meets international environmental protection standard; Intelligent control system will prevent compressor from overloading which will extend its service life; closed circulation system reduced evaporation of refrigerant.\n<table>\n<tbody>\n<tr>\n<td width=""151""><strong>Model</strong></td>\n<td width=""101""><strong>YR02293</strong></td>\n<td width=""101""><strong>YR02294</strong></td>\n<td width=""101""><strong>YR02295</strong></td>\n<td width=""102""><strong>YR02296</strong></td>\n</tr>\n<tr>\n<td width=""151""><strong>Temperature Range (°C)</strong></td>\n<td colspan=""4"" width=""406"">-10~25</td>\n</tr>\n<tr>\n<td width=""151""><strong>Temperature Stability (°C)</strong></td>\n<td colspan=""4"" width=""406"">±2</td>\n</tr>\n<tr>\n<td width=""151""><strong>Cooling Capacity at 15 Degree (W)</strong></td>\n<td width=""101"">1000</td>\n<td width=""101"">2000</td>\n<td width=""101"">3000</td>\n<td width=""102"">6000</td>\n</tr>\n<tr>\n<td width=""151""><strong>Flow</strong></td>\n<td width=""101"">30L/Min\n\nUnder\n\n1bar</td>\n<td width=""101"">30L/Min\n\nUnder\n\n1bar</td>\n<td width=""101"">30L/Min\n\nUnder\n\n1bar</td>\n<td width=""102"">40L/Min\n\nUnder\n\n1.5bar</td>\n</tr>\n<tr>\n<td width=""151""><strong>Bath Volume</strong></td>\n<td width=""101"">12</td>\n<td width=""101"">18</td>\n<td width=""101"">25</td>\n<td width=""102"">50</td>\n</tr>\n<tr>\n<td width=""151""><strong>Refrigerant</strong></td>\n<td colspan=""4"" width=""406"">R134A</td>\n</tr>\n<tr>\n<td width=""151""><strong>Power Supply</strong></td>\n<td colspan=""4"" width=""406"">Single Phase 220V 50HZ</td>\n</tr>\n<tr>\n<td width=""151""><strong>Dimension LxWxH (mm)</strong></td>\n<td width=""101"">675×426×695</td>\n<td width=""101"">675×456×775</td>\n<td width=""101"">740×490×830</td>\n<td width=""102"">1020×635×1030</td>\n</tr>\n</tbody>\n</table>\n</li>\n</ul>",,,taxable,,1,,,0,0,,,,,0,,,,"Laboratory sector > Recirculating Chiller",,,https://kalstein.net/en/wp-content/uploads/2022/01/YR02293-YR02296-IMG-3.jpg,,,,,,,,,0,Model,"YR02293, YR02294, YR02295, YR02296",1,1,,,,
27989,variable,,"High-speed refrigerated centrifuge YR0113",1,0,visible,"<span class=""col-xs-9 marca""><strong>Manufacturer:</strong> Kalstein</span>\n<div class=""col-xs-3 text-center logo_ce""><img title="" Certificacion Europea "" src=""https://kalstein.eu/templates/kalstein/images//CE.jpg"" alt=""Certificacion Europea"" width=""54"" height=""53"" border=""0"" /></div>","In this case, we present two models: YR0113 and YR0112. Both models are centrifuges used to collect microorganisms and cell samples. The maximum RCF of these high-speed centrifuges is 64983 g and its maximum speed is 25000 rpm. On the control system, both models work with a microcomputer control, an electronic lock and a variable conversion engine, which offers a high torque.\n\nThese refrigerated centrifuges work with an imported compressor unit that works with a refrigerant without CFC. This means that these models comply with environmental standards. Another great feature is that these are programmable machines, so the operating data can be stored automatically. The YR0113 model comes with an LCD screen and YR0112 with a LED screen with a touch panel, which makes the operation a lot. Other excellent features of these high-speed refrigerated centrifuges are:\n<ul>\n 	<li>Autoblock device.</li>\n 	<li>Overvel treatment device.</li>\n 	<li>Overheater safety device.</li>\n 	<li>Imbalance safety device.</li>\n 	<li>Automatic alarm device.</li>\n</ul>\nReal speed conversation of speed and RCF is very convenient for operation. Finally, these models have 10 acceleration and deceleration level files for you to choose. On the ability of these models, you should know that the maximum is 1000 ml x 4. The temperature setting is -20 to 40 degrees celsius. The power supply is AC220V 50HZ 30A and the external dimensions are (LXWXH) 710MMX840MMX1200MM with a net weight of 290kg.\n<h6>Technical presentation</h6>\n<ul>\n 	<li>The maximum speed is 25000 rpm and the maximum RCF is 64983 g.</li>\n 	<li>It has microcomputer control, electronic lock and AC variable conversion engine that offers a high torque.</li>\n 	<li>Imported compressor unit with refrigerant without CFC. It is up to the environmental standards.</li>\n 	<li>The machine is programmable. The operating data can be stored automatically.</li>\n 	<li>YR0113 has LCD and YR0112 has LED display. The tactile panel facilitates the operation.</li>\n 	<li>Real-time Speed and RCF conversation is suitable for operation.</li>\n 	<li>It has a self-locking device, overspeed safety device, overheating safety device, imbalance safety device and automatic alarm device.</li>\n 	<li>It has 10 acceleration files and slowdown level for your choice.</li>\n</ul>\n<table dir=""ltr"" border=""1"" cellspacing=""0"" cellpadding=""0""><colgroup> <col width=""207"" /> <col width=""263"" /> <col width=""100"" /></colgroup>\n<tbody>\n<tr>\n<td data-sheets-value=""{&quot;1&quot;:2,&quot;2&quot;:&quot;Model&quot;}""><strong>Model</strong></td>\n<td data-sheets-value=""{&quot;1&quot;:2,&quot;2&quot;:&quot;YR0113&quot;}""><strong>YR0113</strong></td>\n<td data-sheets-value=""{&quot;1&quot;:2,&quot;2&quot;:&quot;YR0112&quot;}""><strong>YR0112</strong></td>\n</tr>\n<tr>\n<td data-sheets-value=""{&quot;1&quot;:2,&quot;2&quot;:&quot;Maximum speed&quot;}""><strong>Maximum speed</strong></td>\n<td data-sheets-value=""{&quot;1&quot;:2,&quot;2&quot;:&quot;22,000r/min&quot;}"">25,000r/min</td>\n<td data-sheets-value=""{&quot;1&quot;:2,&quot;2&quot;:&quot;21,000r/min&quot;}"">25,000r/min</td>\n</tr>\n<tr>\n<td data-sheets-value=""{&quot;1&quot;:2,&quot;2&quot;:&quot;RCF Max&quot;}""><strong>RCF Max</strong></td>\n<td data-sheets-value=""{&quot;1&quot;:2,&quot;2&quot;:&quot;52,000 xg&quot;}"">52,000 xg</td>\n<td data-sheets-value=""{&quot;1&quot;:2,&quot;2&quot;:&quot;50 400 xg&quot;}"">50 400 xg</td>\n</tr>\n<tr>\n<td data-sheets-value=""{&quot;1&quot;:2,&quot;2&quot;:&quot;Maximum capacity&quot;}""><strong>Maximum capacity</strong></td>\n<td data-sheets-value=""{&quot;1&quot;:2,&quot;2&quot;:&quot;1000ml x 4ml&quot;}"">1000ml x 4ml</td>\n<td data-sheets-value=""{&quot;1&quot;:2,&quot;2&quot;:&quot;1000ml x 4ml&quot;}"">1000ml x 4ml</td>\n</tr>\n<tr>\n<td data-sheets-value=""{&quot;1&quot;:2,&quot;2&quot;:&quot;Speed ​​Accuracy&quot;}""><strong>Speed ​​Accuracy</strong></td>\n<td data-sheets-value=""{&quot;1&quot;:2,&quot;2&quot;:&quot;±50r/min&quot;}"">±50r/min</td>\n<td data-sheets-value=""{&quot;1&quot;:2,&quot;2&quot;:&quot;±50r/min&quot;}"">±50r/min</td>\n</tr>\n<tr>\n<td data-sheets-value=""{&quot;1&quot;:2,&quot;2&quot;:&quot;Time Settings&quot;}""><strong>Time Settings</strong></td>\n<td colspan=""2"" rowspan=""1"" data-sheets-value=""{&quot;1&quot;:2,&quot;2&quot;:&quot;1 min to 99 min&quot;}"">1 min to 99 min</td>\n</tr>\n<tr>\n<td data-sheets-value=""{&quot;1&quot;:2,&quot;2&quot;:&quot;Temperature setting&quot;}""><strong>Temperature setting</strong></td>\n<td colspan=""2"" rowspan=""1"" data-sheets-value=""{&quot;1&quot;:2,&quot;2&quot;:&quot;(-)20 ~ +40°C&quot;}"">(-)20 ~ +40°C</td>\n</tr>\n<tr>\n<td data-sheets-value=""{&quot;1&quot;:2,&quot;2&quot;:&quot;Compressor Unit&quot;}""><strong>Compressor Unit</strong></td>\n<td colspan=""2"" rowspan=""1"" data-sheets-value=""{&quot;1&quot;:2,&quot;2&quot;:&quot;French Tecumseh Compressor Unit, R40Aa&quot;}"">French Tecumseh Compressor Unit, R40Aa</td>\n</tr>\n<tr>\n<td data-sheets-value=""{&quot;1&quot;:2,&quot;2&quot;:&quot;Noise&quot;}""><strong>Noise</strong></td>\n<td colspan=""2"" rowspan=""1"" data-sheets-value=""{&quot;1&quot;:2,&quot;2&quot;:&quot;&lt;65dB(A)&quot;}"">&lt;65dB(A)</td>\n</tr>\n<tr>\n<td data-sheets-value=""{&quot;1&quot;:2,&quot;2&quot;:&quot;Power supply&quot;}""><strong>Power supply</strong></td>\n<td colspan=""2"" rowspan=""1"" data-sheets-value=""{&quot;1&quot;:2,&quot;2&quot;:&quot;AC220V 50Hz 20A&quot;}"">AC220V 50Hz 20A</td>\n</tr>\n<tr>\n<td data-sheets-value=""{&quot;1&quot;:2,&quot;2&quot;:&quot;Dimension (W×D×H)&quot;}""><strong>Dimension (W×D×H)</strong></td>\n<td colspan=""2"" rowspan=""1"" data-sheets-value=""{&quot;1&quot;:2,&quot;2&quot;:&quot;710mm x 840mm x 1200mm&quot;}"">710mm x 840mm x 1200mm</td>\n</tr>\n<tr>\n<td data-sheets-value=""{&quot;1&quot;:2,&quot;2&quot;:&quot;Packing Size (L x W x H)&quot;}""><strong>Packing Size (L x W x H)</strong></td>\n<td colspan=""2"" rowspan=""1"" data-sheets-value=""{&quot;1&quot;:2,&quot;2&quot;:&quot;890 x 960 x 1400 (mm)&quot;}"">890 x 960 x 1400 (mm)</td>\n</tr>\n<tr>\n<td data-sheets-value=""{&quot;1&quot;:2,&quot;2&quot;:&quot;Net weight&quot;}""><strong>Net weight</strong></td>\n<td colspan=""2"" rowspan=""1"" data-sheets-value=""{&quot;1&quot;:2,&quot;2&quot;:&quot;290kg&quot;}"">290kg</td>\n</tr>\n</tbody>\n</table>",,,taxable,,1,,,0,0,,,,,0,,,,"Laboratory sector > Centrifuges > Refrigerated centrifuges",,,https://kalstein.net/en/wp-content/uploads/2022/01/lrg_YR118-1.jpg,,,,,,,,,0,Modelo,"YR0112 con pantalla LED, YR0113 con pantalla LCD",1,1,Rotor,"(YR0112-1-1) Rotor de ángulo - 25000rpm - RCF: 64983 - Capacidad (ml) 1.5ml/2.2ml×24, (YR0112-1-2) Rotor de ángulo - 25000 rpm - RCF: 64983 - Capacidad (ml) 5ml×10, (YR0112-10) Rotor de flujo continuo – 8000rpm – RCF: 9500 – Capacidad (ml) 3000ml, (YR0112-11) Rotor de flujo continuo – 16000rpm – RCF: 28100 – Capacidad (ml) 1000ml, (YR0112-12) Rotor de flujo continuo – 10000rpm – RCF: 14800 – Capacidad (ml) 3000ml, (YR0112-2) Rotor de ángulo – 23000rpm – RCF: 60900 – Capacidad (ml) 10ml×16, (YR0112-3) Rotor de ángulo – 18000rpm – RCF: 40930 – Capacidad (ml) 50ml×8, (YR0112-4) Rotor de ángulo – 14000rpm – RCF: 30200 – Capacidad (ml) 250ml×6, (YR0112-5) Rotor de ángulo – 10000rpm – RCF: 17800 – Capacidad (ml) 500ml×6, (YR0112-6) Rotor de ángulo – 7000rpm – RCF: 9980 – Capacidad (ml) 1000ml×4, (YR0112-7) Rotor de microplacas – 4000rpm – RCF: 2236 – Capacidad (ml) 8×96well, (YR0112-8) Rotor oscilante – 5000rpm – RCF: 5470 – Capacidad (ml) 750ml×4, (YR0112-9) Rotor de flujo continuo – 14000rpm – RCF: 21500 – Capacidad (ml) 1000ml",1,1
