ID,Type,SKU,Name,Published,"Is featured?","Visibility in catalog","Short description",Description,"Date sale price starts","Date sale price ends","Tax status","Tax class","In stock?",Stock,"Low stock amount","Backorders allowed?","Sold individually?","Weight (kg)","Length (cm)","Width (cm)","Height (cm)","Allow customer reviews?","Purchase note","Sale price","Regular price",Categories,Tags,"Shipping class",Images,"Download limit","Download expiry days",Parent,"Grouped products",Upsells,Cross-sells,"External URL","Button text",Position,"Attribute 1 name","Attribute 1 value(s)","Attribute 1 visible","Attribute 1 global"
27461,variable,,"Thermostatic Magnetic Stirring Bath YR02311 // YR02312",1,0,visible,"<strong>Manufacturer</strong>: Kalstein\n\n<img class=""alignnone size-full wp-image-7597"" src=""https://www.kalstein.ee/wp-content/uploads/2020/01/CE.jpg"" alt="""" width=""54"" height=""53"" />","It can be used as water bath or oil bath.\n<ol>\n 	<li>Stainless steel 304 heater.</li>\n 	<li>The magnetic stirring system drives the stirrer to rotate synchronistically, so that the solution in the bath can be heated and stirred evenly.</li>\n 	<li>DC brushless motor ensures stable performance and continuous working.</li>\n 	<li>High temperature magnet can continuously work at 300℃ without losing magnetism.</li>\n 	<li>PID temperature controller ensures accurate temperature control.</li>\n 	<li>Key setting and digital display make it easy to operate.</li>\n 	<li>YR02311 <strong>// </strong>YR02312 are equipped with two sensors make bath temperature and container temperature display alternately.</li>\n</ol>\n<table dir=""ltr"" border=""1"" cellspacing=""0"" cellpadding=""0""><colgroup> <col width=""183"" /> <col width=""235"" /> <col width=""235"" /></colgroup>\n<tbody>\n<tr>\n<td data-sheets-value=""{&quot;1&quot;:2,&quot;2&quot;:&quot;Model&quot;}""><strong>Model</strong></td>\n<td data-sheets-value=""{&quot;1&quot;:2,&quot;2&quot;:&quot;YR02311 &quot;}"">YR02311</td>\n<td data-sheets-value=""{&quot;1&quot;:2,&quot;2&quot;:&quot;YR02312&quot;}"">YR02312</td>\n</tr>\n<tr>\n<td data-sheets-value=""{&quot;1&quot;:2,&quot;2&quot;:&quot;Temperature Range ( ℃ )&quot;}""><strong>Temperature Range ( ℃ )</strong></td>\n<td colspan=""2"" rowspan=""1"" data-sheets-value=""{&quot;1&quot;:2,&quot;2&quot;:&quot;Room Temperature+5 ~ 200&quot;}"">Room Temperature+5 ~ 200</td>\n</tr>\n<tr>\n<td data-sheets-value=""{&quot;1&quot;:2,&quot;2&quot;:&quot;Temperature Stability ( ℃ )&quot;}""><strong>Temperature Stability ( ℃ )</strong></td>\n<td colspan=""2"" rowspan=""1"" data-sheets-value=""{&quot;1&quot;:2,&quot;2&quot;:&quot;±1&quot;}"">±1</td>\n</tr>\n<tr>\n<td data-sheets-value=""{&quot;1&quot;:2,&quot;2&quot;:&quot;Temperature Display&quot;}""><strong>Temperature Display</strong></td>\n<td colspan=""2"" rowspan=""1"" data-sheets-value=""{&quot;1&quot;:2,&quot;2&quot;:&quot;Keypad Input, Digital Display&quot;}"">Keypad Input, Digital Display</td>\n</tr>\n<tr>\n<td data-sheets-value=""{&quot;1&quot;:2,&quot;2&quot;:&quot;Stirring Speed Setting&quot;}""><strong>Stirring Speed Setting</strong></td>\n<td colspan=""2"" rowspan=""1"" data-sheets-value=""{&quot;1&quot;:2,&quot;2&quot;:&quot;Knob Setting&quot;}"">Knob Setting</td>\n</tr>\n<tr>\n<td data-sheets-value=""{&quot;1&quot;:2,&quot;2&quot;:&quot;Stirring Speed ( rpm )&quot;}""><strong>Stirring Speed ( rpm )</strong></td>\n<td colspan=""2"" rowspan=""1"" data-sheets-value=""{&quot;1&quot;:2,&quot;2&quot;:&quot;0~2000&quot;}"">0~2000</td>\n</tr>\n<tr>\n<td data-sheets-value=""{&quot;1&quot;:2,&quot;2&quot;:&quot;Bath Dimensions (mm)&quot;}""><strong>Bath Dimensions (mm)</strong></td>\n<td data-sheets-value=""{&quot;1&quot;:2,&quot;2&quot;:&quot;￠ 220*110&quot;}"">￠ 220*110</td>\n<td data-sheets-value=""{&quot;1&quot;:2,&quot;2&quot;:&quot;￠ 254*130&quot;}"">￠ 254*130</td>\n</tr>\n<tr>\n<td data-sheets-value=""{&quot;1&quot;:2,&quot;2&quot;:&quot;Bath Capacity ( L )&quot;}""><strong>Bath Capacity ( L )</strong></td>\n<td data-sheets-value=""{&quot;1&quot;:3,&quot;3&quot;:4}"">4</td>\n<td data-sheets-value=""{&quot;1&quot;:3,&quot;3&quot;:44687}"" data-sheets-numberformat=""{&quot;1&quot;:5,&quot;2&quot;:&quot;d.m&quot;,&quot;3&quot;:1}"">6.5</td>\n</tr>\n<tr>\n<td data-sheets-value=""{&quot;1&quot;:2,&quot;2&quot;:&quot;Heating Power ( W )&quot;}""><strong>Heating Power ( W )</strong></td>\n<td data-sheets-value=""{&quot;1&quot;:3,&quot;3&quot;:500}"">500</td>\n<td data-sheets-value=""{&quot;1&quot;:3,&quot;3&quot;:1050}"">1050</td>\n</tr>\n<tr>\n<td data-sheets-value=""{&quot;1&quot;:2,&quot;2&quot;:&quot;Max. Flask can be placed (ml)&quot;}""><strong>Max. Flask can be placed (ml)</strong></td>\n<td data-sheets-value=""{&quot;1&quot;:3,&quot;3&quot;:3000}"">3000</td>\n<td data-sheets-value=""{&quot;1&quot;:3,&quot;3&quot;:5000}"">5000</td>\n</tr>\n<tr>\n<td data-sheets-value=""{&quot;1&quot;:2,&quot;2&quot;:&quot;Power Supply ( V/Hz )&quot;}""><strong>Power Supply ( V/Hz )</strong></td>\n<td colspan=""2"" rowspan=""1"" data-sheets-value=""{&quot;1&quot;:2,&quot;2&quot;:&quot;1~，11 0V,60Hz or 220-240V~,50/60Hz&quot;}"">1~，11 0V,60Hz or 220-240V~,50/60Hz</td>\n</tr>\n<tr>\n<td data-sheets-value=""{&quot;1&quot;:2,&quot;2&quot;:&quot;Dimensions ( mm )&quot;}""><strong>Dimensions ( mm )</strong></td>\n<td data-sheets-value=""{&quot;1&quot;:2,&quot;2&quot;:&quot;260W*280D*230H&quot;}"">260W*280D*230H</td>\n<td data-sheets-value=""{&quot;1&quot;:2,&quot;2&quot;:&quot;260W*280D*260H&quot;}"">260W*280D*260H</td>\n</tr>\n<tr>\n<td data-sheets-value=""{&quot;1&quot;:2,&quot;2&quot;:&quot;Net Weight (kg)&quot;}""><strong>Net Weight (kg)</strong></td>\n<td data-sheets-value=""{&quot;1&quot;:3,&quot;3&quot;:5}"">5</td>\n<td data-sheets-value=""{&quot;1&quot;:3,&quot;3&quot;:6}"">6</td>\n</tr>\n</tbody>\n</table>",,,taxable,,1,,,0,0,,,,,0,,,,"Laboratory sector > Water Baths\, Circulators & Chillers > Thermostatic Magnetic Stirring Bath",,,https://kalstein.net/en/wp-content/uploads/2021/08/YR02311-YR02312.jpg,,,,,,,,,0,Model,"YR02311, YR02312",1,1
53113,simple,,"Fabric Processor YR427 (Small Type)",1,0,visible,"<span class=""col-xs-9 marca""><b>Manufacturer: </b><i>Kalstein</i></span>\n\n&nbsp;\n<div class=""col-xs-3 text-center logo_ce""></div>","This device features a sturdy housing with aerodynamic design coated with APS with high corrosion resistance. It has economical, practical, reagent-saving, and low-cost space-saving design, which features two sets of operating programs and the two sets of programs of duration are extended; All the memory function built into the programs have, in addition to this machine has a single computer control chip technology that allows a complete set of functions. The cover is made of well sealed plexiglass with gas flow mechanism, eco-friendly and safe.\n<h6>Fabric Processor Features</h6>\nAnother great feature is that this fabric processor has a large capacity reagent cup, which means that more than 40 tissue samples can be processed simultaneously. You should know that this device is not affected by blackouts or power outages during short operation, manual adjustment can be done at any time during the programmed automatic operation; then the system automatically enters the operation. It has an internal dry heating mechanism controlled by high precision temperature, has a flexible, two-dimensional transmission system, with low noise and wear resistant. High precision photoelectric positioning control ensures reliable system operation and accurate positioning, this model is fully intelligent design, allowing timely determination and recovery of abnormal event.\n\nAbout the technical specifications of this device, which contains 700 ml of 12 cups (9 for reagents, 3 for paraffin). The length of processing time in the cup is any duration between 0 and 99 hours for the first cup and any duration between 0 and 24 hours for the other cups. The drip time is approximately 30 seconds. Finally, the frequency of agitation is 2 times per minute.\n<h6>Characteristics</h6>\n<ul>\n 	<li>Rugged, APS-coated housing with aerodynamic design and high corrosion resistance.</li>\n 	<li>Practical, economical design, which saves reagents, takes up little space and is low cost.</li>\n 	<li>Two sets of operating programs and the two sets of time extension programs; all embedded programs have the memory function.</li>\n 	<li>Unique computer chip control technology enables a complete set of functions.</li>\n 	<li>Well-enclosed plexiglass cover with gas expulsion mechanism, ecological and safe.</li>\n 	<li>Large reactive cup capacity: more than 40 tissue samples can be processed simultaneously.</li>\n 	<li>It is not affected by short power outages or power outages during operation.</li>\n 	<li>Manual adjustment can be made at any time during the programmed auto operation, then the system automatically enters the programmed operation.</li>\n 	<li>Internal dry heating mechanism with high precision temperature control.</li>\n 	<li>Two-dimensional transmission system, flexible, quiet, wear-resistant.</li>\n 	<li>High precision photoelectric positioning control system to ensure reliable operation and accurate positioning.</li>\n 	<li>Completely intelligent design, which allows the determination and timely recovery of an abnormal event.</li>\n</ul>\n<table dir=""ltr"" border=""1"" cellspacing=""0"" cellpadding=""0""><colgroup> <col width=""321"" /> <col width=""375"" /></colgroup>\n<tbody>\n<tr>\n<td data-sheets-value=""{&quot;1&quot;:2,&quot;2&quot;:&quot;Modelo&quot;}""><strong>Model</strong></td>\n<td data-sheets-value=""{&quot;1&quot;:2,&quot;2&quot;:&quot;YR427&quot;}""><strong>YR427</strong></td>\n</tr>\n<tr>\n<td data-sheets-value=""{&quot;1&quot;:2,&quot;2&quot;:&quot;Número de tazas&quot;}""><strong><span title=""Haga clic en una palabra para ver traducciones alternativas""><span class=""systran_token_base"">Number</span></span><span class=""systran_space""> </span><span title=""Haga clic en una palabra para ver traducciones alternativas""><span class=""systran_token_base"">of</span></span><span class=""systran_space""> </span><span title=""Haga clic en una palabra para ver traducciones alternativas""><span class=""systran_token_base"">cups</span></span></strong></td>\n<td data-sheets-value=""{&quot;1&quot;:2,&quot;2&quot;:&quot;12 (9 para reactivos, 3 para parafina)&quot;}""><span title=""Haga clic en una palabra para ver traducciones alternativas""><span class=""systran_token_base"">12</span></span><span class=""systran_space""> </span><span title=""Haga clic en una palabra para ver traducciones alternativas""><span class=""systran_token_base"">(9</span></span><span class=""systran_space""> </span><span title=""Haga clic en una palabra para ver traducciones alternativas""><span class=""systran_token_base"">for</span></span><span class=""systran_space""> </span><span title=""Haga clic en una palabra para ver traducciones alternativas""><span class=""systran_token_base"">reagents,</span></span><span class=""systran_space""> </span><span title=""Haga clic en una palabra para ver traducciones alternativas""><span class=""systran_token_base"">3</span></span><span class=""systran_space""> </span><span title=""Haga clic en una palabra para ver traducciones alternativas""><span class=""systran_token_base"">for</span></span><span class=""systran_space""> </span><span title=""Haga clic en una palabra para ver traducciones alternativas""><span class=""systran_token_base"">paraffin)</span></span></td>\n</tr>\n<tr>\n<td data-sheets-value=""{&quot;1&quot;:2,&quot;2&quot;:&quot;Capacidad de cada taza&quot;}""><span title=""Haga clic en una palabra para ver traducciones alternativas""><span class=""systran_token_base""><strong>Capacity</strong></span></span><strong><span class=""systran_space""> </span><span title=""Haga clic en una palabra para ver traducciones alternativas""><span class=""systran_token_base"">of</span></span><span class=""systran_space""> </span><span title=""Haga clic en una palabra para ver traducciones alternativas""><span class=""systran_token_base"">each</span></span><span class=""systran_space""> </span><span title=""Haga clic en una palabra para ver traducciones alternativas""><span class=""systran_token_base"">cup</span></span></strong></td>\n<td data-sheets-value=""{&quot;1&quot;:2,&quot;2&quot;:&quot;700ml&quot;}"">700ml</td>\n</tr>\n<tr>\n<td data-sheets-value=""{&quot;1&quot;:2,&quot;2&quot;:&quot;Duración del tiempo de procesamiento en la copa&quot;}""><strong>Length of processing time in the cup</strong></td>\n<td data-sheets-value=""{&quot;1&quot;:2,&quot;2&quot;:&quot;Cualquier duración entre 0 y 99 horas para la primera taza\\n Cualquier duración entre 0 y 24 horas para las otras copas&quot;}"">Any duration between 0 and 99 hours for the first cup\nAny duration between 0 and 24 hours for the other drinks</td>\n</tr>\n<tr>\n<td data-sheets-value=""{&quot;1&quot;:2,&quot;2&quot;:&quot;Rango de temperatura&quot;}""><strong><span title=""Haga clic en una palabra para ver traducciones alternativas""><span class=""systran_token_base"">Temperature</span></span><span class=""systran_space""> </span><span title=""Haga clic en una palabra para ver traducciones alternativas""><span class=""systran_token_base"">Range</span></span></strong></td>\n<td data-sheets-value=""{&quot;1&quot;:2,&quot;2&quot;:&quot;temperatura ambiente - 80 ℃&quot;}""><span title=""Haga clic en una palabra para ver traducciones alternativas""><span class=""systran_token_base"">ambient</span></span><span class=""systran_space""> </span><span title=""Haga clic en una palabra para ver traducciones alternativas""><span class=""systran_token_base"">temperature</span></span><span class=""systran_space""> </span><span title=""Haga clic en una palabra para ver traducciones alternativas""><span class=""systran_token_base"">-</span></span><span class=""systran_space""> </span><span title=""Haga clic en una palabra para ver traducciones alternativas""><span class=""systran_token_base"">80℃</span></span></td>\n</tr>\n<tr>\n<td data-sheets-value=""{&quot;1&quot;:2,&quot;2&quot;:&quot;Tiempo de goteo&quot;}""><strong><span title=""Haga clic en una palabra para ver traducciones alternativas""><span class=""systran_token_base"">Drip</span></span><span class=""systran_space""> </span><span title=""Haga clic en una palabra para ver traducciones alternativas""><span class=""systran_token_base"">time</span></span></strong></td>\n<td data-sheets-value=""{&quot;1&quot;:2,&quot;2&quot;:&quot;Aproximadamente 30 s&quot;}""><span title=""Haga clic en una palabra para ver traducciones alternativas""><span class=""systran_token_base"">About</span></span><span class=""systran_space""> </span><span title=""Haga clic en una palabra para ver traducciones alternativas""><span class=""systran_token_base"">30</span></span><span class=""systran_space""> </span><span title=""Haga clic en una palabra para ver traducciones alternativas""><span class=""systran_token_base"">sec</span></span></td>\n</tr>\n<tr>\n<td data-sheets-value=""{&quot;1&quot;:2,&quot;2&quot;:&quot;Frecuencia de agitación&quot;}""><strong><span title=""Haga clic en una palabra para ver traducciones alternativas""><span class=""systran_token_base"">Agitation</span></span><span class=""systran_space""> </span><span title=""Haga clic en una palabra para ver traducciones alternativas""><span class=""systran_token_base"">frequency</span></span></strong></td>\n<td data-sheets-value=""{&quot;1&quot;:2,&quot;2&quot;:&quot;2 veces/minuto&quot;}""><span title=""Haga clic en una palabra para ver traducciones alternativas""><span class=""systran_token_base"">2</span></span><span class=""systran_space""> </span><span title=""Haga clic en una palabra para ver traducciones alternativas""><span class=""systran_token_base"">times/minute</span></span></td>\n</tr>\n<tr>\n<td data-sheets-value=""{&quot;1&quot;:2,&quot;2&quot;:&quot;Tensión de trabajo&quot;}""><strong><span title=""Haga clic en una palabra para ver traducciones alternativas""><span class=""systran_token_base"">Working</span></span><span class=""systran_space""> </span><span title=""Haga clic en una palabra para ver traducciones alternativas""><span class=""systran_token_base"">voltage</span></span></strong></td>\n<td data-sheets-value=""{&quot;1&quot;:2,&quot;2&quot;:&quot;AC220V±10% 50Hz (modelo estándar) AC110V±10% 60Hz&quot;}""><span title=""Haga clic en una palabra para ver traducciones alternativas""><span class=""systran_token_base"">AC220V±10%</span></span><span class=""systran_space""> </span><span title=""Haga clic en una palabra para ver traducciones alternativas""><span class=""systran_token_base"">50Hz</span></span><span class=""systran_space""> </span><span title=""Haga clic en una palabra para ver traducciones alternativas""><span class=""systran_token_base"">(standard</span></span><span class=""systran_space""> </span><span title=""Haga clic en una palabra para ver traducciones alternativas""><span class=""systran_token_base"">model)</span></span><span class=""systran_space""> </span><span title=""Haga clic en una palabra para ver traducciones alternativas""><span class=""systran_token_base"">AC110V±10%</span></span><span class=""systran_space""> </span><span title=""Haga clic en una palabra para ver traducciones alternativas""><span class=""systran_token_base"">60Hz</span></span></td>\n</tr>\n<tr>\n<td data-sheets-value=""{&quot;1&quot;:2,&quot;2&quot;:&quot;requerimientos de energía&quot;}""><strong><span title=""Haga clic en una palabra para ver traducciones alternativas""><span class=""systran_token_base"">power</span></span><span class=""systran_space""> </span><span title=""Haga clic en una palabra para ver traducciones alternativas""><span class=""systran_token_base"">requirements</span></span></strong></td>\n<td data-sheets-value=""{&quot;1&quot;:2,&quot;2&quot;:&quot;500W&quot;}"">500W</td>\n</tr>\n<tr>\n<td data-sheets-value=""{&quot;1&quot;:2,&quot;2&quot;:&quot;Dimensiones&quot;}""><strong>Dimensions</strong></td>\n<td data-sheets-value=""{&quot;1&quot;:2,&quot;2&quot;:&quot;795×435×415mm (Ancho×Profundidad×Alto)&quot;}""><span title=""Haga clic en una palabra para ver traducciones alternativas""><span class=""systran_token_base"">795×435×415mm</span></span><span class=""systran_space""> </span><span title=""Haga clic en una palabra para ver traducciones alternativas""><span class=""systran_token_base"">(Width×Depth×Height)</span></span></td>\n</tr>\n<tr>\n<td data-sheets-value=""{&quot;1&quot;:2,&quot;2&quot;:&quot;Peso&quot;}""><strong>Weigh</strong></td>\n<td data-sheets-value=""{&quot;1&quot;:2,&quot;2&quot;:&quot;50kg&quot;}"">50kg</td>\n</tr>\n</tbody>\n</table>",,,taxable,,1,,,0,0,90,95,54,58,0,,,"4989,60","Laboratory sector > Pathological anatomy > Tissue processing",,,https://kalstein.net/en/wp-content/uploads/2022/09/YR427-Kalstein-K-1.jpg,,,,,,,,,0,Dimensions,"95 × 54 × 58 cm",1,0
53114,simple,,"Automated Tissue Processor YR428",1,0,visible,"<span class=""col-xs-9 marca""><strong>Manufacturer:</strong> Kalstein</span>\n<div class=""col-xs-3 text-center logo_ce""><img title="" Certificacion europea "" src=""https://kalstein.eu/templates/kalstein/images//CE.jpg"" alt=""Certificacion europea"" width=""54"" height=""53"" border=""0"" /></div>","YR428 Automated Tissue Processor is mainly used in small laboratories to process specimens to improve the quality sections. The max number of specimens processed is 50 each time. It is popular in the market because of its space saving and simple operation.\n<ul>\n 	<li>Fully intelligent design, enabling timely automatic determination and recovery from an abnormal event</li>\n 	<li>High-quality blue-colored LCD screen operated with two optional programsoffers a clear and reliable display</li>\n 	<li>Manual adjustment can be conducted anytime during the programmed automatic operation; afterwards, the system automatically enters the programmed operation</li>\n 	<li>Green inner-cycling air purification system to efficiently adsorb, and remove, poisonous gas</li>\n 	<li>Imported high-quality parts, smooth operation, low noise, ergonomic design</li>\n</ul>\n<table dir=""ltr"" border=""1"" cellspacing=""0"" cellpadding=""0""><colgroup> <col width=""402"" /> <col width=""417"" /></colgroup>\n<tbody>\n<tr>\n<td data-sheets-value=""{&quot;1&quot;:2,&quot;2&quot;:&quot;Model&quot;}""><strong>Model</strong></td>\n<td data-sheets-value=""{&quot;1&quot;:2,&quot;2&quot;:&quot;YR428&quot;}"">YR428</td>\n</tr>\n<tr>\n<td data-sheets-value=""{&quot;1&quot;:2,&quot;2&quot;:&quot;Number of Cups&quot;}""><strong>Number of Cups</strong></td>\n<td data-sheets-value=""{&quot;1&quot;:2,&quot;2&quot;:&quot;12 (nine cups for reagents and three cups for paraffin)&quot;}"">12 (nine cups for reagents and three cups for paraffin)</td>\n</tr>\n<tr>\n<td data-sheets-value=""{&quot;1&quot;:2,&quot;2&quot;:&quot;Length of Processing Time&quot;}""><strong>Length of Processing Time</strong></td>\n<td data-sheets-value=""{&quot;1&quot;:2,&quot;2&quot;:&quot;Adjustable within 0-99 hours for the 1st station \\nand within 0-24 hours for other stations&quot;}"">Adjustable within 0-99 hours for the 1st station\nand within 0-24 hours for other stations</td>\n</tr>\n<tr>\n<td data-sheets-value=""{&quot;1&quot;:2,&quot;2&quot;:&quot;Temperature Range of Paraffin Cup&quot;}""><strong>Temperature Range of Paraffin Cup</strong></td>\n<td data-sheets-value=""{&quot;1&quot;:2,&quot;2&quot;:&quot;adjustable within RT – 99°; dual protection&quot;}"">adjustable within RT – 99°; dual protection</td>\n</tr>\n<tr>\n<td data-sheets-value=""{&quot;1&quot;:2,&quot;2&quot;:&quot;Heating Mechanism&quot;}""><strong>Heating Mechanism</strong></td>\n<td data-sheets-value=""{&quot;1&quot;:2,&quot;2&quot;:&quot;Internal dry heating automatically begins when \\nthe tissue enters the 2nd cup, thus avoiding unnecessary \\nenergy waste.&quot;}"">Internal dry heating automatically begins when\nthe tissue enters the 2nd cup, thus avoiding unnecessary\nenergy waste.</td>\n</tr>\n<tr>\n<td data-sheets-value=""{&quot;1&quot;:2,&quot;2&quot;:&quot;Capacity of Single Cup&quot;}""><strong>Capacity of Single Cup</strong></td>\n<td data-sheets-value=""{&quot;1&quot;:2,&quot;2&quot;:&quot;1000ml&quot;}"">1000ml</td>\n</tr>\n<tr>\n<td data-sheets-value=""{&quot;1&quot;:2,&quot;2&quot;:&quot;Temperature Control Precision&quot;}""><strong>Temperature Control Precision</strong></td>\n<td data-sheets-value=""{&quot;1&quot;:2,&quot;2&quot;:&quot;±1℃&quot;}"">±1℃</td>\n</tr>\n<tr>\n<td data-sheets-value=""{&quot;1&quot;:2,&quot;2&quot;:&quot;Dripping Time&quot;}""><strong>Dripping Time</strong></td>\n<td data-sheets-value=""{&quot;1&quot;:2,&quot;2&quot;:&quot;Adjustable within 10-60 s; shake/drip above cup&quot;}"">Adjustable within 10-60 s; shake/drip above cup</td>\n</tr>\n<tr>\n<td data-sheets-value=""{&quot;1&quot;:2,&quot;2&quot;:&quot;Frequency of Agitation&quot;}""><strong>Frequency of Agitation</strong></td>\n<td data-sheets-value=""{&quot;1&quot;:2,&quot;2&quot;:&quot;2 times/minute&quot;}"">2 times/minute</td>\n</tr>\n<tr>\n<td data-sheets-value=""{&quot;1&quot;:2,&quot;2&quot;:&quot;Battery backup&quot;}""><strong>Battery backup</strong></td>\n<td data-sheets-value=""{&quot;1&quot;:2,&quot;2&quot;:&quot;with more than 6 hours of continual running power&quot;}"">with more than 6 hours of continual running power</td>\n</tr>\n<tr>\n<td data-sheets-value=""{&quot;1&quot;:2,&quot;2&quot;:&quot;Acceptable Temperature Range of Operation Environment&quot;}""><strong>Acceptable Temperature Range of Operation Environment</strong></td>\n<td data-sheets-value=""{&quot;1&quot;:2,&quot;2&quot;:&quot;0 ~ 40℃&quot;}"">0 ~ 40℃</td>\n</tr>\n<tr>\n<td data-sheets-value=""{&quot;1&quot;:2,&quot;2&quot;:&quot;Working Voltage&quot;}""><strong>Working Voltage</strong></td>\n<td data-sheets-value=""{&quot;1&quot;:2,&quot;2&quot;:&quot;AC 220V±10% 50Hz (standard model); AC110V±10% 60Hz&quot;}"">AC 220V±10% 50Hz (standard model); AC110V±10% 60Hz</td>\n</tr>\n<tr>\n<td data-sheets-value=""{&quot;1&quot;:2,&quot;2&quot;:&quot;Power&quot;}""><strong>Power</strong></td>\n<td data-sheets-value=""{&quot;1&quot;:2,&quot;2&quot;:&quot;500W&quot;}"">500W</td>\n</tr>\n<tr>\n<td data-sheets-value=""{&quot;1&quot;:2,&quot;2&quot;:&quot;Dimensions&quot;}""><strong>Dimensions</strong></td>\n<td data-sheets-value=""{&quot;1&quot;:2,&quot;2&quot;:&quot;1010×420×450 mm (W×D×H)&quot;}"">1010×420×450 mm (W×D×H)</td>\n</tr>\n<tr>\n<td data-sheets-value=""{&quot;1&quot;:2,&quot;2&quot;:&quot;Net weight&quot;}""><strong>Net weight</strong></td>\n<td data-sheets-value=""{&quot;1&quot;:2,&quot;2&quot;:&quot;67 kg&quot;}"">67 kg</td>\n</tr>\n</tbody>\n</table>",,,taxable,,1,,,0,0,102,118,54,56,0,,,"5623,20","Laboratory sector > Pathological anatomy > Tissue processing",,,https://kalstein.net/en/wp-content/uploads/2022/09/YR428-Kalstein-K-1.jpg,,,,,,,,,0,,,,
