53436,variable,,"Precision Balance YR05600 // YR05602",1,0,visible,"<strong>Manufacturer</strong>: <em>Kalstein</em>\n\n<img class=""alignnone size-full wp-image-29188"" src=""https://kalstein.net/en/wp-content/uploads/2022/01/CE.jpg"" alt="""" width=""54"" height=""53"" />","<ul>\n 	<li style=""font-weight: 400"">Large range and high precision/Aluminum shell</li>\n 	<li style=""font-weight: 400"">LED(Green) / LCD</li>\n 	<li style=""font-weight: 400"">Tare function/Counting</li>\n 	<li style=""font-weight: 400"">Overload alarm/Level indicator</li>\n 	<li style=""font-weight: 400"">Option: Printer</li>\n</ul>\n<h6>Technical Specifications</h6>\n<table style=""border-collapse: collapse;width: 420pt;border-spacing: 0px;text-align: start"" border=""0"" width=""560"" cellspacing=""0"" cellpadding=""0"">\n<tbody>\n<tr style=""height: 28.5pt"">\n<td class=""xl64"" style=""height: 28.5pt;width: 60pt"" width=""80"" height=""38""><strong>Model</strong></td>\n<td class=""xl64"" style=""border-left: none;width: 60pt"" width=""80""><strong>Capacity</strong></td>\n<td class=""xl64"" style=""border-left: none;width: 60pt"" width=""80""><strong>Readability</strong></td>\n<td class=""xl64"" style=""border-left: none;width: 60pt"" width=""80""><strong>Repeatability</strong></td>\n<td class=""xl64"" style=""border-left: none;width: 60pt"" width=""80""><strong>Linearity</strong></td>\n<td class=""xl64"" style=""border-left: none;width: 60pt"" width=""80""><strong>Pan Size</strong></td>\n<td class=""xl64"" style=""border-left: none;width: 60pt"" width=""80""><strong>Stable Time</strong></td>\n</tr>\n<tr style=""height: 28.5pt"">\n<td class=""xl64"" style=""height: 28.5pt;border-top: none;width: 60pt"" width=""80"" height=""38""><strong>YR05600</strong></td>\n<td class=""xl64"" style=""border-top: none;border-left: none;width: 60pt"" width=""80"">3000g</td>\n<td class=""xl64"" style=""border-top: none;border-left: none;width: 60pt"" width=""80"">0.01g</td>\n<td class=""xl64"" style=""border-top: none;border-left: none;width: 60pt"" width=""80"">±0.02g</td>\n<td class=""xl64"" style=""border-top: none;border-left: none;width: 60pt"" width=""80"">±0.03g</td>\n<td class=""xl64"" style=""border-top: none;border-left: none;width: 60pt"" width=""80"">180x180mm</td>\n<td class=""xl64"" style=""border-top: none;border-left: none;width: 60pt"" width=""80"">≤3S</td>\n</tr>\n<tr style=""height: 28.5pt"">\n<td class=""xl64"" style=""height: 28.5pt;border-top: none;width: 60pt"" width=""80"" height=""38""><strong>YR05601</strong></td>\n<td class=""xl64"" style=""border-top: none;border-left: none;width: 60pt"" width=""80"">4000g</td>\n<td class=""xl64"" style=""border-top: none;border-left: none;width: 60pt"" width=""80"">0.01g</td>\n<td class=""xl64"" style=""border-top: none;border-left: none;width: 60pt"" width=""80"">±0.02g</td>\n<td class=""xl64"" style=""border-top: none;border-left: none;width: 60pt"" width=""80"">±0.03g</td>\n<td class=""xl64"" style=""border-top: none;border-left: none;width: 60pt"" width=""80"">180x180mm</td>\n<td class=""xl64"" style=""border-top: none;border-left: none;width: 60pt"" width=""80"">≤3S</td>\n</tr>\n<tr style=""height: 28.5pt"">\n<td class=""xl64"" style=""height: 28.5pt;border-top: none;width: 60pt"" width=""80"" height=""38""><strong>YR05602</strong></td>\n<td class=""xl64"" style=""border-top: none;border-left: none;width: 60pt"" width=""80"">5000g</td>\n<td class=""xl64"" style=""border-top: none;border-left: none;width: 60pt"" width=""80"">0.01g</td>\n<td class=""xl64"" style=""border-top: none;border-left: none;width: 60pt"" width=""80"">±0.02g</td>\n<td class=""xl64"" style=""border-top: none;border-left: none;width: 60pt"" width=""80"">±0.03g</td>\n<td class=""xl64"" style=""border-top: none;border-left: none;width: 60pt"" width=""80"">180x180mm</td>\n<td class=""xl64"" style=""border-top: none;border-left: none;width: 60pt"" width=""80"">≤3S</td>\n</tr>\n</tbody>\n</table>",,,taxable,,1,,,0,0,5,41,26,17,0,,,,"Laboratory sector > Balances > Precision Balance",,,https://kalstein.net/en/wp-content/uploads/2022/08/YR053525-IMG.png,,,,,,,,,0,Model,"YR05600, YR05601, YR05602",1,1,,,,
53906,simple,,"Tabletop High Speed Refrigerated Centrifuge YR137-1",1,0,visible,"<div class=""summary entry-summary"">\n<div class=""woocommerce-product-details__short-description"">\n\n<strong>Manufacturer</strong>: <em>Kalstein</em>\n\n<img class=""alignnone size-full wp-image-29188"" src=""https://kalstein.net/en/wp-content/uploads/2022/01/CE.jpg"" alt="""" width=""54"" height=""53"" />\n\n</div>\n</div>","This high-speed centrifuge’s max RCF is 30642g and its maximum speed is 21000rpm. About the control system, this YR126-1 model runs with a microcomputer control, a DC brushless motor, with a stable operation feature, it makes minimum noise and it has a high-speed accuracy. This refrigerated centrifuge works with French Tecumseh Compressor Unit, R404a. This means that this model meets up the environmental standards. Another great feature is that this is a programmable machine, so the operation data can be automatically stored. It also has a LED or LCD display with a touching panel, which makes the operation a lot easier. Other great features about this high-speed refrigerated centrifuge are:\n<ul>\n 	<li>Self-locking device</li>\n 	<li>Over-speed safety device.</li>\n 	<li>Over temperature safety device.</li>\n 	<li>Imbalance safety device.</li>\n 	<li>Automatic alarm device.</li>\n</ul>\nThe real-time conversation of speed and RCF is very convenient for operation. Finally, this model has 10 acceleration and deceleration level files for you to choose.\n\nAbout this model’s capacity, you should know that the maximum is 750mlx6. The temperature setting is from -20 to 40 degrees Celsius. The power supply is AC220V 50Hz 30A and the external dimensions are (LxWxH) 725mmx600mmx440mm with a net weight of 75Kg.\n<h6>Technical Specifications</h6>\n<table width=""441"">\n<tbody>\n<tr>\n<td width=""361""><strong>Model </strong></td>\n<td width=""80""><strong>YR137-1</strong></td>\n</tr>\n<tr>\n<td colspan=""2"" width=""441"">Microcomputer control, LCD large touch screen.</td>\n</tr>\n<tr>\n<td colspan=""2"">Rotor automatic recognition (optional)</td>\n</tr>\n<tr>\n<td colspan=""2"">Silastic sealed ring comfort to GMP.US FDA certificated</td>\n</tr>\n<tr>\n<td colspan=""2"" width=""441"">It has 10 files Of acceleration and deceleration level for\nyour choice</td>\n</tr>\n<tr>\n<td colspan=""2"" width=""441"">New electronical lock ensure the safety spin.\nThere are over-speed safety device, over-temperature safety device and automatic alarm device</td>\n</tr>\n<tr>\n<td colspan=""2"" width=""441"">Pre-programmed option and memory storage function</td>\n</tr>\n<tr>\n<td colspan=""2"" width=""441"">The chamber has large space. Many rotors are available and interchangeable</td>\n</tr>\n<tr>\n<td colspan=""2"" width=""441"">Silastic sealed ring comfort to GMP.US FDA certificated</td>\n</tr>\n<tr>\n<td colspan=""2"" width=""441"">When a substance is precipitated in a medium, it is accompanied by a diffusion phenomenon. The diffusion is unconditional and absolute. The smaller the particle size of the substance, the larger the range of diffusion. The sedimentation is subject to the external force. The interview is conditional, and the mass of the object is larger. The faster the sedimentation rate, the high-speed refrigerated centrifuge is available because some of the particles are too small to see the sedimentation process</td>\n</tr>\n</tbody>\n</table>",,,taxable,,1,,,0,0,130,91,72,66,0,,,"6351,84","Laboratory sector > Centrifuges > Refrigerated centrifuges",,,https://kalstein.net/en/wp-content/uploads/2022/11/YR137-1-img-1.png,,,,,,,,,0,,,,,,,,
54674,variable,,"Clinical Chemistry Reagents YRA1 // YRA14",1,0,visible,"<strong>Manufacturer: </strong><em>Kalstein</em>\n\n<img class=""alignnone size-full wp-image-29188"" src=""https://kalstein.net/en/wp-content/uploads/2022/01/CE.jpg"" alt="""" width=""54"" height=""53"" />","Laboratory chemical reagents are chemical substances used in laboratories to make determinations of the content of other substances, the distribution of the constituents of the sample, to perform analysis, synthesis and finally to be able to do research and scientific work.\n<p style=""background: white;""><span style=""font-family: 'Helvetica',sans-serif; color: #333333;""><strong>The blood lipid elements:</strong> TCH, TG, HDL-C LDL-C , APOA1, the APOB, Lp(a), HCY, TIR.</span></p>\n<p style=""background: white;""><span style=""font-family: 'Helvetica',sans-serif; color: #333333;""><strong>The elements of liver function:</strong> ALP, γ-GT, AST, ALT, TP, ALB, TBIL, DBIL, CHE, TBA, safe, ADA, 5'-NT, MAO, AFP, AMM, legs, ALC, GLDH.</span></p>\n<p style=""background: white;""><span style=""font-family: 'Helvetica',sans-serif; color: #333333;""><strong>Myocardium Zymogram elements:</strong> LDH, α-HBDH, CK-MB, CK, MB, ACE, LDHI, TNI, IMA.</span></p>\n<p style=""background: white;""><span style=""font-family: 'Helvetica',sans-serif; color: #333333;""><strong>The elements of renal function:</strong> UREA, UA, CREA, MALB, Cys-C, BMG, NAG, UTP, α1-MG, RBP.</span></p>\n<p style=""background: white;""><span style=""font-family: 'Helvetica',sans-serif; color: #333333;""><strong>Glyometabolism elements:</strong> GLU, SGP, HbA1c, D3H, LAC.</span></p>\n<p style=""background: white;""><span style=""font-family: 'Helvetica',sans-serif; color: #333333;""><strong>Pancreas elements:</strong> α-Amy, LPS.</span></p>\n<p style=""background: white;""><span style=""font-family: 'Helvetica',sans-serif; color: #333333;""><strong>Pepsinogen elements:</strong> PGI, PGI.</span></p>\n<p style=""background: white;""><span style=""font-family: 'Helvetica',sans-serif; color: #333333;""><strong>Blood gas electrolyte elements:</strong> CL, Ca, P, Mg, CO2, Na, K, Cu, Fe, Zn.</span></p>\n<p style=""background: white;""><span style=""font-family: 'Helvetica',sans-serif; color: #333333;""><strong>Rheumatism elements:</strong> RF, ASO, CRP.</span></p>\n<p style=""background: white;""><span style=""font-family: 'Helvetica',sans-serif; color: #333333;""><strong>The special protein elements:</strong> PALB, TRF, G6PD, DD3, C, C4, IgA, IgG, IgM, UIBC, CP.</span></p>\n<p style=""background: white;""><span style=""font-family: 'Helvetica',sans-serif; color: #333333;""><strong>Inspection of Hemagglutination topic:</strong> FB.</span></p>\n\n<h6>Technical Description:</h6>\n<table width=""740"">\n<tbody>\n<tr>\n<td width=""80"">Model</td>\n<td width=""152"">Specification (713)/Box</td>\n<td width=""80"">Package/Box</td>\n<td width=""348"">Method</td>\n<td width=""80"">Reagent test</td>\n</tr>\n<tr>\n<td>YRA1</td>\n<td>R1:48mlx2 R2:12mlx2</td>\n<td>120ml</td>\n<td>IFCC Recomendation Method</td>\n<td>ALT</td>\n</tr>\n<tr>\n<td>YRA2</td>\n<td>R1:48mlx2 R2:12mlx2</td>\n<td>120ml</td>\n<td>IFCC Recomendation Method</td>\n<td data-sheets-value=""{&quot;1&quot;:2,&quot;2&quot;:&quot;AST&quot;}"">AST</td>\n</tr>\n<tr>\n<td>YRA3</td>\n<td>R1:48mlx2 R2:16mlx2</td>\n<td>128ml</td>\n<td>SZASZ Method</td>\n<td data-sheets-value=""{&quot;1&quot;:2,&quot;2&quot;:&quot;GGT&quot;}"">GGT</td>\n</tr>\n<tr>\n<td>YRA4</td>\n<td>R:20mlx8</td>\n<td>160ml</td>\n<td>Bromocresol Green Method</td>\n<td data-sheets-value=""{&quot;1&quot;:2,&quot;2&quot;:&quot;ALB&quot;}"">ALB</td>\n</tr>\n<tr>\n<td>YRA5</td>\n<td>R1:48mlx2 R2:12mlx2</td>\n<td>120ml</td>\n<td>Diazo 2, 4-2 chloro aniline colorimetric</td>\n<td data-sheets-value=""{&quot;1&quot;:2,&quot;2&quot;:&quot;TBIL&quot;}"">TBIL</td>\n</tr>\n<tr>\n<td>YRA6</td>\n<td>R1:48mlx2 R2:12mlx2</td>\n<td>120ml</td>\n<td>Vanadate oxidation method</td>\n<td data-sheets-value=""{&quot;1&quot;:2,&quot;2&quot;:&quot;TBIL&quot;}"">TBIL</td>\n</tr>\n<tr>\n<td>YRA7</td>\n<td>R1:48mlx2 R2:16mlx2</td>\n<td>128ml</td>\n<td>Enzymatic Cycling Assay</td>\n<td data-sheets-value=""{&quot;1&quot;:2,&quot;2&quot;:&quot;TBA&quot;}"">TBA</td>\n</tr>\n<tr>\n<td>YRA8</td>\n<td>R1:48mlx2 R2:16mlx2</td>\n<td>128ml</td>\n<td>Urease - glutamate dehydrogenase enzyme hydrolysis</td>\n<td data-sheets-value=""{&quot;1&quot;:2,&quot;2&quot;:&quot;UREA&quot;}"">UREA</td>\n</tr>\n<tr>\n<td>YRA9</td>\n<td>R1:48mlx2 R2:16mlx2</td>\n<td>128ml</td>\n<td>Enzymatic Assay Method</td>\n<td data-sheets-value=""{&quot;1&quot;:2,&quot;2&quot;:&quot;CREA&quot;}"">CREA</td>\n</tr>\n<tr>\n<td>YRA10</td>\n<td>R1:48mlx2 R2:16mlx2</td>\n<td>128ml</td>\n<td>Enzymatic Assay Method</td>\n<td data-sheets-value=""{&quot;1&quot;:2,&quot;2&quot;:&quot;K&quot;}"">K</td>\n</tr>\n<tr>\n<td>YRA11</td>\n<td>R1:48mlx2 R2:16mlx2</td>\n<td>128ml</td>\n<td>Enzymatic Assay Method</td>\n<td data-sheets-value=""{&quot;1&quot;:2,&quot;2&quot;:&quot;Na&quot;}"">Na</td>\n</tr>\n<tr>\n<td>YRA12</td>\n<td>R:20mlx8</td>\n<td>160ml</td>\n<td>Mercuric Thiocyanate Method</td>\n<td data-sheets-value=""{&quot;1&quot;:2,&quot;2&quot;:&quot;CI&quot;}"">CI</td>\n</tr>\n<tr>\n<td>YRA13</td>\n<td>R1:48mlx2 R2:16mlx2</td>\n<td>120ml</td>\n<td>IFCC Recomendation Method</td>\n<td data-sheets-value=""{&quot;1&quot;:2,&quot;2&quot;:&quot;CK-MB&quot;}"">CK-MB</td>\n</tr>\n<tr>\n<td>YRA14</td>\n<td>R1:20mlx2 R2:20mlx2</td>\n<td>80ml</td>\n<td>Immuno Turbidimetric</td>\n<td data-sheets-value=""{&quot;1&quot;:2,&quot;2&quot;:&quot;CRP&quot;}"">CRP</td>\n</tr>\n</tbody>\n</table>",,,taxable,,1,,,0,0,,,,,0,,,,"Reagent & Consumables sector > Reagent > Clinical Chemistry Reagent",,,https://kalstein.net/en/wp-content/uploads/2022/12/YRA1-YRA14.jpg,,,,,,,,,0,Modelo,"YRA1, YRA10, YRA11, YRA12, YRA13, YRA14, YRA2, YRA3, YRA4, YRA5, YRA6, YRA7, YRA8, YRA9",1,1,,,,
54724,variable,,"Hematology Reagents YRA15 // YRA17",1,0,visible,"<strong>Manufacturer: </strong><em>Kalstein</em>\n\n<img class=""alignnone size-full wp-image-29188"" src=""https://kalstein.net/en/wp-content/uploads/2022/01/CE.jpg"" alt="""" width=""54"" height=""53"" />","Hematology reagents are indispensable in the use of hematology analyzer. Hematology reagents include hemolytic agents, diluents, cleaning solutions and concentrated cleaning solutions. Among them, hemolytic agent is used to destroy RBC, ensure WBC count, perform WBC classification and HGB detection; diluent is used to maintain the volume and shape of cells, and form a conductive environment; cleaning solution and concentrated cleaning solution are used for maintenance of pipes, needles, and counting pools And maintenance.\n\nKalstein offers a complete range of hematology reagents such as Diluent, lysing reagents and cleaners for the majority of hematology analyzers on the market including 3-part differential and 5-part differential models.\n<h6>Technical Description:</h6>\n<table width=""529"">\n<tbody>\n<tr>\n<td width=""289"">Model Item</td>\n<td width=""80"">YRA15</td>\n<td width=""80"">YRA16</td>\n<td width=""80"">YRA17</td>\n</tr>\n<tr>\n<td>Start up(ml)</td>\n<td>18</td>\n<td>15</td>\n<td>4</td>\n</tr>\n<tr>\n<td>Shut down(ml)</td>\n<td>18</td>\n<td colspan=""2"">0</td>\n</tr>\n<tr>\n<td>Per Test (ml)</td>\n<td>35</td>\n<td>10</td>\n<td>0,6</td>\n</tr>\n<tr>\n<td>Daily Sample</td>\n<td colspan=""3"">60</td>\n</tr>\n<tr>\n<td>Total Test Quantity per Year</td>\n<td colspan=""3"">21900</td>\n</tr>\n<tr>\n<td>Days</td>\n<td colspan=""3"">365</td>\n</tr>\n<tr>\n<td>Start up and shutdown consumption per year</td>\n<td>13140</td>\n<td>5475</td>\n<td>1460</td>\n</tr>\n<tr>\n<td>Test Consumption</td>\n<td>766500</td>\n<td>219000</td>\n<td>13140</td>\n</tr>\n<tr>\n<td>Reagent package needed per year</td>\n<td>39</td>\n<td>44,9</td>\n<td>29,2</td>\n</tr>\n<tr>\n<td>Aditional Information</td>\n<td><span data-sheets-value=""{&quot;1&quot;:2,&quot;2&quot;:&quot;Diluent 20L&quot;}"" data-sheets-userformat=""{&quot;2&quot;:14845,&quot;3&quot;:{&quot;1&quot;:0,&quot;3&quot;:1},&quot;5&quot;:{&quot;1&quot;:[{&quot;1&quot;:2,&quot;2&quot;:0,&quot;5&quot;:{&quot;1&quot;:2,&quot;2&quot;:0}},{&quot;1&quot;:0,&quot;2&quot;:0,&quot;3&quot;:3},{&quot;1&quot;:1,&quot;2&quot;:0,&quot;4&quot;:1}]},&quot;6&quot;:{&quot;1&quot;:[{&quot;1&quot;:2,&quot;2&quot;:0,&quot;5&quot;:{&quot;1&quot;:2,&quot;2&quot;:0}},{&quot;1&quot;:0,&quot;2&quot;:0,&quot;3&quot;:3},{&quot;1&quot;:1,&quot;2&quot;:0,&quot;4&quot;:1}]},&quot;7&quot;:{&quot;1&quot;:[{&quot;1&quot;:2,&quot;2&quot;:0,&quot;5&quot;:{&quot;1&quot;:2,&quot;2&quot;:0}},{&quot;1&quot;:0,&quot;2&quot;:0,&quot;3&quot;:3},{&quot;1&quot;:1,&quot;2&quot;:0,&quot;4&quot;:1}]},&quot;8&quot;:{&quot;1&quot;:[{&quot;1&quot;:2,&quot;2&quot;:0,&quot;5&quot;:{&quot;1&quot;:2,&quot;2&quot;:0}},{&quot;1&quot;:0,&quot;2&quot;:0,&quot;3&quot;:3},{&quot;1&quot;:1,&quot;2&quot;:0,&quot;4&quot;:1}]},&quot;9&quot;:1,&quot;10&quot;:1,&quot;11&quot;:4,&quot;14&quot;:{&quot;1&quot;:3,&quot;3&quot;:1},&quot;15&quot;:&quot;Arial&quot;,&quot;16&quot;:10}"">Diluent 20L</span></td>\n<td><span data-sheets-value=""{&quot;1&quot;:2,&quot;2&quot;:&quot;Cleaner 5L&quot;}"" data-sheets-userformat=""{&quot;2&quot;:14845,&quot;3&quot;:{&quot;1&quot;:0,&quot;3&quot;:1},&quot;5&quot;:{&quot;1&quot;:[{&quot;1&quot;:2,&quot;2&quot;:0,&quot;5&quot;:{&quot;1&quot;:2,&quot;2&quot;:0}},{&quot;1&quot;:0,&quot;2&quot;:0,&quot;3&quot;:3},{&quot;1&quot;:1,&quot;2&quot;:0,&quot;4&quot;:1}]},&quot;6&quot;:{&quot;1&quot;:[{&quot;1&quot;:2,&quot;2&quot;:0,&quot;5&quot;:{&quot;1&quot;:2,&quot;2&quot;:0}},{&quot;1&quot;:0,&quot;2&quot;:0,&quot;3&quot;:3},{&quot;1&quot;:1,&quot;2&quot;:0,&quot;4&quot;:1}]},&quot;7&quot;:{&quot;1&quot;:[{&quot;1&quot;:2,&quot;2&quot;:0,&quot;5&quot;:{&quot;1&quot;:2,&quot;2&quot;:0}},{&quot;1&quot;:0,&quot;2&quot;:0,&quot;3&quot;:3},{&quot;1&quot;:1,&quot;2&quot;:0,&quot;4&quot;:1}]},&quot;8&quot;:{&quot;1&quot;:[{&quot;1&quot;:2,&quot;2&quot;:0,&quot;5&quot;:{&quot;1&quot;:2,&quot;2&quot;:0}},{&quot;1&quot;:0,&quot;2&quot;:0,&quot;3&quot;:3},{&quot;1&quot;:1,&quot;2&quot;:0,&quot;4&quot;:1}]},&quot;9&quot;:1,&quot;10&quot;:1,&quot;11&quot;:4,&quot;14&quot;:{&quot;1&quot;:3,&quot;3&quot;:1},&quot;15&quot;:&quot;Arial&quot;,&quot;16&quot;:10}"">Cleaner 5L</span></td>\n<td><span data-sheets-value=""{&quot;1&quot;:2,&quot;2&quot;:&quot;Lyse 500mL&quot;}"" data-sheets-userformat=""{&quot;2&quot;:14845,&quot;3&quot;:{&quot;1&quot;:0,&quot;3&quot;:1},&quot;5&quot;:{&quot;1&quot;:[{&quot;1&quot;:2,&quot;2&quot;:0,&quot;5&quot;:{&quot;1&quot;:2,&quot;2&quot;:0}},{&quot;1&quot;:0,&quot;2&quot;:0,&quot;3&quot;:3},{&quot;1&quot;:1,&quot;2&quot;:0,&quot;4&quot;:1}]},&quot;6&quot;:{&quot;1&quot;:[{&quot;1&quot;:2,&quot;2&quot;:0,&quot;5&quot;:{&quot;1&quot;:2,&quot;2&quot;:0}},{&quot;1&quot;:0,&quot;2&quot;:0,&quot;3&quot;:3},{&quot;1&quot;:1,&quot;2&quot;:0,&quot;4&quot;:1}]},&quot;7&quot;:{&quot;1&quot;:[{&quot;1&quot;:2,&quot;2&quot;:0,&quot;5&quot;:{&quot;1&quot;:2,&quot;2&quot;:0}},{&quot;1&quot;:0,&quot;2&quot;:0,&quot;3&quot;:3},{&quot;1&quot;:1,&quot;2&quot;:0,&quot;4&quot;:1}]},&quot;8&quot;:{&quot;1&quot;:[{&quot;1&quot;:2,&quot;2&quot;:0,&quot;5&quot;:{&quot;1&quot;:2,&quot;2&quot;:0}},{&quot;1&quot;:0,&quot;2&quot;:0,&quot;3&quot;:3},{&quot;1&quot;:1,&quot;2&quot;:0,&quot;4&quot;:1}]},&quot;9&quot;:1,&quot;10&quot;:1,&quot;11&quot;:4,&quot;14&quot;:{&quot;1&quot;:3,&quot;3&quot;:1},&quot;15&quot;:&quot;Arial&quot;,&quot;16&quot;:10}"">Lyse 500mL</span></td>\n</tr>\n<tr>\n<td colspan=""4"">Note: Probe cleaner is used as maintenance reagent. The total consumption should be estimated</td>\n</tr>\n</tbody>\n</table>",,,taxable,,1,,,0,0,'-,'-,'-,'-,0,,,,"Reagent & Consumables sector > Reagent > Hematology Reagent",,,"https://kalstein.net/en/wp-content/uploads/2022/12/YRA17-1.jpg, https://kalstein.net/en/wp-content/uploads/2022/12/YRA15.jpg, https://kalstein.net/en/wp-content/uploads/2022/12/YRA17.jpg, https://kalstein.net/en/wp-content/uploads/2022/12/YRA16.jpg",,,,,,,,,0,Modelo,"YRA15, YRA16, YRA17",1,1,,,,
54733,simple,,"Hematology Reagents Package YRA17-1",1,0,visible,"<strong>Manufacturer: </strong><em>Kalstein</em>\n\n<img class=""alignnone size-full wp-image-29188"" src=""https://kalstein.net/en/wp-content/uploads/2022/01/CE.jpg"" alt="""" width=""54"" height=""53"" />","Hematology reagents are indispensable in the use of hematology analyzer. Hematology reagents include hemolytic agents, diluents, cleaning solutions and concentrated cleaning solutions. Among them, hemolytic agent is used to destroy RBC, ensure WBC count, perform WBC classification and HGB detection; diluent is used to maintain the volume and shape of cells, and form a conductive environment; cleaning solution and concentrated cleaning solution are used for maintenance of pipes, needles, and counting pools And maintenance.\n\nKalstein offers a complete range of hematology reagents such as Diluent, lysing reagents and cleaners for the majority of hematology analyzers on the market including 3-part differential and 5-part differential models.\n<h6>Technical Description:</h6>\n<table width=""529"">\n<tbody>\n<tr>\n<td width=""289"">Model Item</td>\n<td colspan=""3"" width=""240"">YRA17-1</td>\n</tr>\n<tr>\n<td>Start up(ml)</td>\n<td colspan=""3"">18 / 15 / 4</td>\n</tr>\n<tr>\n<td>Shut down(ml)</td>\n<td colspan=""3"">18 / 0 / 0</td>\n</tr>\n<tr>\n<td>Per Test (ml)</td>\n<td colspan=""3"">35 / 10 / 0,6</td>\n</tr>\n<tr>\n<td>Daily Sample</td>\n<td colspan=""3"">60</td>\n</tr>\n<tr>\n<td>Total Test Quantity per Year</td>\n<td colspan=""3"">21900</td>\n</tr>\n<tr>\n<td>Days</td>\n<td colspan=""3"">365</td>\n</tr>\n<tr>\n<td>Start up and shutdown consumption per year</td>\n<td colspan=""3"">13140 / 5475 / 1460</td>\n</tr>\n<tr>\n<td>Test Consumption</td>\n<td colspan=""3"">766500 / 219000 / 13140</td>\n</tr>\n<tr>\n<td>Reagent package needed per year</td>\n<td colspan=""3"">39 / 44,9 / 29,2</td>\n</tr>\n<tr>\n<td>Aditional Information</td>\n<td colspan=""3""><span data-sheets-value=""{&quot;1&quot;:2,&quot;2&quot;:&quot;Diluent 20L&quot;}"" data-sheets-userformat=""{&quot;2&quot;:14845,&quot;3&quot;:{&quot;1&quot;:0,&quot;3&quot;:1},&quot;5&quot;:{&quot;1&quot;:[{&quot;1&quot;:2,&quot;2&quot;:0,&quot;5&quot;:{&quot;1&quot;:2,&quot;2&quot;:0}},{&quot;1&quot;:0,&quot;2&quot;:0,&quot;3&quot;:3},{&quot;1&quot;:1,&quot;2&quot;:0,&quot;4&quot;:1}]},&quot;6&quot;:{&quot;1&quot;:[{&quot;1&quot;:2,&quot;2&quot;:0,&quot;5&quot;:{&quot;1&quot;:2,&quot;2&quot;:0}},{&quot;1&quot;:0,&quot;2&quot;:0,&quot;3&quot;:3},{&quot;1&quot;:1,&quot;2&quot;:0,&quot;4&quot;:1}]},&quot;7&quot;:{&quot;1&quot;:[{&quot;1&quot;:2,&quot;2&quot;:0,&quot;5&quot;:{&quot;1&quot;:2,&quot;2&quot;:0}},{&quot;1&quot;:0,&quot;2&quot;:0,&quot;3&quot;:3},{&quot;1&quot;:1,&quot;2&quot;:0,&quot;4&quot;:1}]},&quot;8&quot;:{&quot;1&quot;:[{&quot;1&quot;:2,&quot;2&quot;:0,&quot;5&quot;:{&quot;1&quot;:2,&quot;2&quot;:0}},{&quot;1&quot;:0,&quot;2&quot;:0,&quot;3&quot;:3},{&quot;1&quot;:1,&quot;2&quot;:0,&quot;4&quot;:1}]},&quot;9&quot;:1,&quot;10&quot;:1,&quot;11&quot;:4,&quot;14&quot;:{&quot;1&quot;:3,&quot;3&quot;:1},&quot;15&quot;:&quot;Arial&quot;,&quot;16&quot;:10}"">Diluent 20L / Cleaner 5L / Lyse 500ml / Concentration Cleaner 50ml</span></td>\n</tr>\n<tr>\n<td colspan=""4"">Note: Probe cleaner is used as maintenance reagent. The total consumption should be estimated</td>\n</tr>\n</tbody>\n</table>",,,taxable,,1,,,0,0,34,58,34,34,0,,,"158,40","Reagent & Consumables sector > Reagent > Hematology Reagent Package",,,https://kalstein.net/en/wp-content/uploads/2022/12/YRA17-1.jpg,,,,,,,,,0,,,,,,,,
