53115,simple,,"Geautomatiseerde weefselprocessor YR429",1,0,visible,"<span class=""col-xs-9 marca""><strong>Fabrikant:</strong> Kalstein</span>\n<div class=""col-xs-3 text-center logo_ce""></div>","YR429 Automated Tissue Processor wordt voornamelijk gebruikt in middelste laboratoria om specimens te verwerken om de kwaliteitssecties te verbeteren. Het maximum aantal verwerkte exemplaren is 80 per keer. Het is populair in de markt vanwege zijn ruimtebesparende en eenvoudige bediening.\n<ul>\n 	<li>APS-gecoat, gestroomlijnd-ontworpen, gemakkelijk-aan-schone, stevige behuizing met hoge weerstand tegen corrosie</li>\n 	<li>Geïmporteerde hoogwaardige onderdelen, soepele werking, laag geluid, ergonomisch ontwerp</li>\n 	<li>20 bewerkbare programma's kunnen in het systeem worden opgeslagen</li>\n 	<li>Geïntegreerd lcd-scherm van hoge kwaliteit met intuïtieve tweetalige (Chinees/Engels) software biedt een helder scherm en eenvoudige bediening. window-scrolling/flipping human-machine conversatie interface biedt duidelijke instructies voor elke stap (online help)</li>\n 	<li>Volledig intelligent ontwerp maakt tijdige bepaling en automatisch herstel van een abnormale gebeurtenis mogelijk</li>\n 	<li>Real-time visuele simulatie met pictogrammen geeft de werkstatus dynamisch, duidelijk en intuïtief weer</li>\n 	<li>Groen inwendig-cyclisch luchtzuiveringssysteem om giftig gas efficiënt te adsorberen en te verwijderen; milieuvriendelijke en veilige gaszuiveringsinstallatie</li>\n 	<li>Dit systeem kan automatisch op elk gewenst moment worden gestart</li>\n 	<li>De duur van de verwerking wordt automatisch berekend en op het scherm getoond, toestaand gebruiker om een efficiënter werkplan te maken</li>\n 	<li>Handmatige afstelling kan op elk moment tijdens de geprogrammeerde automatische werking plaatsvinden; daarna, gaat het systeem automatisch de geprogrammeerde verrichting in</li>\n 	<li>Automatische ventilatorbesturing: Blijft ""aan""de hele tijd wanneer de monsters niet in beker worden ondergedompeld en komt op 10 seconden elke minuut wanneer de monsters in beker en in verwerking worden ondergedompeld</li>\n 	<li>Intern mechanisme voor droge verwarming met temperatuurregeling met hoge precisie</li>\n 	<li>Stroombesparende besturingsschakeling met stroombeschermingsfunctie.</li>\n 	<li>Bij een stroomuitval wordt het scherm normaal weergegeven met een schuifbalk die de status ""aan"" van het stroombeveiligingssysteem aangeeft.</li>\n 	<li>Batterijback-up met meer dan 30 uur stroomverbruik</li>\n 	<li>Ongeveer 100 weefselmonsters kunnen tegelijkertijd gedehydrateerd worden</li>\n</ul>\n<table dir=""ltr"" border=""1"" cellspacing=""0"" cellpadding=""0""><colgroup> <col width=""271"" /> <col width=""398"" /></colgroup>\n<tbody>\n<tr>\n<td data-sheets-value=""{&quot;1&quot;:2,&quot;2&quot;:&quot;Model&quot;}""><strong>Model</strong></td>\n<td data-sheets-value=""{&quot;1&quot;:2,&quot;2&quot;:&quot;YR429&quot;}""><strong>YR429</strong></td>\n</tr>\n<tr>\n<td data-sheets-value=""{&quot;1&quot;:2,&quot;2&quot;:&quot;Number of Cups&quot;}""><strong>Aantal bekers</strong></td>\n<td data-sheets-value=""{&quot;1&quot;:2,&quot;2&quot;:&quot;12 (9 for reagents, and the cups at the 10th, 11th, and 12th \\nstations are used for paraffin melting)&quot;}"">12 (9 voor reagentia, en de kopjes op de 10e, 11e en 12e stations worden gebruikt voor het smelten van paraffine)</td>\n</tr>\n<tr>\n<td data-sheets-value=""{&quot;1&quot;:2,&quot;2&quot;:&quot;Capacity of Each Cup&quot;}""><strong>Capaciteit van elke beker</strong></td>\n<td data-sheets-value=""{&quot;1&quot;:2,&quot;2&quot;:&quot;1500ml&quot;}"">1500ml</td>\n</tr>\n<tr>\n<td data-sheets-value=""{&quot;1&quot;:2,&quot;2&quot;:&quot;Length of Processing Time in the Cup&quot;}""><strong>Verwerkingsduur in de beker</strong></td>\n<td data-sheets-value=""{&quot;1&quot;:2,&quot;2&quot;:&quot;Any length for the first cup (Extended Time)\\nAny length between 0 and 24 hours for the other cups&quot;}"">Elke lengte voor de eerste beker (verlengde tijd)\nElke lengte tussen 0 en 24 uur voor de andere bekers</td>\n</tr>\n<tr>\n<td data-sheets-value=""{&quot;1&quot;:2,&quot;2&quot;:&quot;Temperature Range&quot;}""><strong>Temperatuurbereik</strong></td>\n<td data-sheets-value=""{&quot;1&quot;:2,&quot;2&quot;:&quot;RT – 80℃&quot;}"">RT – 80℃</td>\n</tr>\n<tr>\n<td data-sheets-value=""{&quot;1&quot;:2,&quot;2&quot;:&quot;Dripping Time&quot;}""><strong>Druppeltijd</strong></td>\n<td data-sheets-value=""{&quot;1&quot;:2,&quot;2&quot;:&quot;Adjustable within 10-60 s; shake/drip above cup&quot;}"">instelbaar binnen 10-60 s; schudden/druppelen boven de beker</td>\n</tr>\n<tr>\n<td data-sheets-value=""{&quot;1&quot;:2,&quot;2&quot;:&quot;Frequency of Agitation&quot;}""><strong>Agitatiefrequentie</strong></td>\n<td data-sheets-value=""{&quot;1&quot;:2,&quot;2&quot;:&quot;Adjustable within 0-6 times/minute&quot;}"">Verstelbaar binnen 0-6 keer/minuut</td>\n</tr>\n<tr>\n<td data-sheets-value=""{&quot;1&quot;:2,&quot;2&quot;:&quot;Tissue Protection Station&quot;}""><strong>Weefselbeschermingsstation</strong></td>\n<td data-sheets-value=""{&quot;1&quot;:2,&quot;2&quot;:&quot;any station from the 1st to 7th station as preset&quot;}"">elk station van het 1e tot het 7e station zoals vooraf ingesteld</td>\n</tr>\n<tr>\n<td data-sheets-value=""{&quot;1&quot;:2,&quot;2&quot;:&quot;Working Voltage&quot;}""><strong>Werkspanning</strong></td>\n<td data-sheets-value=""{&quot;1&quot;:2,&quot;2&quot;:&quot;AC220V±10% 50Hz (standard model); AC110V±10% 60Hz&quot;}"">AC220V±10% 50Hz (standaardmodel);AC110V±10% 60Hz</td>\n</tr>\n<tr>\n<td data-sheets-value=""{&quot;1&quot;:2,&quot;2&quot;:&quot;Power&quot;}""><strong>Vermogen</strong></td>\n<td data-sheets-value=""{&quot;1&quot;:2,&quot;2&quot;:&quot;500 W&quot;}"">500 W</td>\n</tr>\n<tr>\n<td data-sheets-value=""{&quot;1&quot;:2,&quot;2&quot;:&quot;Dimensions&quot;}""><strong>Afmetingen</strong></td>\n<td data-sheets-value=""{&quot;1&quot;:2,&quot;2&quot;:&quot;1055×480×495 mm (W×D×H)&quot;}"">1055×480×495 mm (W×D×H)</td>\n</tr>\n<tr>\n<td data-sheets-value=""{&quot;1&quot;:2,&quot;2&quot;:&quot;Net weight&quot;}""><strong>Nettogewicht</strong></td>\n<td data-sheets-value=""{&quot;1&quot;:2,&quot;2&quot;:&quot;75 kg&quot;}"">75 kg</td>\n</tr>\n</tbody>\n</table>",,,taxable,,1,,,0,0,113,122,62,62,0,,,"6553,80","Laboratory sector > Pathological anatomy > Tissue processing",,,https://kalstein.net/en/wp-content/uploads/2022/09/YR429-Kalstein-K-1.jpg,,,,,,,,,0,,,,
53119,simple,,"Water Bath YR449",1,0,visible,"<span class=""col-xs-9 marca""><strong>Manufacturer:</strong> Kalstein</span>\n<div class=""col-xs-3 text-center logo_ce""><img title="" Certificacion europea "" src=""https://kalstein.eu/templates/kalstein/images//CE.jpg"" alt=""Certificacion europea"" width=""54"" height=""53"" border=""0"" /></div>","High-quality water bath with keyboard control, microcomputer automatic memory and digital tube display.\n<ul>\n 	<li>Quick heating, long lifespan and energy saving, due to the use of a new-type heating element;</li>\n 	<li>Both actual and preset temperatures are displayed;</li>\n 	<li>Automatic memory and restoration functions: After startup, all preset temperature data are automatically stored in the system;</li>\n 	<li>Special black surface material characterized by its strong resistance to abrasion and corrosion.</li>\n</ul>\n<table dir=""ltr"" border=""1"" cellspacing=""0"" cellpadding=""0""><colgroup> <col width=""208"" /> <col width=""360"" /></colgroup>\n<tbody>\n<tr>\n<td data-sheets-value=""{&quot;1&quot;:2,&quot;2&quot;:&quot;Model&quot;}""><strong>Model</strong></td>\n<td data-sheets-value=""{&quot;1&quot;:2,&quot;2&quot;:&quot;YR449&quot;}"">YR449</td>\n</tr>\n<tr>\n<td data-sheets-value=""{&quot;1&quot;:2,&quot;2&quot;:&quot;Temperature Range&quot;}""><strong>Temperature Range</strong></td>\n<td data-sheets-value=""{&quot;1&quot;:2,&quot;2&quot;:&quot;Continuously adjusted in a range of RT to 90℃ \\nand maintained automatically&quot;}"">Continuously adjusted in a range of RT to 90℃\nand maintained automatically</td>\n</tr>\n<tr>\n<td data-sheets-value=""{&quot;1&quot;:2,&quot;2&quot;:&quot;Temperature Control Precision&quot;}""><strong>Temperature Control Precision</strong></td>\n<td data-sheets-value=""{&quot;1&quot;:2,&quot;2&quot;:&quot;±1℃&quot;}"">±1℃</td>\n</tr>\n<tr>\n<td data-sheets-value=""{&quot;1&quot;:2,&quot;2&quot;:&quot;Dimensions of Water Bath Dish&quot;}""><strong>Dimensions of Water Bath Dish</strong></td>\n<td data-sheets-value=""{&quot;1&quot;:2,&quot;2&quot;:&quot;240×180×50mm(W×D×H)&quot;}"">240×180×50mm(W×D×H)</td>\n</tr>\n<tr>\n<td data-sheets-value=""{&quot;1&quot;:2,&quot;2&quot;:&quot;Working Voltage&quot;}""><strong>Working Voltage</strong></td>\n<td data-sheets-value=""{&quot;1&quot;:2,&quot;2&quot;:&quot;AC 220V±10% 50Hz (standard model) AC 110V±10% 60Hz&quot;}"">AC 220V±10% 50Hz (standard model) AC 110V±10% 60Hz</td>\n</tr>\n<tr>\n<td data-sheets-value=""{&quot;1&quot;:2,&quot;2&quot;:&quot;Power&quot;}""><strong>Power</strong></td>\n<td data-sheets-value=""{&quot;1&quot;:2,&quot;2&quot;:&quot;200W&quot;}"">200W</td>\n</tr>\n<tr>\n<td data-sheets-value=""{&quot;1&quot;:2,&quot;2&quot;:&quot;Dimensions&quot;}""><strong>Dimensions</strong></td>\n<td data-sheets-value=""{&quot;1&quot;:2,&quot;2&quot;:&quot;360×350×120mm(W×D×H)&quot;}"">360×350×120mm(W×D×H)</td>\n</tr>\n<tr>\n<td data-sheets-value=""{&quot;1&quot;:2,&quot;2&quot;:&quot;Net Weight&quot;}""><strong>Net Weight</strong></td>\n<td data-sheets-value=""{&quot;1&quot;:2,&quot;2&quot;:&quot;5kg&quot;}"">5kg</td>\n</tr>\n</tbody>\n</table>",,,taxable,,1,,,0,0,6,41,41,19,0,,,"712,80","Laboratory sector > Pathological anatomy > Tissue water bath",,,https://kalstein.net/en/wp-content/uploads/2022/09/YR449-Kalstein-K-1.jpg,,,,,,,,,0,,,,
53121,simple,,"Slide Dryer YR451",1,0,visible,"<div><strong>Manufacturer:</strong> Kalstein</div>\n<div class=""col-xs-3 text-center logo_ce""><img title="" Certificacion europea "" src=""https://kalstein.eu/templates/kalstein/images//CE.jpg"" alt=""Certificacion europea"" width=""54"" height=""53"" border=""0"" /></div>","High-quality water bath with keyboard control, microcomputer automatic memory, LED lighting, and digital tube display.\n<ul>\n 	<li>Pure-green digital displayfor real-time direct monitoring of heating temperature, clear and easy to operate; all parameters including preset temperatures, working temperatures, and wording status are real-time displayed</li>\n 	<li>Temperature is automatically program-controlled by single-chip microprocessors made in USA</li>\n 	<li>This device featured with multiple functions and its easy setting operation can meet the needs of different users as much as possible</li>\n 	<li>DC low-voltage illuminating system and removable transparent heating dish: easy operation and convenient observation</li>\n 	<li>New heating mechanism using a new-type high-thermal-conductivity heating element provides even and quick heating</li>\n 	<li> PID-controlled</li>\n 	<li>Triple temperature controls</li>\n 	<li>long lifespan, safe, reliable and energy-saving</li>\n 	<li>Temperature is precisely and reliably measured by temperature-sensing integrated blocks made in USA, and all settings are automatically stored in the system</li>\n 	<li>The surface of the temperature-controlling probes is made with special black material to enable strong resistance to abrasion and corrosion, fast conductivity, and real-time measurement</li>\n 	<li>Automatic memory and restoration functions: After startup, all preset temperature data are automatically stored in the system.</li>\n</ul>\n<table dir=""ltr"" border=""1"" cellspacing=""0"" cellpadding=""0""><colgroup> <col width=""212"" /> <col width=""345"" /></colgroup>\n<tbody>\n<tr>\n<td data-sheets-value=""{&quot;1&quot;:2,&quot;2&quot;:&quot;Model&quot;}""><strong>Model</strong></td>\n<td data-sheets-value=""{&quot;1&quot;:2,&quot;2&quot;:&quot;YR451&quot;}"">YR451</td>\n</tr>\n<tr>\n<td data-sheets-value=""{&quot;1&quot;:2,&quot;2&quot;:&quot;Dimensions of bath bowl&quot;}""><strong>Dimensions of bath bowl</strong></td>\n<td data-sheets-value=""{&quot;1&quot;:2,&quot;2&quot;:&quot;350mm×220mm×45mm&quot;}"">350mm×220mm×45mm</td>\n</tr>\n<tr>\n<td data-sheets-value=""{&quot;1&quot;:2,&quot;2&quot;:&quot;Temperature range&quot;}""><strong>Temperature range</strong></td>\n<td data-sheets-value=""{&quot;1&quot;:2,&quot;2&quot;:&quot;0 – 85℃&quot;}"">0 – 85℃</td>\n</tr>\n<tr>\n<td data-sheets-value=""{&quot;1&quot;:2,&quot;2&quot;:&quot;Temperature Control Precision&quot;}""><strong>Temperature Control Precision</strong></td>\n<td data-sheets-value=""{&quot;1&quot;:2,&quot;2&quot;:&quot;±1℃&quot;}"">±1℃</td>\n</tr>\n<tr>\n<td data-sheets-value=""{&quot;1&quot;:2,&quot;2&quot;:&quot;Working Voltage&quot;}""><strong>Working Voltage</strong></td>\n<td data-sheets-value=""{&quot;1&quot;:2,&quot;2&quot;:&quot;AC 220V±10% 50Hz (standard model); AC110V±10% 60Hz&quot;}"">AC 220V±10% 50Hz (standard model); AC110V±10% 60Hz</td>\n</tr>\n<tr>\n<td data-sheets-value=""{&quot;1&quot;:2,&quot;2&quot;:&quot;Power&quot;}""><strong>Power</strong></td>\n<td data-sheets-value=""{&quot;1&quot;:2,&quot;2&quot;:&quot;400W&quot;}"">400W</td>\n</tr>\n<tr>\n<td data-sheets-value=""{&quot;1&quot;:2,&quot;2&quot;:&quot;Dimensions&quot;}""><strong>Dimensions</strong></td>\n<td data-sheets-value=""{&quot;1&quot;:2,&quot;2&quot;:&quot;515×420×150mm(W×D×H)&quot;}"">515×420×150mm(W×D×H)</td>\n</tr>\n<tr>\n<td data-sheets-value=""{&quot;1&quot;:2,&quot;2&quot;:&quot;Net weight&quot;}""><strong>Net weight</strong></td>\n<td data-sheets-value=""{&quot;1&quot;:2,&quot;2&quot;:&quot;9kg&quot;}"">9kg</td>\n</tr>\n</tbody>\n</table>",,,taxable,,1,,,0,0,11,60,50,25,0,,,"1405,80","Laboratory sector > Pathological anatomy > Tissue Flotation",,,https://kalstein.net/en/wp-content/uploads/2022/09/YR451-Kalstein-K-1.jpg,,,,,,,,,0,,,,
53122,simple,,"Flotation work station YR452",1,0,visible,"<span class=""col-xs-9 marca""><strong>Manufacturer:</strong> Kalstein</span>\n<div class=""col-xs-3 text-center logo_ce""><img title="" Certificacion europea "" src=""https://kalstein.eu/templates/kalstein/images//CE.jpg"" alt=""Certificacion europea"" width=""54"" height=""53"" border=""0"" /></div>","High-quality Tissue flotation station YR452 with keyboard control, microcomputer automatic memory, LED lighting, and digital tube display.\n<ul>\n 	<li>Pure-green digital screen for real-time monitoring of heating temperature, direct and clear, easy to operate; all parameters including preset temperatures, working temperatures, and wording status are real-time displayed</li>\n 	<li>Temperature is automatically program-controlled by single-chip microprocessors made in USA</li>\n 	<li>This device features multiple functions and its easy setting operation can meet the needs of different users</li>\n 	<li>DC low-voltage illuminating system and removable transparent heating dish: easy operation and convenient observation</li>\n 	<li>New heating mechanism using a new-type high-thermal-conductivity heating element provides even and quick heating</li>\n 	<li>PID-controlled</li>\n 	<li>Riple temperature controls</li>\n 	<li>long lifespan, safe, reliable and energy-saving</li>\n 	<li>Temperature is precisely measured by temperature-sensing integrated blocks made in USA, and all settings are automatically stored in the system</li>\n 	<li>Special temperature-control and monitoring system characterized by strong resistance to abrasion and corrosion to ensure temperature precise</li>\n 	<li>Automatic memory and restoration functions: After startup, all preset temperature data are automatically stored in the system</li>\n 	<li>Temperatures for floating and drying slides are individually controlled</li>\n</ul>\n<table dir=""ltr"" border=""1"" cellspacing=""0"" cellpadding=""0""><colgroup> <col width=""192"" /> <col width=""345"" /></colgroup>\n<tbody>\n<tr>\n<td data-sheets-value=""{&quot;1&quot;:2,&quot;2&quot;:&quot;Model&quot;}""><strong>Model</strong></td>\n<td data-sheets-value=""{&quot;1&quot;:2,&quot;2&quot;:&quot;YR452&quot;}"">YR452</td>\n</tr>\n<tr>\n<td data-sheets-value=""{&quot;1&quot;:2,&quot;2&quot;:&quot;Temperature Range&quot;}""><strong>Temperature Range</strong></td>\n<td data-sheets-value=""{&quot;1&quot;:2,&quot;2&quot;:&quot;RT- 75℃&quot;}"">RT- 75℃</td>\n</tr>\n<tr>\n<td data-sheets-value=""{&quot;1&quot;:2,&quot;2&quot;:&quot;Temperature Control Precision&quot;}""><strong>Temperature Control Precision</strong></td>\n<td data-sheets-value=""{&quot;1&quot;:2,&quot;2&quot;:&quot;±1℃&quot;}"">±1℃</td>\n</tr>\n<tr>\n<td data-sheets-value=""{&quot;1&quot;:2,&quot;2&quot;:&quot;Dimensions of Water Bath Dish&quot;}""><strong>Dimensions of Water Bath Dish</strong></td>\n<td data-sheets-value=""{&quot;1&quot;:2,&quot;2&quot;:&quot;350×220×45mm(W×D×H)&quot;}"">350×220×45mm(W×D×H)</td>\n</tr>\n<tr>\n<td data-sheets-value=""{&quot;1&quot;:2,&quot;2&quot;:&quot;Dimensions of Drying Station&quot;}""><strong>Dimensions of Drying Station</strong></td>\n<td data-sheets-value=""{&quot;1&quot;:2,&quot;2&quot;:&quot;330mm×90mm&quot;}"">330mm×90mm</td>\n</tr>\n<tr>\n<td data-sheets-value=""{&quot;1&quot;:2,&quot;2&quot;:&quot;Working Voltage&quot;}""><strong>Working Voltage</strong></td>\n<td data-sheets-value=""{&quot;1&quot;:2,&quot;2&quot;:&quot;AC220V±10% 50Hz (standard model); AC110V±10% 60Hz&quot;}"">AC220V±10% 50Hz (standard model); AC110V±10% 60Hz</td>\n</tr>\n<tr>\n<td data-sheets-value=""{&quot;1&quot;:2,&quot;2&quot;:&quot;Power&quot;}""><strong>Power</strong></td>\n<td data-sheets-value=""{&quot;1&quot;:2,&quot;2&quot;:&quot;500W&quot;}"">500W</td>\n</tr>\n<tr>\n<td data-sheets-value=""{&quot;1&quot;:2,&quot;2&quot;:&quot;Dimensions&quot;}""><strong>Dimensions</strong></td>\n<td data-sheets-value=""{&quot;1&quot;:2,&quot;2&quot;:&quot;515×420×160mm(W×D×H)&quot;}"">515×420×160mm(W×D×H)</td>\n</tr>\n<tr>\n<td data-sheets-value=""{&quot;1&quot;:2,&quot;2&quot;:&quot;Weight&quot;}""><strong>Weight</strong></td>\n<td data-sheets-value=""{&quot;1&quot;:2,&quot;2&quot;:&quot;9kg&quot;}"">9kg</td>\n</tr>\n</tbody>\n</table>",,,taxable,,1,,,0,0,11,60,50,25,0,,,"1565,20","Laboratory sector > Pathological anatomy > Tissue Flotation",,,https://kalstein.net/en/wp-content/uploads/2022/09/YR452-Kalstein-K-1.jpg,,,,,,,,,0,,,,
53127,simple,,"Automated tissue processor YR431",1,0,visible,"<strong>Manufacturer:</strong> Kalstein\n\n<img class=""alignnone size-full wp-image-22690"" src=""https://kalstein.net/en/wp-content/uploads/2021/11/CE.jpg"" alt="""" width=""54"" height=""53"" />","YR431 Automated Tissue Processor is mainly used in middle laboratories to process specimens to improve the quality sections. The max number of specimens processed is 130 each time. It is popular in the market because of its space saving and simple operation.\n<ul>\n 	<li>Imported high-quality parts, smooth operation, low noise, ergonomic design</li>\n 	<li>Integrated high-quality LCD screen with intuitive bilingual (Chinese/English) software offers a clear display and simple operation; window-scrolling/flipping human-machine conversation interfaceprovides clear instructions for each step (online help)</li>\n 	<li>Fully intelligent design, enabling timely determination and automatic recovery from an abnormal event</li>\n 	<li>Real-time visual simulation with iconsdisplays working status dynamically, clearly and intuitively</li>\n 	<li>Green inner-cycling air purification system to efficiently adsorb and remove poisonous gas; well-sealed gas-effluxion mechanism to effectively improve the operational environment, environmentally-friendly and safe</li>\n 	<li>This system can be automatically started at any timeas programmed</li>\n 	<li>Processing duration is automatically calculated and displayed on the screen, allowing user to make a more efficientwork plan</li>\n 	<li>20 editable programs can be stored in the system</li>\n 	<li>Manual adjustment can be conducted anytime during the programmed automatic operation; afterwards, the system automatically enters the programmed operation</li>\n 	<li>Automated fan control: Stays‘on’ all the time when the specimens are not submerged in cup and 10 seconds every minute when the specimens are submerged in cup and processin</li>\n 	<li>Internal dry heating mechanism with high-precision temperature control</li>\n 	<li>Automatically determines the time of heatingfor energy efficiency</li>\n 	<li>Low-energy-consuming control circuit with power protection function</li>\n 	<li>When a power outage occurs, the screen displays as normal with a scrolling bar demonstrating the ‘on’ status of the power protection system</li>\n 	<li>Battery backup with more than 30 hours of running power</li>\n 	<li>Approximately 130tissue samples can be processed at the same time</li>\n</ul>\n<table dir=""ltr"" border=""1"" cellspacing=""0"" cellpadding=""0""><colgroup> <col width=""264"" /> <col width=""389"" /></colgroup>\n<tbody>\n<tr>\n<td data-sheets-value=""{&quot;1&quot;:2,&quot;2&quot;:&quot;Model&quot;}""><strong>Model</strong></td>\n<td data-sheets-value=""{&quot;1&quot;:2,&quot;2&quot;:&quot;YR431&quot;}"">YR431</td>\n</tr>\n<tr>\n<td data-sheets-value=""{&quot;1&quot;:2,&quot;2&quot;:&quot;Number of Cups&quot;}""><strong>Number of Cups</strong></td>\n<td data-sheets-value=""{&quot;1&quot;:2,&quot;2&quot;:&quot;12 (The 1stto 9th stations for reagents and the 10th to 12th \\nstations for paraffin melting)&quot;}"">12 (The 1stto 9th stations for reagents and the 10th to 12th\nstations for paraffin melting)</td>\n</tr>\n<tr>\n<td data-sheets-value=""{&quot;1&quot;:2,&quot;2&quot;:&quot;Capacity of Each Cup&quot;}""><strong>Capacity of Each Cup</strong></td>\n<td data-sheets-value=""{&quot;1&quot;:2,&quot;2&quot;:&quot;2000 ml&quot;}"">2000 ml</td>\n</tr>\n<tr>\n<td data-sheets-value=""{&quot;1&quot;:2,&quot;2&quot;:&quot;Temperature Range&quot;}""><strong>Temperature Range</strong></td>\n<td data-sheets-value=""{&quot;1&quot;:2,&quot;2&quot;:&quot;RT – 80℃&quot;}"">RT – 80℃</td>\n</tr>\n<tr>\n<td data-sheets-value=""{&quot;1&quot;:2,&quot;2&quot;:&quot;Temperature Control Precisio&quot;}""><strong>Temperature Control Precisio</strong></td>\n<td data-sheets-value=""{&quot;1&quot;:2,&quot;2&quot;:&quot;±1℃&quot;}"">±1℃</td>\n</tr>\n<tr>\n<td data-sheets-value=""{&quot;1&quot;:2,&quot;2&quot;:&quot;Length of Processing Time in the Cup:&quot;}""><strong>Length of Processing Time in the Cup</strong></td>\n<td data-sheets-value=""{&quot;1&quot;:2,&quot;2&quot;:&quot;Any length for the first cup (Extended Time)\\nAny length between 0 and 24 hours for the 2ndto 12th cup&quot;}"">Any length for the first cup (Extended Time)\nAny length between 0 and 24 hours for the 2ndto 12th cup</td>\n</tr>\n<tr>\n<td data-sheets-value=""{&quot;1&quot;:2,&quot;2&quot;:&quot;Dripping Time&quot;}""><strong>Dripping Time</strong></td>\n<td data-sheets-value=""{&quot;1&quot;:2,&quot;2&quot;:&quot;Adjustable between 10s and 60s; shake/drip function above cup&quot;}"">Adjustable between 10s and 60s; shake/drip function above cup</td>\n</tr>\n<tr>\n<td data-sheets-value=""{&quot;1&quot;:2,&quot;2&quot;:&quot;Frequency of Agitation&quot;}""><strong>Frequency of Agitation</strong></td>\n<td data-sheets-value=""{&quot;1&quot;:2,&quot;2&quot;:&quot;Adjustable within 0 – 6 times/minute&quot;}"">Adjustable within 0 – 6 times/minute</td>\n</tr>\n<tr>\n<td data-sheets-value=""{&quot;1&quot;:2,&quot;2&quot;:&quot;Tissue Protection Station&quot;}""><strong>Tissue Protection Station</strong></td>\n<td data-sheets-value=""{&quot;1&quot;:2,&quot;2&quot;:&quot;any station from the 1stto 7th station as preset&quot;}"">any station from the 1stto 7th station as preset</td>\n</tr>\n<tr>\n<td data-sheets-value=""{&quot;1&quot;:2,&quot;2&quot;:&quot;Working Voltage&quot;}""><strong>Working Voltage</strong></td>\n<td data-sheets-value=""{&quot;1&quot;:2,&quot;2&quot;:&quot;AC220V±10% 50Hz (standard model)AC110V±10% 60Hz&quot;}"">AC220V±10% 50Hz (standard model)AC110V±10% 60Hz</td>\n</tr>\n<tr>\n<td data-sheets-value=""{&quot;1&quot;:2,&quot;2&quot;:&quot;Power&quot;}""><strong>Power</strong></td>\n<td data-sheets-value=""{&quot;1&quot;:2,&quot;2&quot;:&quot;500 W&quot;}"">500 W</td>\n</tr>\n<tr>\n<td data-sheets-value=""{&quot;1&quot;:2,&quot;2&quot;:&quot;Dimensions&quot;}""><strong>Dimensions</strong></td>\n<td data-sheets-value=""{&quot;1&quot;:2,&quot;2&quot;:&quot;1170×465×535mm(W×D×H)&quot;}"">1170×465×535mm(W×D×H)</td>\n</tr>\n<tr>\n<td data-sheets-value=""{&quot;1&quot;:2,&quot;2&quot;:&quot;Net weight&quot;}""><strong>Net weight</strong></td>\n<td data-sheets-value=""{&quot;1&quot;:2,&quot;2&quot;:&quot;85kg&quot;}"">85kg</td>\n</tr>\n</tbody>\n</table>",,,taxable,,1,,,0,0,130,132,59,68,0,,,"7801,20","Laboratory sector > Pathological anatomy > Tissue processing",,,https://kalstein.net/en/wp-content/uploads/2022/09/Procesador-de-tejidos-YR431-3-1.jpg,,,,,,,,,0,,,,
