ID,Type,SKU,Name,Published,"Is featured?","Visibility in catalog","Short description",Description,"Date sale price starts","Date sale price ends","Tax status","Tax class","In stock?",Stock,"Low stock amount","Backorders allowed?","Sold individually?","Weight (kg)","Length (cm)","Width (cm)","Height (cm)","Allow customer reviews?","Purchase note","Sale price","Regular price",Categories,Tags,"Shipping class",Images,"Download limit","Download expiry days",Parent,"Grouped products",Upsells,Cross-sells,"External URL","Button text",Position,"Attribute 1 name","Attribute 1 value(s)","Attribute 1 visible","Attribute 1 global"
37362,simple,,"Vortex Mixer YR05761",1,0,visible,"<strong>Manufacturer</strong>: <em>Kalstein</em>\n\n<img class=""alignnone size-full wp-image-29188"" src=""https://kalstein.net/en/wp-content/uploads/2022/01/CE.jpg"" alt="""" width=""54"" height=""53"" />","YR05761  plate vortex mixer is best solution for shaking 96 well micro plate and other small size testing tube, centrifuge tube and pcr strip, etc. Applications in cell and molecular biology, microbiology and immunology, etc.\n<h6>Features</h6>\n<ul>\n 	<li>Intelligent controller for speed and timer;</li>\n 	<li>Adopt permanent magnet rotor, with over-temperature protection, ensure long time working</li>\n 	<li>Brushless motor, noiseless and maintenance-free;</li>\n 	<li>Two operation mode ""touching"" and ""continuous"", easy to switch</li>\n 	<li>Can automaticly identify various clamps quickly and ensure safe using;</li>\n</ul>\n<h6>Technical Specifications</h6>\n<table width=""575"">\n<tbody>\n<tr>\n<td width=""199""><strong>Model </strong></td>\n<td width=""376""><strong>YR05761</strong></td>\n</tr>\n<tr>\n<td><strong>Input Power </strong></td>\n<td>AC100-250V /50/60Hz</td>\n</tr>\n<tr>\n<td><strong>Outout Power </strong></td>\n<td>18W</td>\n</tr>\n<tr>\n<td><strong>Drive Mode </strong></td>\n<td>DC24V brushless motor</td>\n</tr>\n<tr>\n<td><strong>Control Mode </strong></td>\n<td>PWM steolessly variable frequencv</td>\n</tr>\n<tr>\n<td><strong>Operation Mode </strong></td>\n<td>""jog"", ""continuous""</td>\n</tr>\n<tr>\n<td><strong>Power Fuse </strong></td>\n<td>PPTC Resettable Fuses /no reolacement</td>\n</tr>\n<tr>\n<td><strong>Maximum Load </strong></td>\n<td>1.5Kg</td>\n</tr>\n<tr>\n<td><strong>Speed Range </strong></td>\n<td>0/200-3000r/min.</td>\n</tr>\n<tr>\n<td><strong>Oscillation Mode </strong></td>\n<td>Circumference</td>\n</tr>\n<tr>\n<td><strong>Circle diameter </strong></td>\n<td>4.5mm</td>\n</tr>\n<tr>\n<td><strong>Fixture Identification function </strong></td>\n<td>Automatic identification/ Safe and efficient</td>\n</tr>\n<tr>\n<td><strong>Speed function /showing </strong></td>\n<td>Full digital / bright LED display</td>\n</tr>\n<tr>\n<td><strong>Timing function /showing </strong></td>\n<td>Soeed timing function /showing Digital timing 15-999min</td>\n</tr>\n<tr>\n<td><strong>DimensionlLxWxH)</strong></td>\n<td>countdown ""jog"""" timing / bright LED disolav</td>\n</tr>\n<tr>\n<td><strong>Weight </strong></td>\n<td>198x138x67mm</td>\n</tr>\n<tr>\n<td><strong>The noise for Maximum speed </strong></td>\n<td>4.1kg</td>\n</tr>\n<tr>\n<td><strong>Maximum acceleration </strong></td>\n<td>≤3s</td>\n</tr>\n<tr>\n<td><strong>Maximum deceleration </strong></td>\n<td>≤3s</td>\n</tr>\n<tr>\n<td width=""199""><strong>Ambient temoerature / </strong>\n<strong>relative humidity</strong></td>\n<td>5-40°C / 80 %</td>\n</tr>\n<tr>\n<td><strong>Protection grade </strong></td>\n<td>IP21</td>\n</tr>\n<tr>\n<td><strong>Testing standard </strong></td>\n<td>EN 61010-1,EN 61010-2-020,EN 61326-1,EN 61010-3-2/A2</td>\n</tr>\n</tbody>\n</table>",,,taxable,,1,,,0,0,8.00,34,40,47,0,,,"336,60","Laboratory sector > Shakers",,,https://kalstein.net/en/wp-content/uploads/2022/08/YR05761-IMG.png,,,,,,,,,0,,,,
37363,simple,,"Roller Mixer YR05762",1,0,visible,"<strong>Manufacturer</strong>: <em>Kalstein</em>\n\n<img class=""alignnone size-full wp-image-29188"" src=""https://kalstein.net/en/wp-content/uploads/2022/01/CE.jpg"" alt="""" width=""54"" height=""53"" />","YR05762 digital roller mixer provides a gentle but highly efficient rocking and rolling motions, ideal for mixing blood samples, viscous sub­stances and liquidsolid suspensions. Used in a variety applications, prevention of blood coaqulation and immune precipitation etc.\n<h6>Features</h6>\n<ul>\n 	<li>Rocking and rolling motions for complete mixing Display show the speed and time</li>\n 	<li>Speed range of 10-99rpm</li>\n 	<li>Seven roller design with small footprint and easy clean Digital setting speed and time</li>\n</ul>\n<h6>Technical Specifications</h6>\n<table width=""344"">\n<tbody>\n<tr>\n<td width=""158""><strong>Model </strong></td>\n<td width=""186""><strong>YR05762</strong></td>\n</tr>\n<tr>\n<td><strong>Speed</strong></td>\n<td> Adjustable, 10-99rpm ±10%</td>\n</tr>\n<tr>\n<td><strong>Motion </strong></td>\n<td> Simultaneous roll &amp; tilt± 5%</td>\n</tr>\n<tr>\n<td><strong>Operating Temperature </strong></td>\n<td>4°C - 40°C</td>\n</tr>\n<tr>\n<td><strong>Electrical</strong></td>\n<td>80-230V, 50-60Hz, 50W</td>\n</tr>\n</tbody>\n</table>",,,taxable,,1,,,0,0,4,30,50,30,0,,,"306,90","Laboratory sector > Shakers",,,https://kalstein.net/en/wp-content/uploads/2022/08/YR05762-IMG.png,,,,,,,,,0,,,,
37365,simple,,"Rotation Shaker YR05764",1,0,visible,"<strong>Manufacturer</strong>: <em>Kalstein</em>\n\n<img class=""alignnone size-full wp-image-29188"" src=""https://kalstein.net/en/wp-content/uploads/2022/01/CE.jpg"" alt="""" width=""54"" height=""53"" />","Rotation Shaker YR05764 is a combination of variable speed rotator, advanced multiple tube vortex in one machine , it accept tubes from 0.2ml to 50ml ,ail kinds of tube holder can be assembled discretionary in one rack. The mixer can be used in ambient temperatures from +4 to 65°( , ma king it ideal for a variety of laboratory settings such as Molecular Biology ,Biochemistry ,Clinical and Histochemistry . Small enough to fit on a crowded bench .the mixer is easily moved where it is needed the bench . cold room ,incubator or biological hood .\n<h6>Features</h6>\n<ul>\n 	<li>Tube holder assemble discretionary.</li>\n 	<li>Large LCD show the ail the parameter.</li>\n 	<li>2 additional custom programs (6 segments /program) can be created easily) 4.10 different programs for rotation and mixing.</li>\n 	<li>360° rotation and 0-360° discretionary mixing angle is available.</li>\n 	<li>Adjustable speed and time for effective mixing.</li>\n 	<li>Accept tubes from 0.2ml to 50ml.</li>\n 	<li>Can put in freezer or incubator.</li>\n</ul>\n<h6>Technical Specifications</h6>\n<table width=""394"">\n<tbody>\n<tr>\n<td width=""208""><strong>Model </strong></td>\n<td width=""186""><strong>YR05764</strong></td>\n</tr>\n<tr>\n<td><strong>Adaptor </strong></td>\n<td>DC12V, 1000MA</td>\n</tr>\n<tr>\n<td><strong>Rotation speed </strong></td>\n<td>l-99RPM</td>\n</tr>\n<tr>\n<td><strong>Environment temperature </strong></td>\n<td>+4-65°C</td>\n</tr>\n<tr>\n<td><strong>Relative air humidity (at 20°C)% </strong></td>\n<td>up to 60</td>\n</tr>\n</tbody>\n</table>",,,taxable,,1,,,0,0,4.00,24,51,27,0,,,"376,20","Laboratory sector > Shakers",,,https://kalstein.net/en/wp-content/uploads/2022/08/YR05764-IMG.png,,,,,,,,,0,,,,
37366,simple,,"Orbital Shaker  YR05765",1,0,visible,"<strong>Manufacturer</strong>: <em>Kalstein</em>\n\n<img class=""alignnone size-full wp-image-29188"" src=""https://kalstein.net/en/wp-content/uploads/2022/01/CE.jpg"" alt="""" width=""54"" height=""53"" />","<ul>\n 	<li>Using uniaxial drive balancing technology, machine runs smoothly with low noise;</li>\n 	<li>Brushless DC motor, long life, no need maintenance;</li>\n 	<li>Overcurrent protection function, automatically eut off power without affecting other equipment;</li>\n 	<li>Automatic memory function, after starting up, run according to the last setting;</li>\n 	<li>Slow start function to prevent liquid splashing.</li>\n</ul>\n<h6>Technical Specifications</h6>\n<table width=""630"">\n<tbody>\n<tr>\n<td width=""228""><strong>Model</strong></td>\n<td width=""402""><strong>YR05765</strong></td>\n</tr>\n<tr>\n<td><strong>Shake Model </strong></td>\n<td>convolution / reciprocation</td>\n</tr>\n<tr>\n<td><strong>Cyclotron Frequencv Range</strong></td>\n<td>40-300rpm</td>\n</tr>\n<tr>\n<td><strong>Frequencv sensitivitv (rpm) </strong></td>\n<td>±1</td>\n</tr>\n<tr>\n<td><strong>Orbit Diameter (mm) </strong></td>\n<td>Ø26</td>\n</tr>\n<tr>\n<td><strong>Standard capacitv </strong></td>\n<td>9x250ml</td>\n</tr>\n<tr>\n<td><strong>Size of Platform(mm) </strong></td>\n<td>330 x 280</td>\n</tr>\n<tr>\n<td width=""228""><strong>Timing range </strong>\n<strong>(continuous available) </strong></td>\n<td>0-990m</td>\n</tr>\n<tr>\n<td><strong>Number of platform </strong></td>\n<td>1</td>\n</tr>\n<tr>\n<td><strong>Outside dimension /W•D•H) (mm) </strong></td>\n<td>350 x 330 x 230</td>\n</tr>\n<tr>\n<td><strong>Power (w)</strong></td>\n<td>300</td>\n</tr>\n<tr>\n<td><strong>Power Supply</strong></td>\n<td>AC220V+10% 50-60HZ</td>\n</tr>\n<tr>\n<td><strong>Optional</strong></td>\n<td>Double laver, max capacitv will be double of standard capacitv</td>\n</tr>\n<tr>\n<td colspan=""2""><strong>Max capacity for conical / erlenmeyer flask</strong></td>\n</tr>\n<tr>\n<td><strong>50ml </strong></td>\n<td>20</td>\n</tr>\n<tr>\n<td><strong>100ml </strong></td>\n<td>16</td>\n</tr>\n<tr>\n<td><strong>250ml </strong></td>\n<td>9</td>\n</tr>\n<tr>\n<td><strong>300ml </strong></td>\n<td>8</td>\n</tr>\n<tr>\n<td><strong>500ml </strong></td>\n<td>6</td>\n</tr>\n<tr>\n<td><strong>1L</strong></td>\n<td>3</td>\n</tr>\n<tr>\n<td><strong>2L </strong></td>\n<td>/</td>\n</tr>\n</tbody>\n</table>",,,taxable,,1,,,0,0,20,42,42,25,0,,,"595,30","Laboratory sector > Shakers",,,https://kalstein.net/en/wp-content/uploads/2022/08/YR05765-IMG.png,,,,,,,,,0,,,,
37367,variable,,"Orbital Shaker YR05766 // YR05768",1,0,visible,"<strong>Manufacturer</strong>: <em>Kalstein</em>\n\n<img class=""alignnone size-full wp-image-29188"" src=""https://kalstein.net/en/wp-content/uploads/2022/01/CE.jpg"" alt="""" width=""54"" height=""53"" />","<ul>\n 	<li>Using uniaxial drive balancing technology, machine runs smoothly with low noise;</li>\n 	<li>Brushless DC motor, long life, no need maintenance;</li>\n 	<li>Overcurrent protection function, automatically eut off power without affecting other equipment;</li>\n 	<li>Automatic memory function, after starting up, run according to the last setting;</li>\n 	<li>Slow start function to prevent liquid splashing.</li>\n</ul>\n<strong>Technical Specifications</strong>\n<table width=""717"">\n<tbody>\n<tr>\n<td width=""228""><strong>Model </strong></td>\n<td width=""179""><strong>YR05766</strong></td>\n<td width=""124""><strong>YR05767</strong></td>\n<td width=""186""><strong>YR05768</strong></td>\n</tr>\n<tr>\n<td><strong>Shaking</strong> <strong>Mode </strong></td>\n<td> orbital/ convolution</td>\n<td>rocking</td>\n<td>wavina / three dimensional</td>\n</tr>\n<tr>\n<td><strong>Control</strong></td>\n<td colspan=""3"">Microcomouter PID contral</td>\n</tr>\n<tr>\n<td><strong>Display</strong></td>\n<td colspan=""3""> LED diqital display</td>\n</tr>\n<tr>\n<td><strong>Amplitude</strong></td>\n<td>Ø30</td>\n<td>25mm</td>\n<td>3-15°(manual)</td>\n</tr>\n<tr>\n<td><strong>Frequency (rpm/min)</strong></td>\n<td>15-240</td>\n<td colspan=""2"">15-90</td>\n</tr>\n<tr>\n<td><strong>Sensitivity (rpm)</strong></td>\n<td colspan=""3"">±2</td>\n</tr>\n<tr>\n<td width=""228""><strong>Timmer</strong></td>\n<td colspan=""3"">0-99hours59minutes</td>\n</tr>\n<tr>\n<td><strong>Tray Size (mm)</strong></td>\n<td colspan=""3"">320x265</td>\n</tr>\n<tr>\n<td><strong>Tray Number</strong></td>\n<td colspan=""3"">1</td>\n</tr>\n<tr>\n<td><strong>Overall Size (mm)</strong></td>\n<td>330x480x160</td>\n<td>330x480x220</td>\n<td> 330x480x180</td>\n</tr>\n<tr>\n<td><strong>Power</strong></td>\n<td colspan=""3"">30W</td>\n</tr>\n<tr>\n<td><strong>Power Supply</strong></td>\n<td colspan=""3"">AC 90-260V, 50-60HZ</td>\n</tr>\n<tr>\n<td><strong>Ambient Temperature</strong></td>\n<td colspan=""3"">-10 °C-65 °C</td>\n</tr>\n</tbody>\n</table>\n&nbsp;",,,taxable,,1,,,0,0,8,39.5,46,30,0,,,,"Laboratory sector > Shakers",,,https://kalstein.net/en/wp-content/uploads/2022/08/YR05766-YR05768-IMG.png,,,,,,,,,0,Model,"YR05766, YR05767, YR05768",1,1
37368,variable,,"Decoloration Shaker YR05794 // YR05801",1,0,visible,"<div class=""woocommerce-product-details__short-description"">\n<div class=""woocommerce-product-details__short-description"">\n\n<strong>Manufacturer</strong>: <em>Kalstein</em>\n\n<img class=""alignnone size-full wp-image-29188"" src=""https://kalstein.net/en/wp-content/uploads/2022/01/CE.jpg"" alt="""" width=""54"" height=""53"" />\n\n</div>\n</div>","<ul>\n 	<li>LED digital display can show the setting parameters directly.</li>\n 	<li>The instrument adopt de motor, use microcomputer to contrai speed, to achieve high accuracy, and not affected by voltage fluctuations.</li>\n 	<li>The instrument is designed with low speed start, avoiding sudden high speed may cause liquid spilt.</li>\n 	<li>The instrument can automatically operate according to the original settings after power gel normal from sudden eut off.</li>\n 	<li>The instrument can realize fault self-diagnosis by sound and light to prompt the fault location.</li>\n 	<li>Each parameter value can be modified in real lime under running state.</li>\n 	<li>When overloaded, the instrument will automatically stop, ensuring the life and safety of the instrument.</li>\n 	<li>Wide voltage range, can be used in the range of AC90-260v.</li>\n</ul>\n<h6>Technical Specifications</h6>\n<table width=""905"">\n<tbody>\n<tr>\n<td width=""148"">Model</td>\n<td width=""94"">YR05794</td>\n<td width=""94"">YR05795</td>\n<td width=""94"">YR05796</td>\n<td width=""94"">YR05797</td>\n<td width=""97"">YR05798</td>\n<td width=""94"">YR05799</td>\n<td width=""96"">YR05800</td>\n<td width=""94"">YR05801</td>\n</tr>\n<tr>\n<td>shaking mode</td>\n<td colspan=""2"">orbital/\n\nconvolution</td>\n<td colspan=""2"">liner /\n\nreciprocation</td>\n<td colspan=""2"">Rocking</td>\n<td colspan=""2"">waving /\n\nthree dimensional</td>\n</tr>\n<tr>\n<td>control</td>\n<td colspan=""8"">Microcomouter PID control</td>\n</tr>\n<tr>\n<td width=""148"">displav</td>\n<td colspan=""8"">LED diqital display</td>\n</tr>\n<tr>\n<td>amplitude</td>\n<td>Ø30</td>\n<td></td>\n<td>30mm</td>\n<td></td>\n<td>25mm</td>\n<td></td>\n<td>3-15°/manual</td>\n<td></td>\n</tr>\n<tr>\n<td>frequency (rpm/min)</td>\n<td colspan=""4"">15-240</td>\n<td colspan=""4"">15-90</td>\n</tr>\n<tr>\n<td>sensitivity (rpm)</td>\n<td colspan=""8"">+2</td>\n</tr>\n<tr>\n<td>timmer</td>\n<td colspan=""8"">0-99hours\n\n59minutes</td>\n</tr>\n<tr>\n<td>trav size(mm)</td>\n<td>250x\n\n230</td>\n<td>320x\n\n265</td>\n<td>250x\n\n230</td>\n<td>320x\n\n265</td>\n<td>250x\n\n230</td>\n<td>320x\n\n265</td>\n<td>250x\n\n230</td>\n<td>320x\n\n265</td>\n</tr>\n<tr>\n<td>tray number</td>\n<td colspan=""8"">1</td>\n</tr>\n<tr>\n<td>overall size/mm)</td>\n<td>270x295x\n\n160</td>\n<td>330x480x\n\n160</td>\n<td>270x295x\n\n160</td>\n<td>330x480x\n\n160</td>\n<td> 270x295x\n\n170</td>\n<td>330x480x\n\n220</td>\n<td>270x295x\n\n170</td>\n<td>330x480x\n\n180</td>\n</tr>\n<tr>\n<td>Power</td>\n<td colspan=""8"">30W</td>\n</tr>\n<tr>\n<td width=""148"">power supply</td>\n<td colspan=""8"">AC 90-260V, 50-60HZ</td>\n</tr>\n<tr>\n<td>ambient temperature</td>\n<td colspan=""8"">-10 °C-65 °C</td>\n</tr>\n</tbody>\n</table>",,,taxable,,1,,,0,0,8,46,39.5,30,0,,,,"Laboratory sector > Shakers",,,https://kalstein.net/en/wp-content/uploads/2022/09/YR05794-IMG.png,,,,,,,,,0,Model,"YR05794, YR05795, YR05796, YR05797, YR05798, YR05799, YR05800, YR05801",1,1
52921,simple,,"YR05119 Chemistry &amp; Immunoassay Analyzer for Seminal Plasma",1,0,visible,"<strong>Manufacturer</strong>: <em>Kalstein</em>\n\n<img class=""alignnone size-full wp-image-29188"" src=""https://kalstein.net/en/wp-content/uploads/2022/01/CE.jpg"" alt="""" width=""54"" height=""53"" />","<ul>\n 	<li>Chemistry and immunoassay test for seminal plasma</li>\n 	<li>Built-in computer, Windows system, operate by mouse and keyboard</li>\n 	<li>8-channel fiber spectroscopy system</li>\n 	<li>Inner incubator, temperature precision : ≤ ± 0.3℃</li>\n 	<li>Printer: external printer, A4 paper report</li>\n</ul>\n<h6>Technical Specifications</h6>\n<table width=""928"">\n<tbody>\n<tr>\n<td width=""148""><strong>Model</strong></td>\n<td width=""780""><strong>YR05119</strong></td>\n</tr>\n<tr>\n<td width=""148""><strong>Item</strong></td>\n<td width=""780"">parameters</td>\n</tr>\n<tr>\n<td width=""148""><strong>Test mode</strong></td>\n<td width=""780"">Kinetic, End point, Two point</td>\n</tr>\n<tr>\n<td width=""148""><strong>Wavelengths</strong></td>\n<td width=""780"">7wavelength,340, 405, 450, 492, 505, 560 and 630nm, single or double wavelength test</td>\n</tr>\n<tr>\n<td width=""148""><strong>Absorbance range</strong></td>\n<td width=""780"">0~4.000 Abs</td>\n</tr>\n<tr>\n<td width=""148""><strong>Channel difference</strong></td>\n<td width=""780"">≤ ±0.015Abs</td>\n</tr>\n<tr>\n<td width=""148""><strong>Light source,</strong></td>\n<td width=""780"">High light LED, life more than 100,000 hours</td>\n</tr>\n<tr>\n<td width=""148""><strong>Test items</strong></td>\n<td width=""780"">Frutose, Zn, Citric, ACP, a-NAG, Acrosin,Elastase,etc.</td>\n</tr>\n</tbody>\n</table>",,,taxable,,1,,,0,0,16,60,38,51,0,,,"22374,00","Laboratory sector > Analyzers > Semen Analyzer",,,https://kalstein.net/en/wp-content/uploads/2022/10/YR05119-IMG.jpg,,,,,,,,,0,,,,
53112,simple,,"Slide Dryer (Oven) YR453",1,0,visible,"<span class=""col-xs-9 marca""><strong>Manufacturer:</strong> Kalstein</span>\n<div class=""col-xs-3 text-center logo_ce""><img title="" Certificacion europea "" src=""https://kalstein.eu/templates/kalstein/images//CE.jpg"" alt=""Certificacion europea"" width=""54"" height=""53"" border=""0"" /></div>","High-quality hot plate with keyboard control, microcomputer automatic memory and digital tube display. This model offers great advantages such as improving your workflow by providing high-quality performance in your laboratory workspace. We know that in every histology laboratory the sectioning process is very important. That is why you must have this high-end device. The convenience this slide dryer brings you when it comes to the assembly process is like no other.\n<ul>\n 	<li>Quick heating, long lifespan, and energy-saving, due to the use of a new-type heating element</li>\n 	<li>Both actual and preset temperatures are displayed</li>\n 	<li>Automatic memory and restoration functions: After startup, all preset temperature data are automatically stored in the system</li>\n 	<li>Special black surface material characterized by its strong resistance to abrasion and corrosion</li>\n</ul>\n<table dir=""ltr"" border=""1"" cellspacing=""0"" cellpadding=""0""><colgroup> <col width=""246"" /> <col width=""352"" /></colgroup>\n<tbody>\n<tr>\n<td data-sheets-value=""{&quot;1&quot;:2,&quot;2&quot;:&quot;Model&quot;}""><strong>Model</strong></td>\n<td data-sheets-value=""{&quot;1&quot;:2,&quot;2&quot;:&quot;YR453&quot;}"">YR453</td>\n</tr>\n<tr>\n<td data-sheets-value=""{&quot;1&quot;:2,&quot;2&quot;:&quot;Temperature Range&quot;}""><strong>Temperature Range</strong></td>\n<td data-sheets-value=""{&quot;1&quot;:2,&quot;2&quot;:&quot;continuously adjusted in a range of RT \\nto 90℃ and maintained automatically;&quot;}"">continuously adjusted in a range of RT\nto 90℃ and maintained automatically;</td>\n</tr>\n<tr>\n<td data-sheets-value=""{&quot;1&quot;:2,&quot;2&quot;:&quot;Temperature Control Precision&quot;}""><strong>Temperature Control Precision</strong></td>\n<td data-sheets-value=""{&quot;1&quot;:2,&quot;2&quot;:&quot;±1℃&quot;}"">±1℃</td>\n</tr>\n<tr>\n<td data-sheets-value=""{&quot;1&quot;:2,&quot;2&quot;:&quot;Suitable Environmental Temperature&quot;}""><strong>Suitable Environmental Temperature</strong></td>\n<td data-sheets-value=""{&quot;1&quot;:2,&quot;2&quot;:&quot;0 – 40℃&quot;}"">0 – 40℃</td>\n</tr>\n<tr>\n<td data-sheets-value=""{&quot;1&quot;:2,&quot;2&quot;:&quot;Working Voltage&quot;}""><strong>Working Voltage</strong></td>\n<td data-sheets-value=""{&quot;1&quot;:2,&quot;2&quot;:&quot;AC 220V±10% 50Hz (standard model); AC110V±10% 60Hz&quot;}"">AC 220V±10% 50Hz (standard model); AC110V±10% 60Hz</td>\n</tr>\n<tr>\n<td data-sheets-value=""{&quot;1&quot;:2,&quot;2&quot;:&quot;Power&quot;}""><strong>Power</strong></td>\n<td data-sheets-value=""{&quot;1&quot;:2,&quot;2&quot;:&quot;200W&quot;}"">200W</td>\n</tr>\n<tr>\n<td data-sheets-value=""{&quot;1&quot;:2,&quot;2&quot;:&quot;Dimensions&quot;}""><strong>Dimensions</strong></td>\n<td data-sheets-value=""{&quot;1&quot;:2,&quot;2&quot;:&quot;360×350×120mm(W×D×H)&quot;}"">360×350×120mm(W×D×H)</td>\n</tr>\n<tr>\n<td data-sheets-value=""{&quot;1&quot;:2,&quot;2&quot;:&quot;Net weight&quot;}""><strong>Net weight</strong></td>\n<td data-sheets-value=""{&quot;1&quot;:2,&quot;2&quot;:&quot;5kg&quot;}"">5kg</td>\n</tr>\n</tbody>\n</table>\n&nbsp;",,,taxable,,1,,,0,0,7,41,41,19,0,,,"712,80","Laboratory sector > Pathological anatomy > Slide warmers",,,https://kalstein.net/en/wp-content/uploads/2022/09/YR453-Kalstein-K-1.jpg,,,,,,,,,0,,,,
53131,simple,,"Slide Dryer (Oven) - YR455",1,0,visible,"<strong>Manufacturer:</strong> Kalstein\n\n<img class=""alignnone size-full wp-image-22690"" src=""https://kalstein.net/en/wp-content/uploads/2021/11/CE.jpg"" alt="""" width=""54"" height=""53"" />","High-quality hot plate with keyboard control, microcomputer automatic memory and digital tube display.\n<ul>\n 	<li>Quick heating, long lifespan, and energy-saving, due to the use of a new-type heating element</li>\n 	<li>Both actual and preset temperatures are displayed</li>\n 	<li>Automatic memory and restoration functions: After startup, all preset temperature data are automatically stored in the system</li>\n 	<li>Special black surface material characterized by its strong resistance to abrasion and corrosion</li>\n</ul>\n<table dir=""ltr"" border=""1"" cellspacing=""0"" cellpadding=""0""><colgroup> <col width=""299"" /> <col width=""352"" /></colgroup>\n<tbody>\n<tr>\n<td data-sheets-value=""{&quot;1&quot;:2,&quot;2&quot;:&quot;Model&quot;}""><strong>Model</strong></td>\n<td data-sheets-value=""{&quot;1&quot;:2,&quot;2&quot;:&quot;YR455&quot;}"">YR455</td>\n</tr>\n<tr>\n<td data-sheets-value=""{&quot;1&quot;:2,&quot;2&quot;:&quot;Temperature Range&quot;}""><strong>Temperature Range</strong></td>\n<td data-sheets-value=""{&quot;1&quot;:2,&quot;2&quot;:&quot;continuously adjusted in a range of RT \\nto 90℃ and maintained automatically;&quot;}"">continuously adjusted in a range of RT\nto 90℃ and maintained automatically;</td>\n</tr>\n<tr>\n<td data-sheets-value=""{&quot;1&quot;:2,&quot;2&quot;:&quot;Temperature Control Precision&quot;}""><strong>Temperature Control Precision</strong></td>\n<td data-sheets-value=""{&quot;1&quot;:2,&quot;2&quot;:&quot;±1℃&quot;}"">±1℃</td>\n</tr>\n<tr>\n<td data-sheets-value=""{&quot;1&quot;:2,&quot;2&quot;:&quot;Suitable Environmental Temperature&quot;}""><strong>Suitable Environmental Temperature</strong></td>\n<td data-sheets-value=""{&quot;1&quot;:2,&quot;2&quot;:&quot;0 – 40℃&quot;}"">0 – 40℃</td>\n</tr>\n<tr>\n<td data-sheets-value=""{&quot;1&quot;:2,&quot;2&quot;:&quot;Working Voltage&quot;}""><strong>Working Voltage</strong></td>\n<td data-sheets-value=""{&quot;1&quot;:2,&quot;2&quot;:&quot;AC 220V±10% 50Hz (standard model); AC110V±10% 60Hz&quot;}"">AC 220V±10% 50Hz (standard model); AC110V±10% 60Hz</td>\n</tr>\n<tr>\n<td data-sheets-value=""{&quot;1&quot;:2,&quot;2&quot;:&quot;Power&quot;}""><strong>Power</strong></td>\n<td data-sheets-value=""{&quot;1&quot;:2,&quot;2&quot;:&quot;200W&quot;}"">200W</td>\n</tr>\n<tr>\n<td data-sheets-value=""{&quot;1&quot;:2,&quot;2&quot;:&quot;Dimensions&quot;}""><strong>Dimensions</strong></td>\n<td data-sheets-value=""{&quot;1&quot;:2,&quot;2&quot;:&quot;360×350×135mm(W×D×H)&quot;}"">360×350×135mm(W×D×H)</td>\n</tr>\n<tr>\n<td data-sheets-value=""{&quot;1&quot;:2,&quot;2&quot;:&quot;Net weight&quot;}""><strong>Net weight</strong></td>\n<td data-sheets-value=""{&quot;1&quot;:2,&quot;2&quot;:&quot;6kg&quot;}"">6kg</td>\n</tr>\n</tbody>\n</table>",,,taxable,,1,,,0,0,9,41,41,19,0,,,"1306,80","Laboratory sector > Pathological anatomy > Slide warmers",,,https://kalstein.net/en/wp-content/uploads/2022/09/YR455-Kalstein-K-1.jpg,,,,,,,,,0,,,,
