53197,simple,,"Inclusion Center YR439-1",1,0,visible,"<strong>Manufacturer:</strong> Kalstein\n\n<img class=""alignnone size-full wp-image-7597"" src=""https://www.kalstein.ee/wp-content/uploads/2020/01/CE.jpg"" alt="""" width=""54"" height=""53"" />\n\n&nbsp;","<ul>\n 	<li>Imported OLED module display, clear writing, you can clearly observe the display data from any angle</li>\n 	<li>The interface layout is reasonable, the working status icon is displayed and the button LED indicates, the working status is clear at a glance</li>\n 	<li>Full automatic program control by computer, can be preset to turn on and off at any time every week</li>\n 	<li>The integrated temperature measurement block imported from the United States has high precision and reliable performance.</li>\n 	<li>Independent seven channel PID temperature control, do not affect each other</li>\n 	<li>Using a new type of flexible heating element, rapid heating, uniform heating, energy saving and reliable</li>\n 	<li>Double overheat protection device; safe and reliable</li>\n 	<li>With memory and automatic recall functions, the preset temperature is automatically retained after operation</li>\n 	<li>Two modes of operation, manual mode to start and stop immediately, automatic mode with power off memory, call auto power function</li>\n 	<li>The left and right boxes are enlarged, suitable for all kinds of dewatering baskets. The inner and outer boxes are separate design, which is convenient to take out and change the wax and maintain.</li>\n 	<li>Enlarged tweezer storage table, large and small tweezers can be placed, unique diversion groove design to prevent paraffin overflow</li>\n 	<li>Large workbench design with wax block repair device, multi-functional use</li>\n 	<li>Equipped with universal metal hose magnifier, users can be adjusted according to their needs, suitable for the organization and operation of very small samples.</li>\n 	<li>Imported semiconductor random small cold table, instant cooling, convenient for rapid sample positioning and embedding, and improve work efficiency</li>\n 	<li>Large capacity wax bath to ensure mass tissue inlay can be completed in one go</li>\n 	<li>The cold light source low-voltage lighting system adopts imported CPU constant current independent control, and the brightness is continuously adjusted without flickering</li>\n 	<li>The lighting adopts the universal metal hose design, the lighting angle can be adjusted arbitrarily, and it is more convenient to observe the tissue samples.</li>\n 	<li>Imported valve adjusts the flow rate of the wax nozzle, suitable for various tissue inlay treatments</li>\n 	<li>Soft touch automatic switch, dual control flow wax design foot switch, two ways to choose at will</li>\n 	<li>Perfect wax flow system design, automatic wax outlet, precise position and convenient inlay operation</li>\n</ul>\n<h6>Technical Description</h6>\n<table dir=""ltr"" border=""1"" cellspacing=""0"" cellpadding=""0"">\n<tbody>\n<tr>\n<td data-sheets-value=""{&quot;1&quot;:2,&quot;2&quot;:&quot;Modelo&quot;}""><strong>Model</strong></td>\n<td data-sheets-value=""{&quot;1&quot;:2,&quot;2&quot;:&quot;YR439-1&quot;}"">YR439-1</td>\n</tr>\n<tr>\n<td data-sheets-value=""{&quot;1&quot;:2,&quot;2&quot;:&quot;◆ Capacidad de la cámara de parafina:&quot;}""><strong>Paraffin Chamber Capacity</strong></td>\n<td data-sheets-value=""{&quot;1&quot;:2,&quot;2&quot;:&quot;≥6 litros&quot;}"">≥6 liters</td>\n</tr>\n<tr>\n<td data-sheets-value=""{&quot;1&quot;:2,&quot;2&quot;:&quot;◆ Rangos de temperatura:&quot;}""><strong>Temperature ranges</strong></td>\n<td data-sheets-value=""{&quot;1&quot;:2,&quot;2&quot;:&quot;RT - 85 ℃:&quot;}"">RT - 85 ℃:</td>\n</tr>\n<tr>\n<td data-sheets-value=""{&quot;1&quot;:2,&quot;2&quot;:&quot;◆ Precisión del control de temperatura:&quot;}""><strong>Temperature control precision</strong></td>\n<td data-sheets-value=""{&quot;1&quot;:2,&quot;2&quot;:&quot;± 1%&quot;}"">± 1%</td>\n</tr>\n<tr>\n<td data-sheets-value=""{&quot;1&quot;:2,&quot;2&quot;:&quot;◆ Control de flujo de parafina:&quot;}""><strong>Paraffin flow control</strong></td>\n<td data-sheets-value=""{&quot;1&quot;:2,&quot;2&quot;:&quot;Control de flujo de parafina a través de la placa táctil y \\nel pedal opcional&quot;}"">Paraffin flow control via touch plate and\noptional pedal</td>\n</tr>\n<tr>\n<td colspan=""2"" rowspan=""1"" data-sheets-value=""{&quot;1&quot;:2,&quot;2&quot;:&quot;◆ El control de ENCENDIDO / APAGADO totalmente programable permite el inicio y la parada automáticos \\ndel sistema en cualquier momento semanal&quot;}""><strong>Fully programmable ON / OFF control allows automatic start and stop</strong>\n<strong>from the system at any time weekly</strong></td>\n</tr>\n<tr>\n<td data-sheets-value=""{&quot;1&quot;:2,&quot;2&quot;:&quot;◆ Dimensiones de la cámara de parafina (BMIV):&quot;}""><strong>Paraffin Chamber Dimensions (BMIV)</strong></td>\n<td data-sheets-value=""{&quot;1&quot;:2,&quot;2&quot;:&quot;495 × 132 × 95 mm (ancho x profundidad x altura)&quot;}"">495 × 132 × 95 mm (width x depth x height)</td>\n</tr>\n<tr>\n<td data-sheets-value=""{&quot;1&quot;:2,&quot;2&quot;:&quot;◆ Dimensiones de la cámara térmica (cada una de las dos):&quot;}""><strong>Thermal camera dimensions (each)</strong></td>\n<td data-sheets-value=""{&quot;1&quot;:2,&quot;2&quot;:&quot;240 × 160 × 50 mm (ancho x profundidad x altura)&quot;}"">240 × 160 × 50mm (width x depth x height)</td>\n</tr>\n<tr>\n<td data-sheets-value=""{&quot;1&quot;:2,&quot;2&quot;:&quot;◆ Área de trabajo del módulo de incrustación:&quot;}""><strong>Keying module workspace</strong></td>\n<td data-sheets-value=""{&quot;1&quot;:2,&quot;2&quot;:&quot;540 mm × 93 mm&quot;}"">540 mm × 93 mm</td>\n</tr>\n<tr>\n<td data-sheets-value=""{&quot;1&quot;:2,&quot;2&quot;:&quot;◆ Dimensiones de la placa fría pequeña:&quot;}""><strong>Small cold plate dimensions</strong></td>\n<td data-sheets-value=""{&quot;1&quot;:2,&quot;2&quot;:&quot;60 × 50 mm&quot;}"">60 × 50 mm</td>\n</tr>\n<tr>\n<td data-sheets-value=""{&quot;1&quot;:2,&quot;2&quot;:&quot;◆ Voltaje de funcionamiento:&quot;}""><strong>Operating voltage</strong></td>\n<td data-sheets-value=""{&quot;1&quot;:2,&quot;2&quot;:&quot;CA 220V ± 10% 50Hz (modelo estándar); AC110V ± 10% 60Hz&quot;}"">AC 220V ± 10% 50Hz (standard model); AC110V ± 10% 60Hz</td>\n</tr>\n<tr>\n<td data-sheets-value=""{&quot;1&quot;:2,&quot;2&quot;:&quot;◆ Poder:&quot;}""><strong>Power</strong></td>\n<td data-sheets-value=""{&quot;1&quot;:2,&quot;2&quot;:&quot;1000W (KD-BMⅣ)&quot;}"">1000W</td>\n</tr>\n<tr>\n<td data-sheets-value=""{&quot;1&quot;:2,&quot;2&quot;:&quot;◆ Dimensiones:&quot;}""><strong>Dimensions</strong></td>\n<td data-sheets-value=""{&quot;1&quot;:2,&quot;2&quot;:&quot;670×575×395mm(W x D x H) (KD-BMⅣ)&quot;}"">670×575×395mm(W x D x H)</td>\n</tr>\n<tr>\n<td data-sheets-value=""{&quot;1&quot;:2,&quot;2&quot;:&quot;◆ Peso neto:&quot;}""><strong>Net weight</strong></td>\n<td data-sheets-value=""{&quot;1&quot;:2,&quot;2&quot;:&quot;38.5kg (KD-BMⅣ)&quot;}"">38.5kg</td>\n</tr>\n</tbody>\n</table>",,,taxable,,1,,,0,0,64,78,70,55,0,,,"4059,00","Laboratory sector > Pathological anatomy > Tissue Embedding System",,,https://kalstein.net/en/wp-content/uploads/2022/09/YR439-1-IMG.jpg,,,,,,,,,0,,,,
53198,simple,,"YR440B Biological Tissue Freezer",1,0,visible,"<strong>Manufacturer</strong>: <em>Kalstein</em>\n\n<img class=""alignnone size-full wp-image-7597"" src=""https://www.kalstein.ee/wp-content/uploads/2020/01/CE.jpg"" alt="""" width=""54"" height=""53"" />","<ul>\n 	<li>Use imported original compressors and use environmentally friendly fluorine-free refrigerants. Low noise and superior cooling effect</li>\n 	<li>Imported pure green digital module displays the real-time temperature and the working status is clear at a glance</li>\n 	<li>The compressor has a delay protection function, stable performance and long service life.</li>\n 	<li>With super cooling mode and temperature control mode, high temperature control precision</li>\n 	<li>The cooling temperature in the temperature control mode can be adjusted, set the appropriate temperature to achieve the ideal freezing effect</li>\n 	<li>Advanced production technology, rapid cooling, even distribution of cooling on the work surface</li>\n 	<li>The countertop is made of special varnish for baking, which is resistant to low temperatures, does not freeze or crack, has a smooth surface and is easy to clean in ice cubes.</li>\n 	<li>This machine can be used in line with the inlay machine, with automatic change machine function, and can also be used independently</li>\n</ul>\n<h6>Technical Presentation</h6>\n<table dir=""ltr"" border=""1"" cellspacing=""0"" cellpadding=""0""><colgroup> <col width=""274"" /> <col width=""430"" /></colgroup>\n<tbody>\n<tr>\n<td data-sheets-value=""{&quot;1&quot;:2,&quot;2&quot;:&quot;Modelo&quot;}""><strong>Model</strong></td>\n<td data-sheets-value=""{&quot;1&quot;:2,&quot;2&quot;:&quot;YR440B&quot;}"">YR440B</td>\n</tr>\n<tr>\n<td data-sheets-value=""{&quot;1&quot;:2,&quot;2&quot;:&quot;Temperature Ranges of Cryo Module&quot;}""><strong>Cryogenic Module Temperature Ranges</strong></td>\n<td data-sheets-value=""{&quot;1&quot;:2,&quot;2&quot;:&quot;0 to -20℃&quot;}"">0 to -20℃</td>\n</tr>\n<tr>\n<td data-sheets-value=""{&quot;1&quot;:2,&quot;2&quot;:&quot;Temperature setting of Cryo Module&quot;}""><strong>Cryogenic module temperature setting</strong></td>\n<td data-sheets-value=""{&quot;1&quot;:2,&quot;2&quot;:&quot;the optimal working temperature is approximately -10℃,\\n and the temperature is under delay protection&quot;}"">The optimal working temperature is about -10 ℃,\nand the temperature is under delay protection</td>\n</tr>\n<tr>\n<td data-sheets-value=""{&quot;1&quot;:2,&quot;2&quot;:&quot;Dimensions of Cryo Module&quot;}""><strong>Cryogenic Module Dimensions</strong></td>\n<td data-sheets-value=""{&quot;1&quot;:2,&quot;2&quot;:&quot;315×380 mm&quot;}"">315×380 mm</td>\n</tr>\n<tr>\n<td data-sheets-value=""{&quot;1&quot;:2,&quot;2&quot;:&quot;Working Voltage&quot;}""><strong>Working voltage</strong></td>\n<td data-sheets-value=""{&quot;1&quot;:2,&quot;2&quot;:&quot;AC 220V±10% 50Hz (standard model); AC110V±10% 60Hz&quot;}"">AC 220V±10% 50Hz (standard model); AC110V±10% 60Hz</td>\n</tr>\n<tr>\n<td data-sheets-value=""{&quot;1&quot;:2,&quot;2&quot;:&quot;Power&quot;}""><strong>Can</strong></td>\n<td data-sheets-value=""{&quot;1&quot;:2,&quot;2&quot;:&quot;300W&quot;}"">300W</td>\n</tr>\n<tr>\n<td data-sheets-value=""{&quot;1&quot;:2,&quot;2&quot;:&quot;Dimensions&quot;}""><strong>Dimensions</strong></td>\n<td data-sheets-value=""{&quot;1&quot;:2,&quot;2&quot;:&quot;710×350×390mm (W×D×H)&quot;}"">710×350×390mm (W×D×H)</td>\n</tr>\n<tr>\n<td data-sheets-value=""{&quot;1&quot;:2,&quot;2&quot;:&quot;Net weight&quot;}""><strong>Net weight</strong></td>\n<td data-sheets-value=""{&quot;1&quot;:2,&quot;2&quot;:&quot;25kg&quot;}"">25kg</td>\n</tr>\n</tbody>\n</table>",,,taxable,,1,,,0,0,45,79.5,48,58,0,,,"2178,00","Laboratory sector > Pathological anatomy > Tissue Embedding System",,,https://kalstein.net/en/wp-content/uploads/2022/09/YR440B-IMG.jpg,,,,,,,,,0,,,,
53199,simple,,"Biological tissue freeze embedding machine {6 liters, with cooling plate} YR448",1,0,visible,"<strong>Manufacturer</strong>: <em>Kalstein</em>\n\n<img class=""alignnone size-full wp-image-7597"" src=""https://www.kalstein.ee/wp-content/uploads/2020/01/CE.jpg"" alt="""" width=""54"" height=""53"" />","<ul>\n 	<li>Imported OLED module display, clear writing, you can clearly observe the display data from any angle</li>\n 	<li>The interface layout is reasonable, the working status icon is displayed, the button LED indicates, the working status is clear at a glance</li>\n 	<li>Full automatic program control by computer, can be preset to turn on and off at any time every week</li>\n 	<li>The integrated temperature measurement block imported from the United States has high precision and reliable performance. Independent seven channel PID temperature control, do not affect each other</li>\n 	<li>Using a new type of flexible heating element, rapid heating, uniform heating, energy saving and reliable</li>\n 	<li>Double overheat protection device; safe and reliable</li>\n 	<li>With memory and automatic recall functions, the preset temperature is automatically retained after operation</li>\n 	<li>Two modes of operation, manual mode to start and stop immediately, automatic mode with power off memory, call auto power function</li>\n 	<li>The appearance is novel, split design, inlay machine, freezer, free combination</li>\n 	<li>The left and right boxes are enlarged, suitable for all kinds of dehydration baskets, the inner and outer boxes are separate design, which is convenient to take out and change the wax and keep</li>\n 	<li>Enlarged forceps storage platform, large and small forceps can be placed, unique diversion groove design to prevent paraffin overflow</li>\n 	<li>Large workbench design with wax block repair device, multi-functional use</li>\n 	<li>Equipped with universal metal hose magnifier, users can adjust by themselves according to their needs, suitable for the organization and operation of very small samples.</li>\n 	<li>The cooling station adopts the original imported compressor and the imported environmentally friendly fluorine-free refrigerant, which has superior cooling effect</li>\n 	<li>The freezer has super cool mode and temperature control mode; high temperature control precision</li>\n 	<li>Imported semiconductor random small cold table, instant cooling, convenient for rapid sample positioning and embedding, and improve work efficiency</li>\n 	<li>Large capacity wax bath to ensure massive tissue inlay can be completed in one go</li>\n 	<li>The cold light source low-voltage lighting system adopts imported CPU constant current independent control, and the brightness is continuously adjusted without flickering</li>\n 	<li>The lighting adopts the universal metal hose design, the lighting angle can be adjusted arbitrarily, and it is more convenient to observe the tissue samples.</li>\n 	<li>The imported valve adjusts the flow rate of the wax nozzle, which is suitable for various tissue inlay treatments</li>\n 	<li>Automatic soft touch switch and foot switch dual control flow wax design, two ways are free to choose</li>\n 	<li>Perfect wax flow system design, automatic wax discharge, precise position and convenient inlay operation</li>\n 	<li>It is equipped with a controlled power outlet socket to realize the control of the on and off timing of other equipment such as the freezing station and the machine at the same time</li>\n</ul>\n<h6>Technical description</h6>\n<table dir=""ltr"" border=""1"" cellspacing=""0"" cellpadding=""0""><colgroup> <col width=""258"" /> <col width=""430"" /></colgroup>\n<tbody>\n<tr>\n<td data-sheets-value=""{&quot;1&quot;:2,&quot;2&quot;:&quot;Modelo&quot;}""><strong>Model</strong></td>\n<td data-sheets-value=""{&quot;1&quot;:2,&quot;2&quot;:&quot;YR448&quot;}"">YR448</td>\n</tr>\n<tr>\n<td data-sheets-value=""{&quot;1&quot;:2,&quot;2&quot;:&quot;Rangos de temperatura del módulo Cryo&quot;}""><strong>Cryo module temperature ranges</strong></td>\n<td data-sheets-value=""{&quot;1&quot;:2,&quot;2&quot;:&quot;0 a -20 C&quot;}"">0 a -20 C</td>\n</tr>\n<tr>\n<td data-sheets-value=""{&quot;1&quot;:2,&quot;2&quot;:&quot;Ajuste de temperatura del módulo Cryo&quot;}""><strong>Cryo module temperature setting</strong></td>\n<td data-sheets-value=""{&quot;1&quot;:2,&quot;2&quot;:&quot;la temperatura de trabajo óptima es \\nde aproximadamente -10 C, y la temperatura \\nestá bajo protección de retardo&quot;}"">The optimal working temperature is\nabout -10 C, and the temperature\nis under delay protection</td>\n</tr>\n<tr>\n<td data-sheets-value=""{&quot;1&quot;:2,&quot;2&quot;:&quot;Dimensiones del módulo Cryo&quot;}""><strong>Cryo module dimensions</strong></td>\n<td data-sheets-value=""{&quot;1&quot;:2,&quot;2&quot;:&quot;315×380 mm.&quot;}"">315×380 mm.</td>\n</tr>\n<tr>\n<td data-sheets-value=""{&quot;1&quot;:2,&quot;2&quot;:&quot;Voltaje de trabajo&quot;}""><strong>Working voltage</strong></td>\n<td data-sheets-value=""{&quot;1&quot;:2,&quot;2&quot;:&quot;CA 220V +/- 10% 50Hz (modelo estándar); AC110V +/- 10% 60Hz&quot;}"">\n<div>\n<div>CA 220V +/- 10% 50Hz (Standard Model); AC110V +/- 10% 60Hz</div>\n</div></td>\n</tr>\n<tr>\n<td data-sheets-value=""{&quot;1&quot;:2,&quot;2&quot;:&quot;Potencia&quot;}""><strong>Power</strong></td>\n<td data-sheets-value=""{&quot;1&quot;:2,&quot;2&quot;:&quot;300W&quot;}"">300W</td>\n</tr>\n<tr>\n<td data-sheets-value=""{&quot;1&quot;:2,&quot;2&quot;:&quot;Dimensiones&quot;}""><strong>Dimensions</strong></td>\n<td data-sheets-value=""{&quot;1&quot;:2,&quot;2&quot;:&quot;710x350x390mm (WxDxH)&quot;}"">710x350x390mm (WxDxH)</td>\n</tr>\n<tr>\n<td data-sheets-value=""{&quot;1&quot;:2,&quot;2&quot;:&quot;Peso neto&quot;}""><strong>Net Weight</strong></td>\n<td data-sheets-value=""{&quot;1&quot;:2,&quot;2&quot;:&quot;25kg&quot;}"">25kg</td>\n</tr>\n</tbody>\n</table>",,,taxable,,1,,,0,0,116,85,123,71,0,,,"6327,00","Laboratory sector > Pathological anatomy > Tissue Embedding System",,,https://kalstein.net/en/wp-content/uploads/2022/09/YR448-IMG.jpg,,,,,,,,,0,Measure,"Cooling Plate: 70 * 45 * 53, Inclusion Machine: 67 * 63 * 52",1,1
53274,simple,,"Floatation Workstation  (Water Bath/slide dryer) YR456",1,0,visible,"<strong>Manufacturer</strong>: <em>Kalstein</em>\n\n<img class=""alignnone size-full wp-image-29784"" src=""https://kalstein.net/en/wp-content/uploads/2022/04/CE.jpg"" alt="""" width=""54"" height=""53"" />","<ul>\n 	<li style=""font-weight: 400""><span style=""font-weight: 400"">Pure-green digital screen for real-time monitoring of heating temperature, direct and clear, easy to operate; all parameters including preset temperatures, working temperatures, and wording status are real-time displayed</span></li>\n 	<li style=""font-weight: 400""><span style=""font-weight: 400"">Temperature is automatically program-controlled by single-chip microprocessors </span></li>\n 	<li style=""font-weight: 400""><span style=""font-weight: 400"">This device features multiple functions and its easy setting operation can meet the needs of different users;</span></li>\n 	<li style=""font-weight: 400""><span style=""font-weight: 400"">Two independent heating tank with DC low-voltage illuminating system and removable transparent heating dish: easy operation and convenient observation</span></li>\n 	<li style=""font-weight: 400""><span style=""font-weight: 400"">New heating mechanism using a new-type high-thermal-conductivity heating element provides even and quick heating: </span> <span style=""font-weight: 400"">PID-controlled, Triple temperature controls, long lifespan, safe, reliable and energy-saving</span></li>\n 	<li style=""font-weight: 400""><span style=""font-weight: 400"">Temperature is precisely measured by temperature-sensing integrated blocks made in USA, and all settings are automatically stored in the system</span></li>\n 	<li style=""font-weight: 400""><span style=""font-weight: 400"">Special temperature-control and monitoring system characterized by strong resistance to abrasion and corrosion to ensure temperature precise;</span></li>\n 	<li style=""font-weight: 400""><span style=""font-weight: 400"">Automatic memory and restoration functions: After startup, all preset temperature data are automatically stored in the system</span></li>\n 	<li style=""font-weight: 400""><span style=""font-weight: 400"">Temperatures for floating and drying slides are individually controlled.</span></li>\n</ul>\n<h6>Technical Specifications</h6>\n<table width=""614"">\n<tbody>\n<tr>\n<td width=""255""><strong>Model</strong></td>\n<td width=""359""><strong>YR456</strong></td>\n</tr>\n<tr>\n<td width=""255""><strong>Left Temperature range of water bath</strong></td>\n<td width=""359"">RT - 70℃; automatically maintained</td>\n</tr>\n<tr>\n<td><strong>Right Temperature range of water bath</strong></td>\n<td> RT - 70℃; automatically maintained</td>\n</tr>\n<tr>\n<td width=""255""><strong>Temperature range of slide dryer</strong></td>\n<td> RT - 100℃; automatically maintained</td>\n</tr>\n<tr>\n<td width=""255""><strong>Automatic memory and restoration functions</strong></td>\n<td width=""359""> After startup, all preset temperature data\nare automatically stored in the system.</td>\n</tr>\n<tr>\n<td width=""255""><strong>Temperature Control Precision</strong></td>\n<td>±2℃</td>\n</tr>\n<tr>\n<td width=""255""><strong>Dimensions of water bath dish</strong></td>\n<td> 155×155×55mm(W×D×H)</td>\n</tr>\n<tr>\n<td width=""255""><strong>Dimensions of drying station(32pcs slides)</strong></td>\n<td>405×130mm(W×D×H)</td>\n</tr>\n<tr>\n<td width=""255""><strong>Working Voltage</strong></td>\n<td> AC 220V±10% 50Hz (standard model); AC110V±10% 60Hz</td>\n</tr>\n<tr>\n<td width=""255""><strong>Power</strong></td>\n<td> 600W</td>\n</tr>\n<tr>\n<td width=""255""><strong>Dimensions</strong></td>\n<td width=""359"">475×460×175 mm (W×D×H)</td>\n</tr>\n<tr>\n<td width=""255""><strong>Net weight</strong></td>\n<td>10kg</td>\n</tr>\n</tbody>\n</table>",,,taxable,,1,,,0,0,9.3,53,47,23.5,0,,,"2574,00","Laboratory sector > Pathological anatomy > Tissue Flotation",,,https://kalstein.net/en/wp-content/uploads/2022/09/YR456-IMG-2.png,,,,,,,,,0,,,,
53275,simple,,"Flotation Water Bath (Water Bath/slide dryer) YR457",1,0,visible,"<strong>Manufacturer</strong>: <em>Kalstein</em>\n\n<img class=""alignnone size-full wp-image-29784"" src=""https://kalstein.net/en/wp-content/uploads/2022/04/CE.jpg"" alt="""" width=""54"" height=""53"" />","<ul>\n 	<li>Pure-green digital screen for real-time monitoring of heating temperature, direct and clear, easy to operate; all parameters including preset temperatures, working temperatures, and wording status are real-time displayed</li>\n 	<li>Temperature is automatically program-controlled by single-chip microprocessors</li>\n 	<li>This device features multiple functions and its easy setting operation can meet the needs of different users</li>\n 	<li>DC low-voltage illuminating system and removable transparent heating dish: easy operation and convenient observation</li>\n 	<li>New heating mechanism using a new-type high-thermal-conductivity heating element provides even and quick heating: PID-controlled, Triple temperature controls, long lifespan, safe, reliable and energy-saving</li>\n 	<li>Temperature is precisely measured by temperature-sensing integrated blocks made in USA, and all settings are automatically stored in the system</li>\n 	<li>Special temperature-control and monitoring system characterized by strong resistance to abrasion and corrosion to ensure temperature precise</li>\n 	<li>Automatic memory and restoration functions: After startup, all preset temperature data are automatically stored in the system</li>\n 	<li>Temperatures for floating and drying slides are individually controlled</li>\n</ul>\n<h6>Technical Specifications</h6>\n<table width=""451"">\n<tbody>\n<tr>\n<td width=""214""><strong>Model</strong></td>\n<td width=""237""><strong>YR457</strong></td>\n</tr>\n<tr>\n<td width=""214""><strong>Temperature range of water bath</strong></td>\n<td>RT - 70℃; automatically maintained</td>\n</tr>\n<tr>\n<td><strong>Temperature range of slide dryer</strong></td>\n<td>RT - 100℃; automatically maintained</td>\n</tr>\n<tr>\n<td width=""214""><strong>Automatic memory and restoration functions</strong></td>\n<td width=""237""> After startup, all preset temperature\ndata are automatically stored in the system.</td>\n</tr>\n<tr>\n<td><strong>Temperature Control Precision</strong></td>\n<td>±2℃</td>\n</tr>\n<tr>\n<td><strong>Dimensions of water bath dish</strong></td>\n<td> 210×170×60mm(W×D×H)</td>\n</tr>\n<tr>\n<td width=""214""><strong>Dimensions of drying station(50pcs slides)</strong></td>\n<td width=""237"">250×108mm(W×D×H)</td>\n</tr>\n<tr>\n<td width=""214"">Working Voltage</td>\n<td>AC 220V±10% 50Hz (standard model)</td>\n</tr>\n<tr>\n<td><strong>Power</strong></td>\n<td>400W</td>\n</tr>\n<tr>\n<td width=""214""><strong>Dimensions</strong></td>\n<td>460×310×135 mm (W×D×H)</td>\n</tr>\n<tr>\n<td width=""214""><strong>Net weight</strong></td>\n<td>6kg</td>\n</tr>\n</tbody>\n</table>",,,taxable,,1,,,0,0,13,57,41,31,0,,,"1871,10","Laboratory sector > Pathological anatomy > Tissue Flotation",,,https://kalstein.net/en/wp-content/uploads/2022/09/YR457-IMG-1.png,,,,,,,,,0,,,,
54542,variation,,"Thermostatic Magnetic Stirring Bath YR02311 // YR02312 - YR02311",1,0,visible,,,,,taxable,parent,1,,,0,0,7,35,34,30,0,,,"6672,60",,,,,,,id:27461,,,,,,1,Model,YR02311,,1
54543,variation,,"Thermostatic Magnetic Stirring Bath YR02311 // YR02312 - YR02312",1,0,visible,,,,,taxable,parent,1,,,0,0,7,36,33,32,0,,,"7524,00",,,,,,,id:27461,,,,,,2,Model,YR02312,,1
